name_english,name_japanese,show_type,episodes,status,aired,broadcast_time,producers,licensors,studios,source,genres,episode_length,rating,score_and_scorers,members,favorites,description
Hatenkou Yugi,破天荒遊戯,TV,10,Finished Airing,"Jan 5, 2008 to Mar 8, 2008",Saturdays at 02 30 (JST),"Frontier Works, Sotsu",Sentai Filmworks,Studio Deen,Manga,"Adventure, Comedy, Drama, Romance, Fantasy, Josei",24 min. per ep.,PG-13,"7.17, 14094",33217,192,"""See the world""

With these words, Rahzel, the daughter of a rich family, is kicked out of her house and sent on her journey. Along the way she meets up with Heat and Alzeid, two men with very different personalities but very similar journeys. Rahzel is a clever, stubborn, and confident girl, who, with the powers of her magic and mind helps the people she runs into on her journey to discover the world. "
,劇場版 ハイスクール・フリート,Movie,1,Finished Airing,"Jan 18, 2020",,Aniplex,add some,A-1 Pictures,Original,"Action, Military, School",1 hr. 43 min.,PG-13,"7.17, 476",9020,32,No synopsis information has been added to this title. Help improve our database by adding a synopsis here.
High School of the Dead,学園黙示録 HIGHSCHOOL OF THE DEAD,TV,12,Finished Airing,"Jul 5, 2010 to Sep 20, 2010",Mondays at 11 30 (JST),"Geneon Universal Entertainment, AT-X, Showgate",Sentai Filmworks,Madhouse,Manga,"Action, Horror, Supernatural, Ecchi, Shounen",24 min. per ep.,R+,"7.17, 665358",1056549,9433,"It happened suddenly: The dead began to rise and Japan was thrown into total chaos. As these monsters begin terrorizing a high school, Takashi Kimuro is forced to kill his best friend when he gets bitten and joins the ranks of the walking dead. Vowing to protect Rei Miyamoto, the girlfriend of the man he just executed, they narrowly escape their death trap of a school, only to be greeted with a society that has already fallen.

Soon, Takashi and Rei band together with other students on a journey to find their family members and uncover what caused this overwhelming pandemic. Joining them is Saeko Busujima, the beautiful president of the Kendo Club; Kouta Hirano, an otaku with a fetish for firearms; Saya Takagi, the daughter of an influential politician; and Shizuka Marikawa, their hot school nurse. But will the combined strength of these individuals be enough to conquer this undead apocalypse?

[Written by MAL Rewrite]"
Maria the Virgin Witch,純潔のマリア,TV,12,Finished Airing,"Jan 11, 2015 to Mar 29, 2015",Sundays at 22 30 (JST),"Bandai Visual, Lantis, Kodansha, I Will",Funimation,Production I.G,Manga,"Comedy, Historical, Magic, Romance, Fantasy, Seinen",24 min. per ep.,R,"7.17, 53238",126226,218,"Maria is a powerful young witch living with her two familiars in medieval France during the Hundred Years' War against England. As the war rages on and the innocent get caught in its destruction, Maria becomes fed up with the situation and begins using her magic to try and prevent further conflict in hopes of maintaining peace. However, her constant intervention soon attracts the attention of the heavens, and the archangel Michael is sent to keep her from meddling in human affairs. The divine being confronts Maria, and he forbids her from using her powers, issuing a decree that her magic will be taken if she loses her virginity. Though she is now labeled a heretic, Maria adamantly refuses to heed Michael's warning and continues to disrupt the war between the two nations. But as the Church begins plotting to take away the witch's power and put a stop to Maria's interference once and for all, her peacemaking may soon come to an end.

[Written by MAL Rewrite]"
"Eureka Seven - good night, sleep tight, young lovers",交響詩篇エウレカセブン ポケットが虹でいっぱい,Movie,1,Finished Airing,"Apr 25, 2009",,add some,"Funimation, Bandai Entertainment","Bones, Kinema Citrus",Original,"Adventure, Mecha, Romance, Sci-Fi",1 hr. 55 min.,PG-13,"7.17, 20962",41252,119,"Renton, son of scientists, and Eureka, a girl who can't live under the sun, are raised together when very young and become very attached to each other. One day, Eureka is taken away. Powerless at the time, Renton vows to rescue her. He enters the military and is soon is assigned to the Independent Youths Unit 303 of the First Mobile Forces thanks to his exceptional performance alongside his Nirvash, a bio-mechanical armor/control system. Unknown to Renton, lies a plot to extinguish the alien invasion that is currently happening involving not only him, but Eureka too. 

(Source: ANN)"
Kurokami The Animation,黒神 The Animation,TV,23,Finished Airing,"Jan 9, 2009 to Jun 19, 2009",Fridays at 02 40 (JST),"Bandai Visual, TV Asahi, Square Enix","Bandai Entertainment, Sentai Filmworks, NYAV Post",Sunrise,Manga,"Action, Super Power, Martial Arts, Seinen",23 min. per ep.,R,"7.17, 37476",104677,324,"High school student Ibuki Keita has been haunted by misfortune for as long as he can remember. For no apparent reason, everyone around him dies tragically. Ultimately, he refuses to become too close to anyone, even his childhood friend Akane. This leaves Keita alone in a life full of misery and disgrace.

While eating at his favorite ramen shop one evening, Keita meets a strange young girl named Kuro. Possessing abilities that surpass that of a normal human being, Kuro classifies herself as a Mototsumitama. She explains to Keita about ""Terra,"" a life-energy force split between three identical looking people; a global phenomenon dubbed the ""Doppeliner System."" As a Mototsumitama, Kuro guards the ""Coexistence Equilibrium,"" the beings that protect the flow of Terra around the world. Keita refuses to believe her story, until he is caught up in the crossfire of this hidden world. On the verge of death, he makes a contract with Kuro, unbeknownst to its true meaning. Now he is bound to Kuro, and must be with her at all times. Could Keita's misfortune possibly get any greater?

[Written by MAL Rewrite]"
Lupin III Missed by a Dollar,ルパン三世 1$マネーウォーズ,Special,1,Finished Airing,"Jul 28, 2000",,"VAP, Tohokushinsha Film Corporation",Funimation,TMS Entertainment,Unknown,"Action, Adventure, Mystery, Comedy, Seinen",1 hr. 30 min.,PG-13,"7.17, 2009",5116,2,"Lupin & co. compete with a greedy bank president and her goons to solve the mystery leading to a broach, a treasure said to be behind the success of history's most powerful rulers. 

(Source: ANN)"
Unbreakable Machine-Doll,機巧少女〈マシンドール〉は傷つかない,TV,12,Finished Airing,"Oct 7, 2013 to Dec 23, 2013",Mondays at 20 30 (JST),"Genco, Media Factory, Kadokawa Shoten, Movic, AT-X, Showgate",Funimation,Lerche,Light novel,"Action, Ecchi, Fantasy, School",23 min. per ep.,R+,"7.17, 122631",253935,646,"The Walpurgis Royal Academy of Machinart was founded alongside the development of ""Machinart,"" machine magic capable of giving life and intelligence to mechanical dolls subsequently called as ""automaton."" Its aim: train skilled puppeteers to control the automatons, as militaries across the globe have begun incorporating Machinart into their armies.

After miserably failing the academy's entrance exams, Raishin Akabane and his humanoid automaton Yaya must defeat one of the top one hundred students to earn the right to take part in the Evening Party, a fight for supremacy between puppeteers using their automatons. The last one standing is bestowed the title of ""Wiseman"" and granted access to the powerful forbidden arts.

Thus, Raishin challenges Charlotte Belew and her automaton Sigmund to a duel, but before they even begin, Sigmund is attacked by other students. After saving his opponents from their assaulters, Raishin cancels the duel but is forced to search for a new way to gain access to the Party. Driven by the tragedies of his past, Raishin fights alongside Yaya to rise to the top and claim the title of Wiseman.

[Written by MAL Rewrite]"
Bodacious Space Pirates,モーレツ宇宙海賊,TV,26,Finished Airing,"Jan 8, 2012 to Jul 1, 2012",Sundays at 00 30 (JST),"Starchild Records, Magic Capsule",Sentai Filmworks,Satelight,Light novel,"Sci-Fi, Space",24 min. per ep.,PG-13,"7.17, 22306",64879,278,"The story centers around a spirited high school girl named Marika. She keeps herself busy with the space yacht club and her part-time job at a high-class retro café. One day, two strangers suddenly appear and claim to be subordinates of her dead father. They demand that she assume command of the space pirate ship Bentenmaru. A privateer ship's compact was made during a war of independence a century ago, and according to that compact, the ship must be inherited by the captain's next direct descendant. Marika finds herself embarking on a new life as a space pirate."
The Seven Deadly Sins Signs of Holy War,七つの大罪 聖戦の予兆,TV,4,Finished Airing,"Aug 28, 2016 to Sep 18, 2016",Sundays at 17 00 (JST),"Aniplex, Dentsu, Kodansha, Movic",add some,A-1 Pictures,Manga,"Action, Adventure, Ecchi, Fantasy, Magic, Shounen, Supernatural",24 min. per ep.,PG-13,"7.17, 237943",418432,698,"The Seven Deadly Sins, along with Elizabeth Liones and Hawk, have won the Kingdom of Leones back from the Holy Knights. At long last, it's their time to indulge in the peaceful lives they fought for. From inedible meat pies, overdue battles, unexpected stalkers, and the butterflies of first love, the Sins are accompanied by their friends in their carefree, fun-filled time together. However, the calm is broken with the premonition of a new threat, bringing upon the signs of Holy War and threatening to shatter the peace of the Sins' easygoing days.

[Written by MAL Rewrite]"
A Day Before Us (Season Zero),A Day Before Us,ONA,19,Finished Airing,"May 10, 2018 to Aug 2, 2019",,add some,add some,"LICO, Red Dog Culture House",Original,Romance,3 min. per ep.,PG-13,"7.16, 492",1557,5,"A Day Before Us is an animated Korean drama of a special and sweet love story of the following four main characters; Yeo Reum, Ha Eun, Kim Wook, and Yeon Woo.

(Source: AniDB)"
,アクセル・ワールド EX,OVA,2,Finished Airing,"Sep 13, 2012 to Jan 31, 2013",,add some,add some,Sunrise,Light novel,"Action, Game, Sci-Fi, Romance, School",24 min. per ep.,PG-13,"7.16, 51233",97331,109,"OVA bundled with the Accel World simulation and action games. The Blu-ray OVA discs came with the PS3 limited edition versions and the DVD with the PSP limited edition versions.

The project was split into two PSP and PS3 titles, and one episode was released with each game:
#EX01: Reverberation;Zankyou (bundled with Stage:01 Ginyoku no Kakusei)
#EX02: Vacation;Onsen (bundled with Stage:02 Kasoku no Chouten)"
Flowers of Evil,惡の華,TV,13,Finished Airing,"Apr 5, 2013 to Jun 30, 2013",Unknown,"Starchild Records, Animax, Kodansha, KlockWorx, GANSIS",Sentai Filmworks,Zexcs,Manga,"Psychological, Drama, Romance, School, Shounen",24 min. per ep.,R,"7.16, 54700",155249,2367,"Kasuga Takao is a boy who loves reading books, particularly Baudelaire's Les Fleurs du Mal. A girl at his school, Saeki Nanako, is his muse and his Venus, and he admires her from a distance. One day, he forgets his copy of Les Fleurs du Mal in the classroom and runs back alone to pick it up. In the classroom, he finds not only his book, but Saeki's gym uniform. On a mad impulse, he steals it.

Now everyone knows ""some pervert"" stole Saeki's uniform, and Kasuga is dying with shame and guilt. Furthermore, the weird, creepy, and friendless girl of the class, Nakamura, saw him take the uniform. Instead of revealing it was him, she recognizes his kindred deviant spirit and uses her knowledge to take control of his life. Will it be possible for Kasuga to get closer to Saeki, despite Nakamura's meddling and his dark secret? What exactly does Nakamura intend to do with him?

(Source: MangaHelpers)"
,あの日見た花の名前を僕達はまだ知らない。「めんまへの手紙」,Special,1,Finished Airing,"Feb 22, 2012",,add some,add some,A-1 Pictures,Original,"Comedy, Drama",12 min.,PG-13,"7.16, 4187",15125,21,Special Picture Drama episode included on the Anohana Fes. Memorial DVD/Blu-ray Box
,青の祓魔師 OVA,OVA,2,Finished Airing,"Apr 4, 2017 to Oct 4, 2017",,add some,add some,A-1 Pictures,Manga,"Action, Demons, Supernatural, Fantasy, Shounen",24 min. per ep.,PG-13,"7.16, 17604",52368,70,"Bundled with the 19th and 20th volumes of the Ao no Exorcist manga.

The first episode is based on the second chapter of the second Ao no Exorcist novel Home Sweet Home.

The second episode is based on the title chapter from the Ao no Exorcist: Spy Game novel."
