name_english,name_japanese,show_type,episodes,status,aired,broadcast_time,producers,licensors,studios,source,genres,episode_length,rating,score_and_scorers,members,favorites,description
Tico and Friends,七つの海のティコ,TV,39,Finished Airing,"Jan 16, 1994 to Dec 18, 1994",Sundays at 19 30 (JST),add some,add some,Nippon Animation,Original,"Slice of Life, Adventure",23 min. per ep.,G,"7.41, 1485",4145,15,"Nanami Simpson is a young girl. Her mother dies when she is young, and she goes to live with her father, Scott Simpson, on board a marine research vessel, the Peperonchino. Her father is a marine biologist, and he is in search of a creature known as the glowing whale. When he finds the bones of one of these, he is saddened, and resolves to change his mission toward preserving and caring for the creatures. Nanami befriends an Orca which she names Tico, and she goes swimming with it every day. Eventually, she learns to breathe underwater which astounds her father. Nanami nearly drowns one day, and one of the glowing whales saves her from certain death and returns her to the vessel, where her father finally gets to see it.

(Source: ANN)"
,NARUTO×UT,OVA,1,Finished Airing,"Jan 1, 2011",,add some,add some,Studio Pierrot,Manga,"Action, Comedy, Super Power, Martial Arts, Shounen",6 min.,PG-13,"7.41, 19166",38635,116,"All-new animation offered throughout UNIQLO clothing stores in Japan on January 1, 2011. The DVD contains an exclusive version of Mayonaka Orchestra, by the Japanese rock band Aqua Timez. A limited number of the DVDs was offered as presents to people who bought UNIQLO's Naruto graphic T-shirts online or in their stores.

(Source: ANN, edited)"
,ナルト-NARUTO-疾風伝 サニー・サイド・バトル,Special,1,Finished Airing,"Oct 6, 2013",,add some,add some,Studio Pierrot,Original,"Action, Comedy, Super Power, Martial Arts, Shounen",11 min.,PG-13,"7.41, 20707",39804,114,"A comedy-filled filler with a plot revolving around the two Uchiha Brothers, Mangekyo Sharingan, chickens, and fried eggs."
,あひるの空,TV,50,Finished Airing,"Oct 2, 2019 to Sep 30, 2020",Wednesdays at 17 55 (JST),"TV Tokyo, Kodansha, AT-X, King Records, DMM pictures",Sentai Filmworks,Diomedea,Manga,"Comedy, Sports, Drama, School, Shounen",24 min. per ep.,PG-13,"7.40, 35086",118775,599,"Lacking what is considered the most important asset in basketball, Sora Kurumatani has struggled with his short height since the inception of his love for the game. Despite missing this beneficial aspect, Sora's unwavering drive never allowed his small stature to dictate his ability to play, believing strongly in trying his hardest and persistently practicing to prove his capability.

In hopes of satisfying his mother's wishes, Sora enters Kuzuryuu High School to become a member of the basketball club and compete wholeheartedly in tournaments. However, Sora is disappointed to find out that the boy's basketball team is nothing but a retreat for punks who have no interest in the sport. Sora also comes to learn that brothers Chiaki and Momoharu Hanazono—whom he becomes acquainted with—have also lost their once spirited motivation to play. 

Determined to revive the basketball team, Sora challenges the boys to a match against him, where his quick feet and swift movements overwhelm the group. Gradually affected by Sora's impressive skills, sheer effort, and tireless devotion to basketball, the boys unexpectedly find their burnt-out passion for the game rekindling once again.

[Written by MAL Rewrite]"
Red Riding Hood Chacha,赤ずきんチャチャ,TV,74,Finished Airing,"Jan 7, 1994 to Jun 30, 1995",Fridays at 18 00 (JST),"Nihon Ad Systems, Shueisha",add some,Gallop,Manga,"Adventure, Comedy, Fantasy, Magic, Romance, Shoujo",24 min. per ep.,G,"7.40, 3702",11624,87,"Akazukin Chacha is the story of a young magical girl (Mahō Shōjo) named Chacha. Living with her guardian in a cottage on Mochi-mochi mountain is Seravi, who is her teacher and also the fictional world's greatest magician. Chacha is clumsy in casting her spells because, throughout the anime, when she summons something, it often turns out to be something that she didn't mean to cast, for example, spiders (kumo) instead of a cloud (also kumo). At times in the anime when she and her friends are in trouble, however, her spells do work. Living on the same mountain is a boy gifted with enormous strength named Riiya. It is described that Riiya came from a family of werewolves who can instantly change into a wolf whenever they want. Quite far from Mochi-mochi mountain lies Urizuri mountain. Dorothy, also a well known magician in her land, lives in a castle on Urizuri mountain. Living with her is Shiine, her student. Shiine is adept when it comes to casting spells. He is a young wizard and most of his knowledge about magic was taught to him by Dorothy.

The first 2 seasons were originally created by the anime team. Most of the stories in season 3 are based on the manga.

(Source: Wikipedia)"
AKB0048,AKB0048,TV,13,Finished Airing,"Apr 29, 2012 to Jul 22, 2012",Unknown,"Starchild Records, Magic Capsule, GANSIS",Sentai Filmworks,Satelight,Original,"Music, Sci-Fi",23 min. per ep.,PG-13,"7.40, 23465",53078,677,"After an interplanetary war at the beginning of the 21st century, planet Earth has been left in ruins, with much of its ecosystem completely destroyed. Because it was no longer possible to live a normal life on this planet, the inhabitants are forced to move on to other planets where life will, hopefully, be more comfortable.

The Deep Galactic Trade Organization, a totalitarian government that affects many of the newly inhabited planets, has somehow come to the conclusion that music is a source of evil, and that it must be banned and destroyed for good. The talent group AKB0048 is soon formed, based on the original AKB48 members that once lived on Earth. Even though their music is now considered universally illegal, they make it their mission to bring their music back to life by travelling from one planet to another and holding as many concerts as they possibly can. They must undergo a whole new set of training methods in order to become the best that they can possibly be, while also avoiding the constant danger of being arrested because of their music. Join interplanetary popstars AKB0048 as they try to save the world－with music!"
,ベイビーアイラブユーだぜ,ONA,1,Finished Airing,"Dec 11, 2018",,add some,add some,Bones,Original,"Music, Romance",3 min.,G,"7.40, 2612",4695,13,"Japan-based confectionery company Lotte opened a special site to celebrate the 70th anniversary since its founding in 1948. The centerpiece of the commemorative website is a new animated musical short featuring the song ""Shinesekai"" (New World) by the band Bump of Chicken.

The video centers on a middle school boy-meets-high school girl scenario. They are surrounded by a wide range of characters who are all ""spirits"" of various Lotte snacks, such as a men's singing group representing Ghana chocolate bars and, well, Koalas representing Koala March. 

(Source: ANN) "
Captain Tsubasa,キャプテン翼 (2001),TV,52,Finished Airing,"Oct 7, 2001 to Oct 6, 2002",Unknown,TV Tokyo,add some,"Madhouse, Group TAC",Manga,"Action, Sports, Shounen",24 min. per ep.,PG-13,"7.40, 23953",38769,214,"Tsubasa Oozora loves everything about soccer: the cheer of the crowd, the speed of the ball, the passion of the players, and the excitement that comes from striving to be the best soccer player he can be. His goal is to aim for the World Cup, and to do that, he’s spent countless hours practicing soccer, ever since the moment he could walk on two legs. Now, as he plays for the Barcelona team in a fierce game, it seems as though his dreams are on the verge of coming true.

Captain Tsubasa: Road to 2002 tells the story of how Tsubasa climbed his way through the ranks, featuring his roots in the town of Nankatsu as well as his epic journey to master the art of soccer."
Danganronpa 3 The End of Hope's Peak High School - Future Arc,ダンガンロンパ3 -The End of 希望ヶ峰学園- 未来編,TV,12,Finished Airing,"Jul 11, 2016 to Sep 26, 2016",Mondays at 23 00 (JST),add some,Funimation,Lerche,Game,"Action, Mystery, Horror, Psychological",24 min. per ep.,R,"7.40, 117092",234782,1629,"After Makoto Naegi and his fellow survivors escaped Hope's Peak Academy to the world beyond, they soon join the Future Foundation, an organization dedicated to combating despair. Just when all seems to be looking up, Naegi is arrested and tried for betrayal due to defending a malicious group of Remnants of Despair. Standing before all of the Future Foundation executives, he finds himself, along with Kyouko Kirigiri and Aoi Asahina, facing an unknown fate.

The matter at hand only escalates when the organization's supposedly impenetrable security is hacked into by a
familiar face: Monokuma. Much to Naegi's horror, the mechanical bear immediately announces the beginning of a new killing game, as moments later, the first victim appears as a signal for despair to resume its brutal conquest.

In the conclusion to Danganronpa's gripping tale of hope and despair, Naegi, the Super High School-Level Lucky Student, must once again unravel the mystery as his colleagues and friends begin falling around him. However, there are no more class trials; among the 16 desperate participants, there is only one killer—and their death means the end of this infernal game.

[Written by MAL Rewrite]"
I Can't Understand What My Husband Is Saying,旦那が何を言っているかわからない件,TV,13,Finished Airing,"Oct 3, 2014 to Dec 26, 2014",Fridays at 01 00 (JST),"DAX Production, Dream Creation",add some,Seven,4-koma manga,"Slice of Life, Comedy, Romance, Seinen",3 min. per ep.,PG-13,"7.40, 140507",260241,719,"Though they couldn't be any more different, love has managed to blossom between Hajime Tsunashi, a hardcore otaku who shuts himself in at home while making a living off his blog, and his wife Kaoru—a hard-working office lady who, in contrast, is fairly ordinary, albeit somewhat of a crazy drunk. As this unlikely couple discovers, love is much more than just a first kiss or a wedding; the years that come afterward in the journey of marriage brings with it many joys as well as challenges.

Whether due to their quirky personalities or the peculiar people surrounding them, Hajime and Kaoru find themselves caught up in a variety of baffling and ridiculous antics. But despite the struggles they face, the love that ties them together spurs them to move forward and strive to become better people in order to bring their partner happiness.

[Written by MAL Rewrite]"
I Can't Understand What My Husband Is Saying 2nd Thread,旦那が何を言っているかわからない件2スレ目,TV,13,Finished Airing,"Apr 3, 2015 to Jun 26, 2015",Fridays at 01 00 (JST),"DAX Production, Dream Creation",add some,Seven,4-koma manga,"Comedy, Romance, Seinen, Slice of Life",3 min. per ep.,PG-13,"7.40, 92068",151009,166,"The Tsunashi couple is as lively and offbeat as ever. Hardcore otaku shut-in Hajime and workaholic office lady Kaoru still get themselves into hilarious situations thanks to both their own eccentric natures and the bizarre group of friends surrounding them.

After learning about Kaoru's pregnancy, Hajime works harder than ever to become a good husband and a worthy father. Meanwhile, Kaoru reflects on their relationship and remembers all of the trials and tribulations that brought them closer. The two of them continue to put their best foot forward in their lives and their marriage—all for the sake of long-lasting, selfless love.

[Written by MAL Rewrite]
"
Someone's Gaze,だれかのまなざし,Movie,1,Finished Airing,"Feb 10, 2013",,The Answer Studio,add some,CoMix Wave Films,Original,"Drama, Slice of Life",6 min.,G,"7.40, 29614",55144,83,"In near-future Japan, Aya Okamura lives alone in an apartment away from her parents. Her mother has worked overseas ever since her childhood, so her aging father Kouji and their cat Mii-san are the only ones left in their family home. After a tiring day, Aya declines her father's invitation for dinner by lying that she is still at work. Yet that very night, she receives another call with sudden news that may bring this separated family closer.

[Written by MAL Rewrite]"
,名探偵コナン ～ロンドンからの㊙指令 (ロンドンからのマル秘指令),OVA,1,Finished Airing,"May 30, 2011",,add some,add some,TMS Entertainment,Manga,"Adventure, Police, Comedy, Mystery, Shounen",25 min.,PG-13,"7.40, 4828",10130,2,"Diana invites Kogorou and Ran to London, but since Conan cannot travel with his invented name, Ai gives him a temporary antidote, letting him travel as Kudou Shin'ichi. Together with Professor Agasa they are on a plane to London.

Back in Japan, Ai now lives with Ayumi. Near their apartment, a suspicious man clothed in black named Kurokawa Youji has been trying to track down and now has found Ai. Shortly after Mitsuhiko notices a picture in a magazine of a foreign actress named Grace Aihara, who looks exactly like Ai, Conan calls, ominously instructing Mitsuhiko to keep Ai away from the Professor's house. And so, Mitsuhiko and Genta go about trying to protect Ai...

(Source: foo2)"
Dramaturgy,ドラマツルギー,Music,1,Finished Airing,"Oct 10, 2017",,add some,add some,add some,Original,Music,4 min.,G,"7.40, 859",1292,3,"An original song by Eve, sung by Hatsune Miku, animated by Mah. Eve's self-cover uses the same animated footage and was released on October 11, 2017. Eve included his self-cover MV on his own self-made record label harapeco records's CD+DVD release on December 13, 2017 as a part of his ""Bunka"" album."
How heavy are the dumbbells you lift?,ダンベル何キロ持てる？,TV,12,Finished Airing,"Jul 3, 2019 to Sep 18, 2019",Wednesdays at 22 30 (JST),"AT-X, Shogakukan, Kadokawa Media House, RAY, NTT Plala, Kadokawa",Funimation,Doga Kobo,Web manga,"Comedy, Ecchi, Slice of Life, Sports",24 min. per ep.,PG-13,"7.40, 87490",208821,747,"During a regular after-school grub crawl, gluttonous high schooler Hibiki Sakura is confronted about her ever-expanding waistline by her best friend, Ayaka Uehara. With her attempts at solitary exercise failing miserably, Hibiki decides to join the newly opened Silverman Gym. At her orientation, Hibiki runs into student council president and school idol Akemi Souryuuin.

However, it soon turns out that Hibiki is in for a lot more than she bargained for. Not only is Silverman Gym full of world-renowned bodybuilders and athletes, but to make matters worse, Akemi turns out to be a total muscle fetishist! Grossed out by the scene unfolding before her eyes, Hibiki begins to leave, only to be stopped by trainer Naruzou Machio. Completely enthralled with her newfound Prince Charming, Hibiki signs up as a gym member. Now, as a result of her spur-of-the-moment decision, Hibiki must adapt to her new lifestyle.

[Written by MAL Rewrite]
"
,新世紀ＧＰＸサイバーフォーミュラＳＡＧＡ,OVA,8,Finished Airing,"Aug 1, 1996 to Jul 25, 1997",,add some,add some,Sunrise,Unknown,"Drama, Sci-Fi, Shounen, Sports",30 min. per ep.,R+,"7.40, 722",1851,7,"After his disappointing loss in the last round of the 14th Cyber Formula World Grand Prix, which causes him the championship, Hayato Kazami decides that he needs a change and switches over to the Sugo Garland SF-03 for the 15th Cyber Formula World Grand Prix while he waits for the newest Asurada design. However, his hope to make up for the past year's letdown is made difficult when Aoi ZIP Formula undergoes a major restructuring and brings in Kyoshiro Nagumo as the new president of the team. The new car that he brought to the team, driven by newcomer Phil Fritz, is seemingly unbeatable...

(Source: ANN)"
Gangsta.,GANGSTA. ギャングスタ,TV,12,Finished Airing,"Jul 2, 2015 to Sep 24, 2015",Thursdays at 02 44 (JST),"Bandai Visual, Frontier Works, Lantis, DAX Production, Tokyo MX",Funimation,Manglobe,Manga,"Action, Drama, Seinen",23 min. per ep.,R,"7.40, 198000",405741,2703,"Nicholas Brown and Worick Arcangelo, known in the city of Ergastalum as the ""Handymen,"" are mercenaries for hire who take on jobs no one else can handle. Contracted by powerful mob syndicates and police alike, the Handymen have to be ready and willing for anything. After completing the order of killing a local pimp, the Handymen add Alex Benedetto—a prostitute also designated for elimination—to their ranks to protect her from forces that want her gone from the decrepit hellhole of a city she has come to call home. However, this criminal’s paradise is undergoing a profound period of change that threatens to corrode the delicate balance of power.

Ergastalum was once a safe haven for ""Twilights,"" super-human beings born as the result of a special drug but are now being hunted down by a fierce underground organization. This new threat is rising up to challenge everything the city stands for, and the Handymen will not be able to avoid this coming war.

[Written by MAL Rewrite]"
