name_english,name_japanese,show_type,episodes,status,aired,broadcast_time,producers,licensors,studios,source,genres,episode_length,rating,score_and_scorers,members,favorites,description
,ときめきトゥナイト,TV,34,Finished Airing,"Oct 7, 1982 to Sep 22, 1983",Thursdays at 19 00 (JST),Toho,add some,Group TAC,Manga,"Comedy, Fantasy, Romance, Shoujo, Vampire",24 min. per ep.,PG,"7.18, 1436",6575,35,"The main character, Ranze, is a junior high girl with troubles: her father is a vampire and her mother is a werewolf. Ranze has yet to manifest her supernatural powers, and her parents are beginning to get worried she might be normal. So begins the fantasy romantic comedy story.

(Source: ANN)"
Daimos,闘将ダイモス,TV,44,Finished Airing,"Apr 1, 1978 to Jan 27, 1979",Unknown,Studio Nue,add some,"Sunrise, Toei Animation",Unknown,"Adventure, Drama, Mecha, Romance, Sci-Fi, Shounen",24 min. per ep.,PG,"7.18, 2239",4429,26,"The third of Tadao Nagahama's Romance Super Robot Trilogy. (#1: Chou Denji Robo Combattler V, #2: Chou Denji Machine Voltes V)

After the destruction of their home world, the survivors of the planet Barm head toward Earth with the goal of negotiating the purchase of land to emigrate to. Unfortunately, during the negotiations, the Barmian's leader, Leon, is assassinated by his second in command, Olban, and the delegation from Earth is framed for the murder. In the ensuing chaos, Doctor Isamu Ryuuzaki of the Earth delegation is shot and killed.

Shortly after the disastrous end of the talks, the Barmians (called ""Valerians"" in Starbirds) begin a campaign of terror against Earth, lead by Leon's son, Admiral Richter, who deploys a variety of ""Mecha Soldiers"" against the planet's defenses. The only thing standing between the Earthlings and annihilation is the transforming, karate-using super robot, Daimos, and its pilot, Kazuya Ryuuzaki. But that changes when he meets and falls in love with a mysterious girl named Erika, who turns out to be Richter's sister. Over the course of their struggles to reunite, Kazuya and Erika each learn that the other's people are not all evil... and that their own people are not all good.

(Source: AniDB)"
,万界仙踪 第3季,ONA,48,Finished Airing,"Oct 17, 2019 to Apr 9, 2020",,Tencent Penguin Pictures,add some,Ruo Hong Culture,Web manga,"Action, Adventure, Historical, Demons, Romance, Martial Arts, Fantasy",7 min. per ep.,PG-13,"7.18, 347",842,4,Third season of Wan Jie Xian Zong.
,雪鹰领主之奇遇篇,ONA,4,Finished Airing,"Jan 2, 2020 to Jan 23, 2020",,add some,add some,add some,Novel,"Action, Adventure, Historical, Romance, Martial Arts, Fantasy",Unknown,PG-13,"7.18, 220",722,5,No synopsis information has been added to this title. Help improve our database by adding a synopsis here.
Elegant Yokai Apartment Life,妖怪アパートの幽雅な日常,TV,26,Finished Airing,"Jul 3, 2017 to Dec 25, 2017",Mondays at 23 00 (JST),"TMS Entertainment, Kodansha, Asmik Ace, JR East Marketing & Communications, Sumitomo",add some,Shin-Ei Animation,Light novel,"Slice of Life, Mystery, Supernatural",23 min. per ep.,PG-13,"7.18, 18904",54273,211,"Inaba Yuushi's parents died in his first year of middle school, and he moved in with his relatives. Though they did care for him, he could tell he was a burden. After he graduated, he happily prepared to move to a high school with a dormitory. Unfortunately, the dormitory burned to the ground before he could move in! Yuushi doesn't want to live with his grudging relatives, but it's rough finding lodging as an orphaned student with little money. He finally finds a room in a nice old building which seems too good to be true.

The catch is that it is a Monster House, a place where humans and supernatural creatures—ghosts, mononoke, etc.—live together. Another high schooler lives there, a cute girl named Akine, and she's completely unfazed by the monsters. In fact, she can even exorcise evil spirits! Yuushi's high school life just got much stranger than he ever bargained for!

(Source: MangaHelpers)"
ONE PIECE FILM GOLD 〜episode 0〜 711ver.,ワンピース フィルム ゴールド ～episode 0～ 711ver.,Special,1,Finished Airing,"Jul 2, 2016",,add some,add some,Toei Animation,Manga,"Action, Adventure, Comedy, Super Power, Fantasy, Shounen",10 min.,PG-13,"7.17, 7725",14754,18,"A short prequel to One Piece Film: Gold featuring the nine Straw hat crew members on the ship, planning what to do when they arrive the Casino."
One Piece Recap,ワンピース,OVA,1,Finished Airing,"Mar 17, 2010",,add some,add some,Toei Animation,Manga,"Action, Adventure, Comedy, Fantasy, Shounen, Super Power",29 min.,PG-13,"7.17, 6414",15921,14,A recap OVA summarizing the ten-year TV series up to the Impel Down arc.
,陰陽大戦記,TV,52,Finished Airing,"Nov 30, 2004 to Nov 29, 2005",Thursdays at 18 00 (JST),add some,add some,Sunrise,Unknown,"Adventure, Fantasy, Supernatural, Shounen",23 min. per ep.,G,"7.17, 1503",5253,29,"All his life, Riku Tachibana has been raised by his grandfather. For some reason, the old man has always been fond of strange hand gestures, and they've rubbed off on Riku, who performs them almost subconsciously, to his classmates' great amusement. One day, however, it suddenly becomes clear to Riku what his grandfather has been surreptitiously teaching him. And the teachings could mean the difference between life and death for Riku. 

(Source: ANN)"
,終わりのセラフ 吸血鬼シャハル,OVA,1,Finished Airing,"May 2, 2016",,add some,add some,Wit Studio,Manga,"Action, Military, Supernatural, Drama, Vampire, Shounen",23 min.,R,"7.17, 21893",53813,98,"The story is set before the main story's ""Battle in Nagoya"" arc.

The Shinoa Squad receives another mission from Guren; to rescue a human girl named Riko from a mysterious vampire, Shahar, and bring her back to her family. However, Ferid and Crowley also appear when they find Shahar. Can Yuuichirou save the girl?

(Source: Crunchyroll)"
Ranma ½ Huge Battle! 29 Unteachable Fools,らんま1/2 スペシャルビデオ バトルがいっぱい29人の懲りないやつら,OVA,1,Finished Airing,"Mar 3, 1995",,add some,add some,add some,Unknown,"Comedy, Martial Arts, Slice of Life",27 min.,PG-13,"7.17, 1152",3755,1,"This special, known in Japan as ""Batoru Kaiibai 29 Hitou Korinai Yatsura,"" was available through the Kitty Animation Circle making it a difficult item to come by. It contained clips from twenty-nine of Ranma's most memorable opponents from the television series. 

(Source: furinkan.com/ranma/anime/specials.html)"
Ranma 1/2 Hot Song Contest,らんま１／２　熱闘歌合戦,OVA,2,Finished Airing,"Nov 7, 1990 to Nov 21, 1990",,Kitty Films,add some,add some,Unknown,"Comedy, Music",25 min. per ep.,PG-13,"7.17, 2014",5533,4,"A two-part music OVA series never released outside of Japan featuring the main Ranma 1/2 characters. They appear to be having a music contest at a local TV station. As everybody knows, these characters can't get along for more than three minutes and hilarity and hijinks ensue. 

(Source: AniDB)"
,レック 許されざる者,Special,1,Finished Airing,"Jun 30, 2006",,add some,add some,Shaft,Manga,"Comedy, Drama, Romance, Seinen",13 min.,PG-13,"7.17, 13627",21480,4,"While going out to eat with his roommate Aka Onda, Fumihiko Matsumaru encounters Tanaka, a woman from his company's accounting department who had previously stood him up on a date. Dumped by her boyfriend just minutes before, Tanaka forces Fumihiko to drink with her, spurring Aka's jealousy.

After Fumihiko escorts a drunk Tanaka home, he ends up tending to her the entire night, leading Aka to become suspicious. How will Fumihiko clear up the misunderstanding?

[Written by MAL Rewrite]"
Strike the Blood,ストライク・ザ・ブラッド,TV,24,Finished Airing,"Oct 4, 2013 to Mar 28, 2014",Fridays at 23 30 (JST),"Movic, AT-X, Warner Bros. Japan, KlockWorx, ASCII Media Works, Showgate","Discotek Media, Crunchyroll","Silver Link., Connect",Light novel,"Action, Harem, Supernatural, Ecchi, Vampire, Fantasy, School",24 min. per ep.,R+,"7.17, 228666",474002,2125,"Kojou Akatsuki's days as an ordinary high school student in the Demon District of Itogami Island come to an abrupt end after a fateful encounter leaves him with the remarkable abilities of a vampire.

It isn't long before he is thrust into the center of attention when it is discovered that he is the fourth primogenitor, an immensely powerful vampire whom most consider to be merely a legend. Fearing Kojou's destructive potential, the Lion King Organization sends in an apprentice sword-shaman, Yukina Himeragi, to monitor, and should he become a threat, kill the boy deemed the world's most powerful vampire. Forced together by circumstance, the two form an unlikely alliance as Kojou comes to terms with his abilities and they both struggle to protect the city from various emerging chaotic forces.

[Written by MAL Rewrite]"
"Wake Up, Girls! The Movie","Wake Up, Girls！七人のアイドル",Movie,1,Finished Airing,"Jan 10, 2014",,"TV Tokyo, Avex Entertainment, Sotsu, Sega, Gakken, Rakuonsha, AT-X, Toho, DIVE II Entertainment, Good Smile Company",Sentai Filmworks,"Tatsunoko Production, Ordet",Original,"Drama, Music",52 min.,PG-13,"7.17, 11012",20245,16,"In Wake Up, Girls! Green Leaves Entertainment is in the worst situation any Talent Management Agency can be in... they have NO talent! Desperate for an act, President Junko Tange targets the idol singer market and gives her flunky Matsuda his marching orders: get a girl group to manage, even if it means building one from scratch!

Since complete singing groups rarely appear out of thin air, Matsuda's now in the difficult position of having to find girls with the right skills who don't already have contracts with Japan's music industry. That girl at the Maid Café? Good enough! A lead singer who's been fired from another group? Sure, why not? How about one who's only 13 years old? What could possibly go wrong there?

They may not be on the A-list, the B-List, or even the C-list to start, but with a little love and a whole lot of hard work, it's possible that all Japan may someday wake up to the music of WAKE UP, GIRLS!

(Source: Sentai Filmworks)"
The Daily Life of the Immortal King,仙王的日常生活,ONA,15,Finished Airing,"Jan 18, 2020 to Mar 28, 2020",,add some,bilibili,Haoliners Animation League,Light novel,"Adventure, Slice of Life, Comedy, Demons, Fantasy, School",18 min. per ep.,PG-13,"7.17, 13679",40479,303,"As a cultivation genius who has achieved a new realm every two years since he was a year old, Wang Ling is a near-invincible existence with prowess far beyond his control. But now that he’s sixteen, he faces his greatest battle yet – Senior High School. With one challenge after another popping up, his plans for a low-key high school life seem further and further away…

(Source: Novel Updates)"
,ヨコハマ買い出し紀行 Quiet Country Cafe,OVA,2,Finished Airing,"Dec 18, 2002 to Mar 5, 2003",,SME Visual Works,add some,Ajia-Do,Manga,"Sci-Fi, Slice of Life, Seinen",32 min. per ep.,R+,"7.17, 6377",14030,36,"In the near-future Japan, global warming has brought the large city Yokohama underwater, and only the hills remain above the ocean surface. What used to be one of the largest cities in Japan now feels like a small town. Basically, the existence of the island country itself has been threatened. However, there is no feeling of desperation, devastation, nor hopelessness. People are enjoying laid-back lives, and they seem to appreciate each other's company, enjoying the quiet and peaceful time together.

This is especially so with Alpha, a carefree young woman who runs a cafe, named Cafe Alpha. She enjoys her life immersing herself in the beautiful nature all around her. There is nothing more precious to her than spending quality time with her kind friends. Oh, the fulfillment and the joy she finds in life... it all indicates her to be a compassionate human being, but she is not quite a human. She is actually a type A7M2 robot.

One day, upon hearing a radio forecast warning an approaching typhoon, her old friend who lives close by invites her to the gas station he runs, worried that her old cafe may not withstand the typhoon. Indeed, the passing of typhoon leaves Alpha with her cafe severely damaged. That's when she decides to go on a journey to raise money to rebuild her cafe, and also to see the outside world away from her friends and the comfort of a peaceful life.

(Source: AniDB)"
Rakshasa Street,镇魂街 北落师门篇 上,ONA,5,Finished Airing,"Dec 28, 2019 to Jan 18, 2020",,add some,bilibili,L²Studio,Manga,"Action, Supernatural",23 min. per ep.,PG-13,"7.17, 267",1799,6,First half of the second season of Zhen Hun Jie.
Ai Yori Aoshi Enishi,藍より青し～縁～,TV,12,Finished Airing,"Oct 13, 2003 to Dec 29, 2003",Unknown,"Geneon Universal Entertainment, Rondo Robe, Movic, Cosmic Ray","Funimation, Geneon Entertainment USA",J.C.Staff,Manga,"Comedy, Drama, Harem, Romance, Slice of Life",23 min. per ep.,PG-13,"7.17, 28048",50374,87,"Two years after meeting Aoi, Kaoru and gang are still up to their normal habits. Kaoru now in grad school and the tenants being as rowdy as ever what will become of Aoi and Kaoru's love.

Two years has passed since Aoi and Kaoru were freed from the bonds of their families. They continue to live their normal lives with their usual friends in their house."
Sweet Blue Flowers,青い花,TV,11,Finished Airing,"Jul 2, 2009 to Sep 10, 2009",Thursdays at 02 08 (JST),"Fuji TV, Fujipacific Music",Nozomi Entertainment,J.C.Staff,Manga,"Romance, Shoujo Ai, Slice of Life",22 min. per ep.,PG-13,"7.17, 27874",75232,376,"Shy and soft-spoken Fumi Manjoume and upfront and caring Akira Okudaira were best friends in elementary school, but this changed when Fumi and her family moved away. Years later, Fumi moves back to her hometown after being accepted at Matsuoka Girls’ High School. She finally reunites with Akira, who is going to attend Fujigatani Girls’ Academy. Despite their reunion, their relationship isn't the same as it was years ago.

As soon as Fumi starts attending school, popular senior Yasuko Sugimoto takes notice of her and flatters her more than any other underclassmen. After running to Akira for help so many times before, Fumi must figure out who she is as a person instead of standing in someone else’s shadow.  However, that doesn’t stop Akira from wanting her friendship with Fumi to be as it once was. Will the girls be able to conquer the high school stage of growing up before it pulls them apart?

[Written by MAL Rewrite]
"
,BLAME!,Movie,1,Finished Airing,"May 20, 2017",,"Starchild Records, Kodansha, KlockWorx, Glovision",Viz Media,Polygon Pictures,Manga,"Action, Drama, Mecha, Psychological, Sci-Fi, Seinen",1 hr. 45 min.,PG-13,"7.17, 42470",77732,200,"In the distant technological future, civilization has reached its ultimate Net-based form. An ""infection"" in the past caused the automated systems to spiral out of order, resulting in a multi-leveled city structure that replicates itself infinitely in all directions. Now humanity has lost access to the city's controls, and is hunted down and purged by the defense system known as the Safeguard. In a tiny corner of the city, a little enclave known as the Electro-Fishers is facing eventual extinction, trapped between the threat of the Safeguard and dwindling food supplies. A girl named Zuru goes on a journey to find food for her village, only to inadvertently cause doom when an observation tower senses her and summons a Safeguard pack to eliminate the threat. With her companions dead and all escape routes blocked, the only thing that can save her now is the sudden arrival of Killy the Wanderer, on his quest for the Net Terminal Genes, the key to restoring order to the world.

(Source: Official site)"
Please Save My Earth,ぼくの地球を守って,OVA,6,Finished Airing,"Dec 17, 1993 to Sep 23, 1994",,"Victor Entertainment, Hakusensha",Viz Media,Production I.G,Manga,"Drama, Sci-Fi, Shoujo",30 min. per ep.,PG-13,"7.17, 4224",12749,104,"Alice Sakaguchi once dreamt that she is another person living on the moon. The dream is so strange and so real that Alice can't stop thinking about it. She finds out that some of her classmates are having the same kind of dream. They soon discover that they had been seeing flashes of their past lives as a team of scientists on the moon. Alice and her friends then decide to find the other members and piece together what took place back then. Complications arise when they realize that everything that happened in their previous existence continue to haunt and affect their present lives. 

(Source: ANN)"
Boogiepop Phantom,ブギーポップは笑わない Boogiepop Phantom,TV,12,Finished Airing,"Jan 5, 2000 to Mar 22, 2000",Thursdays at 01 45 (JST),"VAP, d-rights",Nozomi Entertainment,Madhouse,Light novel,"Psychological, Supernatural, Dementia, Mystery, Drama, Horror",24 min. per ep.,R+,"7.17, 23246",88490,731,"Five years ago, a string of grisly murders shook the city to its core and now the rumors have begun once more. Boogiepop... Everyone knows about Boogiepop: meet her one dark night and you are taken. People tell each other the stories and laugh: no one believes that she can possibly exist in this day and age. Still, strange things appear to be going on and the darkness is taking on many forms. Something is out there. Are you safe?

(Source: RightStuf)"
,キャッツ・アイ,TV,73,Finished Airing,"Jul 11, 1983 to Jul 8, 1985",Unknown,add some,Nozomi Entertainment,Tokyo Movie Shinsha,Manga,"Action, Adventure, Comedy, Mystery, Romance",25 min. per ep.,PG-13,"7.17, 4682",13835,57,"The three Kisugi sisters—Rui, Hitomi and Ai—during the day run a small cafe called ""Cat's Eye."" To discover the whereabouts of their father, the artist Michael Heintz, who has disappeared, Hitomi and her sisters rob art galleries as the smart and mysterious thief ""Cat's Eye"" in the hope that his works can give them clues about his vanishing. The crucial point is that Hitomi has a relationship with Toshi, a police inspector who has sworn to catch ""Cat's Eye""—and of course he has no idea about Hitomi's double life.

(Source: ANN)"
,ちびまる子ちゃん (1990),Movie,1,Finished Airing,"Dec 15, 1990",,add some,add some,add some,Manga,"Comedy, School, Shoujo",1 hr. 33 min.,G,"7.17, 710",1549,3,"Chibi Maruko chan is the nickname of a sweetly obnoxious 9-year-old girl. She tricks her grandfather, ponders for hours over how to spend her allowance, and hates sitting next to ugly boys. She talks, feels and lives just as real kids do.

As the second term commences, Maruko and her classmates return to their small groups. Maruko’s group includes two naughty boys and Maruko is forced to be one of their subordinates. She seems to face a lot of pressure at school.

As the school’s athletic meet approaches, all the classmates are busy exercising. Maruko is no exception, although her laziness means that she is late sometimes. Maruko realizes that the two boys rival each other in everything they do, and that their friendship is deep and strong. 

(Source: AnimeNfo)"
"Love, Chunibyo & Other Delusions! Heart Throb Lite Shorts",中二病でも恋がしたい！戀 Lite,ONA,6,Finished Airing,"Dec 26, 2013 to Mar 16, 2014",,add some,add some,Kyoto Animation,Light novel,"Comedy, School",3 min. per ep.,PG-13,"7.17, 30521",62318,82,Short episodes aired on KyoAni's official YouTube channel.
Code Geass Akito the Exiled - To Beloved Ones,コードギアス 亡国のアキト 最終章 「愛シキモノタチへ」,Movie,1,Finished Airing,"Feb 6, 2016",,"Bandai Visual, Bandai, Bandai Namco Entertainment, Hakuhodo DY Media Partners",Funimation,Sunrise,Original,"Action, Military, Mecha",59 min.,R+,"7.17, 30441",62927,93,"The Ark Fleet has been destroyed, and a significant number of the enemy's troops have been wiped out due to its crash landing. As the remaining forces of the Knights of St. Michael regroup in order to launch a final assault on Castle Weisswolf, the W-0, along with their new ally Ashley Ashra, stand ready to intercept them.

Meanwhile, with his Geass out of control, Shin moves to erase his younger brother's existence once and for all. But Akito, having promised Leila that he will come back alive, refuses to accept such a fate, and the two clash in their final battle.

[Written by MAL Rewrite]"
Cyborg 009,サイボーグ009,TV,50,Finished Airing,"Mar 6, 1979 to Mar 25, 1980",Unknown,add some,add some,Toei Animation,Manga,"Action, Adventure, Mecha, Sci-Fi, Shounen",24 min. per ep.,PG-13,"7.17, 2039",7014,24,"Joe Shimamura and his companions may seem like regular men, but they are anything but. Joe is actually Cyborg 009, member of a team of cyborgs who fight for the greater good. Each cyborg is outfitted with a special power, from the ability to melt any material, to underwater breathing and flight. He and the other eight cyborgs were modified against their will by the Neo-Black Ghosts organization in order to further their own interests. But instead, they decided to band together and use their powers to fight against their former captors, and all forces of evil."
,D.C.if 〜ダ・カーポ イフ〜,OVA,2,Finished Airing,"Dec 25, 2008 to Mar 25, 2009",,add some,add some,Zexcs,Visual novel,"Harem, Drama, Magic, Romance",26 min. per ep.,PG-13,"7.17, 6685",14134,21,"This two episode OVA retelling of the first Da Capo series with the ""what if"" Junichi Asakura were to return Kotori Shirakawa's feelings."
,ダッシュ勝平,TV,65,Finished Airing,"Oct 4, 1981 to Dec 26, 1982",Unknown,Fuji TV,add some,"Tatsunoko Production, Tama Production",Unknown,"Comedy, Sports, Ecchi, Shounen",25 min. per ep.,PG-13,"7.17, 1922",4193,30,"Kappei is a dramatically short guy but he is a master in every sport. He lives as a guest in sweet Akane's house, and he's in love with her, but there's a strange rival, her dog Salomone (Italian name) who plans evil traps to encumber Kappei. But the dog has also another function: he explains all sport rules when a new sport is depicted. Kappei is fond of white female underwear, always trying to lift girl's skirts up.

(Source: ANN)"
,アイドリッシュセブン DIAMOND FUSION,Music,1,Finished Airing,"Apr 30, 2018",,add some,add some,add some,Game,Music,3 min.,G,"7.17, 770",1633,8,"Official music video for TRIGGER's song DIAMOND FUSION also released on their ""HEAVENLY VISITOR"" album. The male idol group is primarily a rival to IDOLiSH7, the latter of which is also the name of the overall game franchise being adapted."
Doraemon the Movie The Record of Nobita's Spaceblazer,映画 ドラえもん 新・のび太の宇宙開拓史,Movie,1,Finished Airing,"Mar 7, 2009",,TV Asahi,add some,Shin-Ei Animation,Unknown,"Adventure, Comedy, Fantasy, Kids",1 hr. 38 min.,PG,"7.17, 1701",2994,1,"While Nobita is sleeping, he suddenly feels the floor is trembling, like there would be an earthquake in his room. A little rabbit from an alternate universe named Chamii opens the door between the dimensions using a hammer and gets inside Nobita's room through the floor. Nobita waks up and Doraemon hears somebody steals food from the fridge in the kitchen. It is Chamii, who gets caught by Doraemon and Nobita. She shows them the passageway through Nobita's floor into the spaceship. After they enter the spaceship, they see the Koya Koya Planet. they meet a boy named Roppuru..."
,ドラえもん ２１１２年ドラえもん誕生,Movie,1,Finished Airing,"Mar 4, 1995",,TV Asahi,add some,Shin-Ei Animation,Unknown,"Kids, Fantasy, Comedy",30 min.,PG,"7.17, 1517",2889,6,"The movie is sort of a prequel to the entire series, it showed the life of Doraemon before traveling to the 20th century: How he was made, how he was partially broken, how he lost his ears, how he met the Nobi family and decides to return to the past to help Nobita."
Gunslinger Girl Il Teatrino,ガンスリンガー ガール -IL TEATRINO-,TV,13,Finished Airing,"Jan 7, 2008 to Apr 1, 2008",Unknown,Marvelous,Funimation,Artland,Manga,"Action, Drama, Military, Sci-Fi",25 min. per ep.,R,"7.17, 23268",52570,120,"When the Social Welfare Agency investigates the disappearance of an operative, their inquiry leads them right into the lair of their rival, the Five Republics. The assassin Triela infiltrates the hostile organization, but her search is cut short when she finds herself staring down the barrel of a gun...

(Source: ANN)"
,這いよれ！ニャル子さん　やさしい敵の仕留め方,OVA,1,Finished Airing,"Nov 23, 2012",,add some,add some,Xebec,Light novel,"Comedy, Parody, Sci-Fi",15 min.,PG-13,"7.17, 12354",25202,17,Adaptation of the short story written by Manta Aisora for the first issue of GA Bunko magazine.
,薄桜鬼　黎明録　特典ディスク,OVA,2,Finished Airing,"May 22, 2013",,add some,add some,Studio Deen,Visual novel,"Action, Supernatural, Josei",11 min. per ep.,PG-13,"7.17, 897",3789,5,"2 eps. Tokuten that were released in a Tokuten Disc for those who purchased all 6 volumes of Hakuouki Reimeiroku OVAs.

Including:
1. Natsu no Wazurai (夏のわずらい)

2. Shinpachi Nagakura Saikyou Densetsu (永倉新八最強伝説)"
