name_english,name_japanese,show_type,episodes,status,aired,broadcast_time,producers,licensors,studios,source,genres,episode_length,rating,score_and_scorers,members,favorites,description
,海の幽霊,Music,1,Finished Airing,"May 27, 2019",,add some,add some,add some,Manga,"Music, Supernatural",4 min.,G,"7.42, 860",1676,1,Official music video for Kaijuu no Kodomo's theme song Umi no Yuurei by Kenshi Yonezu. 
Endless Orbit SSX,わが青春のアルカディア・無限軌道ＳＳＸ,TV,22,Finished Airing,"Oct 13, 1982 to Mar 30, 1983",Unknown,TBS,Discotek Media,Toei Animation,Unknown,"Action, Adventure, Drama, Sci-Fi, Space",25 min. per ep.,PG-13,"7.42, 1628",4999,28,"At the end of Arcadia of My Youth Capitain Harlock and the crew of the space ship Arcadia had been banished from Earth. The Earth, as well as many other planets in the universe had been taken over by the Illumidus, a race of destructive humanoids who ruin, enslave or destroy almost any inhabitable planet they come across. In ""Endless Orbit SSX"" Harlock battles the Illumidus while searching for a mythical ""Planet of Peace"" where all the peoples of the universe can live freely and without war.

(Source: Wikipedia)"
,弱虫ペダル Re ROAD,Movie,1,Finished Airing,"Jun 12, 2015",,TOHO animation,Discotek Media,TMS Entertainment,Manga,"Drama, Shounen, Sports",1 hr. 29 min.,PG-13,"7.42, 2913",7563,6,"The movie will compile the episodes from the second season of the anime, and will also have new cuts of animation.

(Source: ANN)"
,夜桜四重奏 ～ホシノウミ～,OVA,3,Finished Airing,"Oct 8, 2010 to Nov 9, 2011",,"KMMJ Studios, Purple Cow Studio Japan",add some,Tatsunoko Production,Manga,"Action, Magic, Comedy, Super Power, Supernatural, Shounen",28 min. per ep.,PG-13,"7.42, 13848",33152,19,"An OVA based on the Hoshi no Umi arc of the manga spanning chapters 26-34. 

This arc focuses on Rin Azuma, a Jiang-Shi yokai resident of Sakurashin adjusting to her new life in the city and working for a ramen shop. One day her former friend Zakuro Kurumaki invades Sakurashin to capture Rin and convince her to join her in destroying the city with the other yokai hunters as well as Enjin Hiizumi, the main antagonist of the series. Akina Hiizumi and the other members of the Hiizumi Life Counseling Office take action to save Rin, 'tune' the yokai controlling Zakuro and protect the city.

(Source: ANN)
"
,幽☆遊☆白書 完全新作アニメーション,Special,2,Finished Airing,"Oct 26, 2018",,"Bandai Visual, Shueisha",add some,Studio Pierrot,Manga,"Action, Adventure, Comedy, Demons, Supernatural, Martial Arts, Shounen",15 min. per ep.,PG-13,"7.42, 4950",15140,18,"Special included in the 25th anniversary Blu-ray box set.

The special will cover the ""Two Shot"" bonus chapter from the manga's seventh volume, which tells the story of how Kurama and Hiei met, as well as the manga's penultimate chapter ""All or Nothing."" which shows the main characters reuniting to solve a hostage crisis in the spirit world.

(Source: ANN)"
One Piece Romance Dawn Story,ワンピース ロマンスドーンストーリー,OVA,1,Finished Airing,"Nov 24, 2008",,add some,add some,Toei Animation,Manga,"Action, Fantasy, Comedy, Super Power, Shounen",33 min.,PG-13,"7.41, 18791",36377,22,"The Straw Hat Pirates, searching for the great passage ""Grand Line"", are in trouble when their food runs out! Luffy, searching for food on his own, finds a ship belonging to the pirate, Gary, and takes it over!! He lands at a nearby town...

Luffy was attacked by a young girl, Silk, who mistook him for a member of the other pirate gang. As the two eat a meal, they tell their stories. Meanwhile, Gary and his band are burning with anger at Luffy, demanding payment from the town's defenseless citizens...!!

(Source: jumpland.com/animetour/op/index_en.html)"
,ワンパンマン,TV,12,Finished Airing,"Apr 10, 2019 to Jul 3, 2019",Wednesdays at 01 35 (JST),"TV Tokyo, Good Smile Company, Shueisha, JR East Marketing & Communications, Bandai Namco Arts, Bandai Spirits",Viz Media,J.C.Staff,Web manga,"Action, Sci-Fi, Comedy, Parody, Super Power, Supernatural",23 min. per ep.,R,"7.41, 429533",873799,5333,"In the wake of defeating Boros and his mighty army, Saitama has returned to his unremarkable everyday life in Z-City. However, unbeknownst to him, the number of monsters appearing is still continuously on the rise, putting a strain on the Hero Association’s resources. Their top executives decide on the bold move of recruiting hoodlums in order to help in their battle. But during the first meeting with these potential newcomers, a mysterious man calling himself Garou makes his appearance. Claiming to be a monster, he starts mercilessly attacking the crowd. 

The mysterious Garou continues his rampage against the Hero Association, crushing every hero he encounters. He turns out to be the legendary martial artist Silverfang’s best former disciple and seems driven by unknown motives. Regardless, this beast of a man seems unstoppable. Intrigued by this puzzling new foe and with an insatiable thirst for money, Saitama decides to seize the opportunity and joins the interesting martial arts competition. 

As the tournament commences and Garou continues his rampage, a new great menace reveals itself, threatening the entire human world. Could this finally be the earth shattering catastrophe predicted by the great seer Madame Shibabawa? 

[Written by MAL Rewrite]
"
,おるちゅばんエビちゅ,TV,24,Finished Airing,"Aug 1, 1999 to Oct 1, 1999",Unknown,"Group TAC, Pioneer LDC",add some,Gainax,Manga,"Comedy, Ecchi, Seinen",8 min. per ep.,R+,"7.41, 14772",39092,313,"Ebichu the hamster seems like the perfect house pet: she cleans, shops, cooks, does laundry, and anything to please her master, known only as ""Office Lady"" (OL). Unfortunately, OL and her unfaithful boyfriend, combined with Ebichu's uncontrollable exuberance and love for ice cream, often earn her severe and bloody punishment. However, Ebichu doesn't seem to mind the abuse if she achieves her goal of making her beloved master a little bit happier.

(Source: IMDB)"
,ポプテピピック　ＴＶスペシャル,Special,2,Finished Airing,"Apr 1, 2019",,add some,add some,add some,4-koma manga,"Comedy, Parody, Dementia",11 min. per ep.,PG-13,"7.41, 6168",19493,16,"Episode 13 and 14 of Poputepipikku. The special has four versions shown on four different broadcasters: Tokyo MX (Blue Dragon ver.), Nico Nico Douga (Vermilion Bird ver.), Abema TV Anilive (White Tiger ver.) and Abema TV Pop Team Epic Channel (Black Tortoise ver.). Each version has a unique combination of seiyuus.

(Source: AniDB)"
Re Hamatora Season 2,Re ␣ ハマトラ,TV,12,Finished Airing,"Jul 8, 2014 to Sep 23, 2014",Tuesdays at 02 05 (JST),"TV Tokyo, Sotsu, AT-X, DAX Production, NAZ, DIVE II Entertainment, Avex Pictures, Q-Tec, Shueisha, Toy's Factory",Sentai Filmworks,Lerche,Original,"Mystery, Comedy, Super Power, Drama",24 min. per ep.,R,"7.41, 61541",134320,384,"It has been three months since the incident at Yokohama. Things have been settling down at Cafe Nowhere. Murasaki and Hajime have teamed up and started investigating again. After an unforeseen reunion, Art holds Nice at gunpoint. What are his real intentions? What will become of the connection between Art and Hamatora?

(Source: Crunchyroll)"
Saiyuki Reload,最遊記RELOAD,TV,25,Finished Airing,"Oct 2, 2003 to Mar 25, 2004",Unknown,add some,Geneon Entertainment USA,Studio Pierrot,Manga,"Action, Adventure, Comedy, Demons, Drama, Josei, Supernatural",23 min. per ep.,PG-13,"7.41, 10666",27446,114,"Priest Genjo Sanzo and companions Cho Hakkai, Sha Gojyo, and Son Goku maintain their westward journey to stop the resurrection of the demon Gyoumao. As the reputation of the Sanzo Ikkou precedes them, they continue to fight demon assassins at every turn, but they must also deal with increasing tensions within their group in order to defeat a powerful enemy. 

(Source: ANN)"
,青春ブタ野郎はバニーガール先輩の夢を見ない,Special,5,Finished Airing,"Dec 19, 2018 to May 15, 2019",,add some,add some,CloverWorks,Light novel,"Comedy, Romance",8 min. per ep.,PG-13,"7.41, 10388",43113,194,Picture drama episodes included on the DVD/Blu-ray Volumes of Seishun Buta Yarou wa Bunny Girl Senpai no Yume wo Minai.
Shigurui Death Frenzy,シグルイ,TV,12,Finished Airing,"Jul 19, 2007 to Oct 11, 2007",Thursdays at 23 30 (JST),"Geneon Universal Entertainment, WOWOW, Akita Shoten",Funimation,Madhouse,Manga,"Action, Historical, Psychological, Drama, Martial Arts, Samurai, Seinen",23 min. per ep.,R+,"7.41, 27672",90351,724,"At the beginning of the Edo Era, when people enjoyed a time of peace, Lord Tokugawa Tadanaga holds a fighting tournament. In the past, matches were fought with wooden swords. This time, real swords will be used.

One-armed Fujiki Gennosuke and blind Irako Seigen will fight each other in this match. Both are disciples of Iwamoto Kogan, who is known as Japan's greatest swordsman. Each of them are determined to prove himself the successor of Iwamoto's school. However, there can only be one champion.

So begins a story of intertwining fates, conflict, and strange destinies.

(Source: ANN)"
,蒼穹のファフナー RIGHT OF LEFT ～single program～,Special,1,Finished Airing,"Dec 30, 2005",,Starchild Records,add some,"Production I.G, Xebec",Original,"Action, Drama, Mecha, Military, Sci-Fi",51 min.,PG-13,"7.41, 4941",12937,26,"Yumi Ikoma and Ryou Masaoka are children who have been selected to take part in a top secret mission, to be the pilots of the first Fafner combat units; the last chance of survival for the human race. The enemy is ruthless, remorseless and is able to read the minds of humans. Therefore, the details of this mission are kept a secret even from the personnel involved. The young pilots must use all their courage and faith in order to survive and complete their mission or the fate of mankind would be compromised. 

(Source: ANN)
"
Tales of Zestiria Dawn of the Shepherd,テイルズ オブ ゼスティリア ～導師の夜明け～,Special,1,Finished Airing,"Dec 30, 2014",,add some,add some,ufotable,Game,Fantasy,44 min.,PG-13,"7.41, 18205",37705,67,TV anime special of Bandai Namco Games' Tales of Zestiria role-playing game.
,たまゆら～hitotose～ 第5.5話「あったかい風の想い出、なので」,Special,1,Finished Airing,"Jun 27, 2012",,add some,add some,TYO Animations,Original,"Comedy, Drama, Slice of Life",24 min.,G,"7.41, 3424",7635,3,Extra episode in the 7th Blu-ray and DVD volumes.
Tanaka-kun is Always Listless,田中くんはいつもけだるげ特典,Special,7,Finished Airing,"Jun 24, 2016 to Dec 22, 2016",,add some,Sentai Filmworks,Silver Link.,Web manga,"Comedy, School, Slice of Life",4 min. per ep.,PG-13,"7.41, 7274",21171,21,Bundled with the Blu-ray and DVD releases of Tanaka-kun wa Itsumo Kedaruge.
Un-Go,UN-GO アン ゴ,TV,11,Finished Airing,"Oct 14, 2011 to Dec 23, 2011",Fridays at 00 45 (JST),"Dentsu, Fuji TV, Toho, Sony Music Entertainment, Fujipacific Music",Sentai Filmworks,Bones,Novel,"Mystery, Supernatural",24 min. per ep.,R,"7.41, 48956",125615,618,"In a dystopian future, detective Shinjuurou Yuuki—known by some as the ""Defeated Detective""—solves mysteries throughout Tokyo. Aided by his odd associate Inga, Shinjuurou's insight and ingenuity in cracking cases, particularly homicides, lead to numerous mysteries solved and culprits caught. However, his partner seems to have some other, more sinister intentions for the people they catch, and the truth of the assistant's identity and motivation is shrouded in secrecy.

[Written by MAL Rewrite]"
,喂，看见耳朵啦 第二季,ONA,12,Finished Airing,"Feb 2, 2019 to Apr 13, 2019",,"bilibili, Alchemy Bros.",add some,monofilmo,Web manga,"Slice of Life, Comedy, Shounen Ai",3 min. per ep.,PG-13,"7.41, 2796",5689,19,"Second season of Wei, Kanjian Erduo La!."
The Familiar of Zero Rondo of Princesses,ゼロの使い魔 ～三美姫（プリンセッセ）の輪舞（ロンド）～,TV,12,Finished Airing,"Jul 7, 2008 to Sep 22, 2008",Mondays at 00 30 (JST),add some,Sentai Filmworks,J.C.Staff,Light novel,"Action, Adventure, Harem, Comedy, Magic, Romance, Ecchi, Fantasy, School",24 min. per ep.,PG-13,"7.41, 218542",355709,879,"Following his brave sacrifice in the war against Albion, Saito Hiraga is knighted and treated as an aristocrat, something that proves difficult for Louise Françoise Le Blanc de La Vallière. With their relationship no longer defined as the mighty Void mage and clueless familiar, she wonders what exactly this means for them.

While venturing to a castle, Louise is ambushed by a powerful mage named Sheffield. Battling alone, the young mage nearly faces defeat until Saito makes his appearance. The mystical and unknown nature of Void magic seems to be at work in the battle, and Louise begins to believe in the possibility of another Void user. Moreover, she realizes that Saito's magical rune is fading, and so a new adventure begins as they search for the elf who revived Saito in the past. The relationship between former master and servant faces a new challenge as they work to restore the runes and redefine the bond which holds them together.

[Written by MAL Rewrite]"
,劇場版 アイカツ！アイドルカツドウ！,Movie,1,Finished Airing,"Dec 13, 2014",,add some,add some,Sunrise,Unknown,"Slice of Life, Music, School, Shoujo",1 hr. 28 min.,PG,"7.41, 2650",5831,31,"The story of the anime revolves around Ichigo, who was just a normal middle school student until she suddenly got involved in the world of idols. The film will center on Aikatsu!'s greatest ""Super Live"" concert yet, the Dai Star Miya Ichigo Matsuri. Ichigo prepares for the concert with press conferences, last-minute lessons, and more.

(Source: ANN)"
Blue Legend Shoot!,蒼き伝説　シュート！,TV,58,Finished Airing,"Nov 7, 1993 to Dec 25, 1994",Sundays at 09 00 (JST),add some,add some,Toei Animation,Manga,"Action, Comedy, Drama, Romance, School, Shounen, Sports",25 min. per ep.,PG-13,"7.41, 4764",11124,66,"Aoki Densetsu Shoot! (Legendary Blue Shot!) or also known as just ""Shoot!"", is the story of Toshihiko Tanaka, Kenji Shiraishi, and Kazuhiro Hiramatsu. Three high school freshmen who have become best friends during their junior high years while playing soccer together. There they were known as the Kakenishi golden trio for their role in making Kakenishi Junior High's soccer team into a force to be reckoned with. After junior high, all of them decided to go to the same high school, Kakegawa High, a school only founded a year before, because of their star soccer player, Yoshiharu Kubo, whom they had idolized.

This young man led Kakegawa High Soccer Club to the best 8 of their prefecture in their first ever appearance with a freshmen only team almost single-handedly. He refuses offers from a number of foreign professional soccer clubs so he can stay at Kake-High to lead them to the All-Japan High School Championship. As the three of them start playing soccer for Kake-High, they experience hardships, romance, and losses on their road to becoming the best Japanese high school soccer team—a team of legends.

(Source: AniDB)"
Arpeggio of Blue Steel -Ars Nova-,蒼き鋼のアルペジオ ‐アルス・ノヴァ‐,TV,12,Finished Airing,"Oct 8, 2013 to Dec 24, 2013",Tuesdays at 02 55 (JST),"Sotsu, KlockWorx, flying DOG, Ultra Super Pictures, Showgate, Shounen Gahousha","Discotek Media, Crunchyroll",SANZIGEN,Manga,"Action, Sci-Fi, Seinen",24 min. per ep.,PG-13,"7.41, 58101",128952,921,"In the year 2039, the drastic effects of global warming have caused sea levels to rise, resulting in major loss of land. To ensure humanity learns its lesson, a fleet of powerful warships equipped with advanced weaponry emerges, causing overwhelming defeat for naval forces throughout the world. Calling themselves the Fleet of Fog, each ship has a ""Mental Model,"" a humanoid avatar which represents the ship's heart, its ""Union Core."" Each model has a different personality but all follow an unknown authority known as the Admiralty Code, who have implemented a blockade to prevent humans from traveling across the sea.

Seventeen years after the blockade, Gunzou Chihaya, a National Marine Academy alumnus, stumbles upon I-401 and its Mental Model, Iona, who sides with mankind for unknown reasons. Utilizing this newfound hope of achieving peace for humanity, Gunzou and his friends form a group of privateers, known as the Blue Steel, as they set out on a dangerous journey.

[Written by MAL Rewrite]"
BTOOOM!,BTOOOM!,TV,12,Finished Airing,"Oct 4, 2012 to Dec 20, 2012",Thursdays at 23 00 (JST),"Sotsu, KlockWorx, flying DOG, Showgate",Sentai Filmworks,Madhouse,Manga,"Action, Sci-Fi, Psychological, Seinen",24 min. per ep.,R,"7.41, 374399",649237,3370,"Ryouta Sakamoto is unemployed and lives with his mother, his only real achievement being that he is Japan's top player of the popular online video game Btooom! However, his peaceful life is about to change when he finds himself stranded on an island in the middle of nowhere, with a small green crystal embedded in his left hand and no memory of how he got there. To his shock, someone has decided to recreate the game he is so fond of in real life, with the stakes being life or death.

Armed with a bag full of unique bombs known as ""BIM,"" the players are tasked with killing seven of their fellow participants and taking their green crystals in order to return home. Initially condemning any form of violence, Ryouta is forced to fight when he realizes that many of the other players are not as welcoming as they may seem. Teaming up with Himiko, a fellow Btooom! player, they attempt to get off of the island together, coming closer and closer to the truth behind this contest of death.

[Written by MAL Rewrite]"
Free! - Iwatobi Swim Club,Free!,TV,12,Finished Airing,"Jul 4, 2013 to Sep 26, 2013",Thursdays at 00 30 (JST),"Lantis, Iwatobi High School Swimming Club, Asahi Broadcasting","Funimation, Discotek Media, Crunchyroll","Kyoto Animation, Animation Do",Original,"Slice of Life, Comedy, Sports, Drama, School",24 min. per ep.,PG-13,"7.41, 292532",533870,9300,"Haruka Nanase has a love for water and a passion for swimming. In elementary school, he competed in and won a relay race with his three friends Rin Matsuoka, Nagisa Hazuki, and Makoto Tachibana. After claiming victory at the tournament, the four friends went their separate ways. Years later, they reunite as high school students; however, Rin couldn't care less about returning to the way things used to be. Not only does he attend a different school, but the sole thing important to him is proving that he is a better swimmer than Haruka.

After the bitter reunion, Haruka, Nagisa, and Makoto decide to form the Iwatobi High School Swim Club, but they will need a fourth member if they hope to take part in the upcoming tournament. Enter Rei Ryuugazaki, a former member of the track team whom Nagisa recruits. As the time to compete draws near, the four develop a close bond while training intensely to come out on top and settle things between Haruka and Rin once and for all.

[Written by MAL Rewrite]"
,冬のソナタ,TV,26,Finished Airing,"Oct 17, 2009 to May 1, 2010",Unknown,Yoon's Color,add some,"Studio Comet, KeyEast, REALTHING",Other,"Drama, Romance",25 min. per ep.,PG-13,"7.41, 4001",20078,70,"Based on the Korean Drama of the same name, Yoo Jin falls in love with Joon Sang as a young girl. After losing him in an accident, she decides to marry her childhood friend. However, Yoo Jin meets someone looking exactly like her lost love, putting her in a bind.  The program featured 23 members of the original Korean cast voicing the characters and was broadcast with Japanese subtitles."
Grimm's Fairy Tale Classics,グリム名作劇場,TV,24,Finished Airing,"Oct 21, 1987 to Mar 30, 1988",Unknown,add some,Saban Entertainment,Nippon Animation,Other,"Adventure, Comedy, Fantasy, Kids, Magic",24 min. per ep.,G,"7.41, 1161",3398,13,"The series consists of mostly stand-alone episodes which retell different fairy or folk tales.  Despite the title, they are not all based on fairy tales collected by the Grimm Brothers."
High School DxD,ハイスクールD×D,TV,12,Finished Airing,"Jan 6, 2012 to Mar 23, 2012",Fridays at 11 00 (JST),"Genco, Lantis, AT-X, PRA, Showgate, Atelier Musa, Fujimi Shobo",Funimation,TNK,Light novel,"Comedy, Demons, Ecchi, Harem, Romance, School",24 min. per ep.,R+,"7.41, 568964",922629,17899,"High school student Issei Hyoudou is your run-of-the-mill pervert who does nothing productive with his life, peeping on women and dreaming of having his own harem one day. Things seem to be looking up for Issei when a beautiful girl asks him out on a date, although she turns out to be a fallen angel who brutally kills him! However, he gets a second chance at life when beautiful senior student Rias Gremory, who is a top-class devil, revives him as her servant, recruiting Issei into the ranks of the school's Occult Research club.

Slowly adjusting to his new life, Issei must train and fight in order to survive in the violent world of angels and devils. Each new adventure leads to many hilarious (and risqué) moments with his new comrades, all the while keeping his new life a secret from his friends and family in High School DxD!

[Written by MAL Rewrite]"
,ヒカルの碁 特別編 - 裁きの一局! いにしえの華よ咲け!!,OVA,1,Finished Airing,2002,,add some,add some,Studio Pierrot,Manga,"Game, Comedy, Supernatural, Shounen",28 min.,G,"7.41, 2616",5909,3,Alternate version of the story featured in episode 64 of Hikaru no Go.
Hitori no Shita - The Outcast 2,一人之下 THE OUTCAST 2ndシーズン,ONA,24,Finished Airing,"Oct 27, 2017 to May 18, 2018",,Tencent Animation & Comics,add some,Haoliners Animation League,Web manga,"Action, Super Power, Supernatural",24 min. per ep.,R,"7.41, 14799",38310,84,Second season of Hitori no Shita: The Outcast.
,ジュエルペット てぃんくる☆,TV,52,Finished Airing,"Apr 3, 2010 to Apr 2, 2011",Unknown,"TV Tokyo, Sotsu, Sanrio, Studio Jack",add some,Studio Comet,Original,"Fantasy, Magic, School, Shoujo",24 min. per ep.,PG,"7.41, 2891",7966,90,"In Jewel Land, Jewelpets, creatures who has the natural ability to use magic lived in harmony with the Witches, attending the School of Witchcraft and Wizardry to learn to use magic with their Jewel Eyes. However for Ruby, a white Japanese Hare whose magic sometimes fail, is appointed to go to the Human World to search for her partner. But when she used the card the magicians gave her, she was sent to the Human World by accident. In the Human World, A girl named Akari Sakura met her on the beach on her way to school. At first, Akari can't understand her due to her Jewel Land Language until Ruby took a special candy so she could speak and understand human language. As the day passes, Ruby knew about her problems and later apologized. A Jewel Charm appeared on Akari's hand and she realized it that she's chosen by Ruby to be her partner. After that, she decided to enter the Jewel Star Grand Prix, on the prize is that any wish that they wanted will be granted. Will she be the Next Jewel Star and her wish be granted in the end? Or It'll just end in one big disaster...

(Source: Wikipedia) "
,血界戦線 王様のレストランの王様,OVA,1,Finished Airing,"Jun 3, 2016",,TOHO animation,add some,Bones,Manga,"Action, Comedy, Super Power, Supernatural, Fantasy, Shounen",24 min.,R,"7.41, 14349",30902,23,"The Winter 2016 issue of Jump SQ.Crown magazine (pictured), which will go on sale on January 22, has announced that Yasuhiro Nightow's supernatural action manga Kekkai Sensen (Blood Blockade Battlefront) will receive an OVA episode.

The episode, titled ""Ousama no Restaurant no Ousama,"" will be released on June 3, 2016, with the Kekkai Sensen guide book titled Blood Blockade Battlefront Binge Bible. It adapts a story from the eighth volume of the manga. Rie Matsumoto returns to direct the episode, which will be animated by studio Bones. It has an estimated running time of 25 minutes."
Love Live! Sunshine!!,ラブライブ！サンシャイン!!,TV,13,Finished Airing,"Jul 2, 2016 to Sep 24, 2016",Saturdays at 22 30 (JST),"Bandai Visual, Lantis, Magic Capsule, ASCII Media Works, Bushiroad",Funimation,Sunrise,Other,"Music, Slice of Life, School",24 min. per ep.,PG-13,"7.41, 63756",133360,2764,"Chika Takami, a self-proclaimed normal girl, has never been involved in any clubs and lacked any notable talents. However, after a visit to Tokyo, she discovers a stage where even an ordinary girl like her could shine—the world of school idols. Inspired by the former superstar school idol group μ's, Chika is determined to start her own school idol club in her seaside hometown at Uranohoshi Girl's High School. But even before gathering any students to join the group, the aspiring school idol finds her greatest obstacle to be student council president Dia Kurosawa who stands firmly against the creation of the club.

Just when it seems there is no hope, Chika meets Riko Sakurauchi, a transfer student from Otonokizaka High School, home of μ's. Somewhat shy but a talented piano player, Chika believes her to be a promising recruit, though convincing her to join is easier said than done. In spite of that, Chika chooses to charge forward and overcome the obstacles keeping her from forming a school idol group that shines as bright as the nine that came before her.

[Written by MAL Rewrite]"
