name_english,name_japanese,show_type,episodes,status,aired,broadcast_time,producers,licensors,studios,source,genres,episode_length,rating,score_and_scorers,members,favorites,description
Black Jack Capital Transfer To Heian,ブラック・ジャック/平安遷都,Movie,1,Finished Airing,1996,,Beijing Sharaku Art,add some,add some,Manga,Shounen,10 min.,PG-13,"6.50, 611",1929,0,"These original short animated films are shown in the ""300 Inch Theater"" at the Tezuka Osamu World in the Kyoto Station Bldg, as well as a two-picture show including animated films from among Tezuka Osamu's major Manga, and one focuses on historic episodes of Kyoto. 

In this theatre, the Phoenix plays the role of storyteller, introducing two films. The Phoenix chooses a story entitled ""Old Woman"" (""Oba-chan"") from numerous episodes of ""Black Jack"" to discuss the theme of how much love can grow in this short lifetime. In the story, there is a seemingly greedy old woman who is always asking her daughter-in-law for money, and her son and his wife become fed up with the old woman's behaviour. Naturally, there are constant quarrels in the family, and their quiet ordinary life seems to have been lost. 

After accidentally coming to know the family, Black Jack learns that the old woman had her young son, who was dying at the time, treated and saved by a noted doctor who claimed a great amount of money. She has, in fact, been paying for the treatment over some tens of years. Because of her great love for her son, the old woman devoted her entire life to paying for the treatment. 

Not aware of his mother's act, the son feels helplessly hammered and squeezed by his mother and his wife. But when he finally comes to know the truth, he is deeply impressed with the love of his mother, who valued her son's life more than her own. Black Jack asks him if he could love her just as much as she loved him. Explaining that only love valued more highly than life can live forever, the Phoenix then tells a story about the move of the capital to Heian, which was a great national project and an attempt to infuse a city with eternal life.

(Source: official site)"
,BLEACH カラブリ！護廷十三屋台大作戦！,OVA,1,Finished Airing,"Sep 21, 2008",,add some,add some,Studio Pierrot,Manga,"Comedy, Shounen",12 min.,PG-13,"6.50, 3545",11006,27,"An animated adaptation of several chapters of Colourful Bleach. Release with the ""TV Animation BLEACH 5th Anniversary Box."""
,伝心　まもって守護月天！,OVA,8,Finished Airing,"Jun 23, 2000 to Nov 30, 2001",,add some,add some,Toei Animation,Manga,"Comedy, Fantasy, Magic, Romance, Shounen",30 min. per ep.,PG-13,"6.50, 1067",3079,7,"In the peaceful life of modern Japan, Shaorin and Tasuke explore their relationship amid familiar interventions and new challenges. Shaorin begins to discover why she chose to stay with Tasuke, and Tasuke begins to learn the depth of his love toward Shaorin. 

(Source: ANN)"
,名探偵コナン～星影の魔術師～,Movie,1,Finished Airing,2012,,add some,add some,D & D Pictures,Manga,Space,25 min.,G,"6.50, 266",1915,0,"The Japan Aerospace Exploration Agency (JAXA) has planned a huge exhibition to present current progress in space exploration, as well as showcase a set of large, beautiful celestial jewels. But then, a message arrives from infamous Kaitou Kid, who plans to steal the treasure. Conan and the Detective Boys are brought in as added security. Everything is going well... until the power cuts out. With limited time, Conan and company must protect the jewels from Kaitou Kid."
,ドラミ＆ドラえもんズ 宇宙（スペース）ランド危機イッパツ！,Movie,1,Finished Airing,"Mar 10, 2001",,add some,add some,Shin-Ei Animation,Unknown,"Kids, Adventure, Fantasy, Comedy, Sci-Fi, Shounen",16 min.,PG,"6.50, 332",932,0,No synopsis information has been added to this title. Help improve our database by adding a synopsis here.
Dragon Ball GT,ドラゴンボールGT,TV,64,Finished Airing,"Feb 7, 1996 to Nov 19, 1997",Wednesdays at 19 00 (JST),Fuji TV,Funimation,Toei Animation,Manga,"Action, Sci-Fi, Adventure, Comedy, Super Power, Magic, Fantasy, Shounen",23 min. per ep.,PG-13,"6.50, 292751",444181,1749,"Emperor Pilaf finally has his hands on the Black Star Dragon Balls after years of searching, which are said to be twice as powerful as Earth's normal ones. Pilaf is about to make his wish for world domination when he is interrupted by Gokuu Son. As a result, Pilaf flubs his wish and accidentally turns Gokuu back into a child.

After the wish is granted, the Black Star Dragon Balls scatter across the galaxy. However, Gokuu discovers that they will cause the Earth to explode unless they are all brought back within a year. Uniting with his granddaughter Pan and a young adult Trunks, Gokuu sets off on an adventure through the universe to find the Black Star Dragon Balls and save his planet from destruction.

[Written by MAL Rewrite]"
Dragon Quest Great Adventure of Dai! Disciple of Aban.,ドラゴンクエスト　ダイの大冒険　起ち・がれ！！アバンの使徒,Movie,1,Finished Airing,"Mar 7, 1992",,add some,add some,Toei Animation,Game,"Action, Adventure, Magic, Fantasy, Shounen",40 min.,PG-13,"6.50, 462",1565,4,"The second Dragon Quest Dai no Daibouken movie. The story takes place between episode 18 and 19 of the TV series.
"
,エスカクロン,OVA,2,Finished Airing,"Jul 15, 2017",,"DIVE II Entertainment, Avex Pictures",add some,Lerche,Other,"Sci-Fi, Music, Slice of Life",25 min. per ep.,PG-13,"6.50, 1498",6398,8,"The story follows the two titular girls Escha and Chron, whose contrasting personalities are like the sun and moon. The two girls are from Terminal, a future post-apocalyptic world that's empty and monochrome. The two girls cross worlds and arrive in the present day, which they call Transit. As Escha and Chron experience the light (scenery) and sound (music) of the real world, the future world of Terminal gradually changes into a more vivid world.

(Source: ANN)"
,エクスドライバー Nina&Rei Danger Zone,OVA,1,Finished Airing,"Apr 20, 2002",,"Bandai Visual, Genco",Geneon Entertainment USA,Actas,Original,"Action, Sci-Fi, Cars",27 min.,PG-13,"6.50, 1531",3446,3,"The story takes place on a world 100 years in the future, a few years before Lisa and Lorna joined eX-D organization. The world where people drives computer-controlled electrically powered ""AI cars"" which automatically take you where you want to go. However, one AI car mysteriously start to run amok. Now Nina and Rei, as the main driver for ex-D organization have to solve the mystery behind the AI car with evil plot and trap awaiting for them... 

(Source: AniDB)"
,FLUXIMATION,Music,14,Finished Airing,"Sep 20, 2005",,add some,add some,Studio 4°C,Unknown,Music,1 min. per ep.,G,"6.50, 1550",3166,1,"14 short music videos for Utada Hikaru's album ""Exodus"". 

Directed by Koji Morimoto, Kazuto Nakazawa, Hideki Himura, Hiroyuki Kitakubo, Jiro Kanai, Yoshiharu Ashino, Yasuhiro Aoki, Atsuko Fukushima, Tatsuyuki Tanaka, Daisuke Nakayama. 

(Source: AniDB)"
