name_english,name_japanese,show_type,episodes,status,aired,broadcast_time,producers,licensors,studios,source,genres,episode_length,rating,score_and_scorers,members,favorites,description
,象のいない動物園,Movie,1,Finished Airing,"Mar 20, 1982",,add some,add some,add some,Unknown,Drama,1 hr. 19 min.,PG,N/A,221,0,"After the war, concerned brother Hide promises his critically ill sister Miyoko that he will arrange for her to see a real elephant. But when he goes to the zoo to find one, an old man tells him of the tragic day when the zoo animals were slaughtered.

The story is based on true historical events of the Ueno Zoo in Tokyo, where dangerous animals during WW2 were slaughtered in order to prevent them from wreaking havoc in case Allied bombings would let the animals escape. Various methods were used such as starvation, poisoning, death by firing squad, and decapitation. Tokyo was bombed over a year later after the animals' slaughter and Ueno Zoo was never hit.

(Source: The Anime Encyclopedia and Wikipedia)"
Zounds,ZOUNDS,Movie,1,Finished Airing,2003,,add some,add some,add some,Original,Music,4 min.,G,N/A,111,0,"In 2003, Hideaki Motoki began “ZOUNDS,” a project centering around the theme of an ecosystem of sounds. In it, musical organisms called ZOUNDS not only communicate through sound, but also invent an abundant variety of sounds through interaction with the environment and each other, to grow and evolve.

(Source: eizo100)"
,象列車がやってきた,Movie,1,Finished Airing,"Jul 4, 1992",,add some,add some,Mushi Production,Unknown,Adventure,1 hr. 20 min.,PG,N/A,206,0,"An educational film about the Elephant Trains in Japan. During WW2 many zoos were slaughtering their dangerous animals (such as elephants) as a safeguard against Allied bombings which might release the animals. After WW2, the only elephants that remained in Japan were two at Higashiyama Zoo in Nagoya. Special trains called Elephant Trains were arranged to bring children from all over the country to Higashiyama Zoo."
