name_english,name_japanese,show_type,episodes,status,aired,broadcast_time,producers,licensors,studios,source,genres,episode_length,rating,score_and_scorers,members,favorites,description
Ring ni Kakero 1 Episode The Pacific War,リングにかけろ1 日米決戦編,TV,12,Finished Airing,"Apr 6, 2006 to Jun 12, 2006",Unknown,Marvelous,add some,Toei Animation,Manga,"Action, Sports, Shounen",25 min. per ep.,PG-13,"6.51, 554",1701,14,"Immediately after Ryuuji Takane won the Champion Carnival, the U.S. Junior Champion Black Shaft appeared, and challenged the best Japan has to offer, just before the World Tournament is about to happen. Now Ryuuji, Takeshi Kawai, Kazuki Shinatora, Ishimatsu Katori, and Superstar Jun Kenzaki have to prove to not only Black Shaft, but the world, that they are truly world-class boxers before the World Tournament starts. But Shaft is not recruiting boxers for his challenge, but instead gets a life-timer criminal from Death Row, the leader of the Great Angels, one of the toughest gangs in America, a mysterious woman, and the ""Dark Emperor of the South"". Also, Shaft negotiates with Don Juliano, the Italian Junior Champion, just in case...

(Source: ANN)"
Seraphim on the Ring,リングの熾天使,Music,1,Finished Airing,"Aug 29, 2019",,add some,add some,add some,Original,"Action, Music",3 min.,PG-13,"6.51, 132",233,0,"A pro wrestling match in which Miku and Rin (Cutie Angels) play against Meiko and Luka. The ringside commentator is KAITO. The referee is Len.

(Source: Mitchie M's YouTube channel)"
,「ロウきゅーぶ！SS」番外編,Special,1,Finished Airing,"Aug 16, 2013",,"Project No.9, Studio Blanc",add some,add some,Unknown,"Ecchi, Comedy, School, Sports",24 min.,PG-13,"6.51, 1142",3523,1,Recap of the first six episodes aired between episode 6-7. Also contains footage from Ro-Kyu-Bu!: Tomoka no Ichigo Sundae OVA.
,ロビハチ,TV,12,Finished Airing,"Apr 8, 2019 to Jun 24, 2019",Mondays at 23 30 (JST),"Sotsu, Pony Canyon",Funimation,Studio Comet,Original,"Adventure, Comedy, Sci-Fi, Space",24 min. per ep.,PG-13,"6.51, 6723",25270,66,"Ever since they encountered aliens on the moon, humanity's technology has developed by leaps and bounds. Half a century later, even though most have it easy, Robby Yaji and Hacchi Kita cannot seem to catch a break in this advanced society. Robby—a man perpetually struck by misfortune—owes large sums of money to debt collectors due to his poor investments in shady get-rich-quick schemes, and Hacchi finds it difficult to get over the boredom of his mundane life.

The two end up on an adventure of a lifetime when loan shark boss Yang sends Hacchi to collect the money Robby owes. Rather than pay up, Robby blasts off into space and heads to Isekandar, a planet that supposedly brings happiness to anyone who visits. Seeing a chance for some much needed excitement, Hacchi tags along with Robby on this journey filled with alien encounters, giant robot battles, and all sorts of troublemaking—all the while avoiding Yang and his cronies who are desperately combing the universe to find them.

[Written by MAL Rewrite]"
Nozomi In The Sun,さすらいの太陽,TV,26,Finished Airing,"Apr 8, 1971 to Sep 30, 1971",Unknown,Mushi Production,add some,add some,Manga,"Music, Drama",24 min. per ep.,PG-13,"6.51, 202",1090,2,"Two baby girls were born in the same hospital: one of them is the daughter of an aristocratic family while the other belongs to a depraved household which lives in the slums of the city. However, the nurse-in-charge, Michiko, secretly switches the two babies due to a personal grudge, resulting in a change of fates of the girls from then on. Many years later, the lives of the two girls continue to be intertwined with each other, with the rich Miki ill-treating the poor Nozomi, yet both of them hold similar dreams to become a singer. 

(Source: ANN)"
Argevollen,白銀の意思 アルジェヴォルン,TV,24,Finished Airing,"Jul 3, 2014 to Dec 18, 2014",Unknown,"Warner Bros. Japan, KlockWorx, Bushiroad, Showgate",Sentai Filmworks,Xebec,Original,"Action, Mecha",23 min. per ep.,R,"6.51, 14766",40020,41,"The Kingdom of Arandas alliance and the Countries Unification of Ingelmia have been at war for many years. The fortress of the Great Wall has remained firmly closed, but when it creaks open, the complexion of the war starts to change dramatically.

A new recruit, Susumu Tokimune, is waiting for his first battle. He takes the lead without thinking of the possibility of being trapped, and has a fatal encounter with engineer Jamie Hazaford and the Silver Trailkrieger, Argevollen.

The encounter takes place in a corner of the world where fighting has become the norm. This small coincidence is going to change the future of Tokimune's Independent 8th platoon, as well as the course of the war.

(Source: Showgate)"
Armored Trooper Votoms Case; Irvine,装甲騎兵ボトムズ Case;IRVINE,OVA,1,Finished Airing,"Nov 6, 2010",,add some,add some,Sunrise,Original,"Action, Military, Sci-Fi, Drama, Mecha",50 min.,R,"6.51, 1096",2451,3,"Irvine Lester is an AT repairman. In order to make a living with his sister, he is secretly fighting in AT gambling matches and intentionally losing the games for money. But the other fighters find out about his excellent AT maneuvering skills and demand a real match."
,探検ドリランド,TV,37,Finished Airing,"Jul 7, 2012 to Mar 30, 2013",Unknown,"TV Tokyo, Dentsu, GREE",add some,Toei Animation,Unknown,"Adventure, Fantasy",20 min. per ep.,PG,"6.51, 785",5383,12,"Due to the influence of someone who visited her town when she was a child, Princess Mikoto of Elua decides to become a hunter and search for treasure all over the land of Driland. She sets out on her journey with her personal assistant Wallens, but they are soon joined by Pollon, a hunter who dreams of being a hero, and Paan, a wandering knight. As they continue their exploration they begin to sense great danger drawing near."
,天体戦士サンレッド ショートコーナー,Special,4,Finished Airing,"Feb 11, 2009 to Apr 22, 2009",,add some,add some,AIC ASTA,Unknown,"Comedy, Parody, Seinen, Super Power",1 min. per ep.,PG-13,"6.51, 257",760,1,Short corners released exclusively on DVD.
Triage X Recollection XOXO,トリアージX 「RECOLLECTION XOXO」,OVA,1,Finished Airing,"Nov 2, 2015",,DAX Production,Sentai Filmworks,Xebec,Manga,"Action, Ecchi, School, Shounen",23 min.,R+,"6.51, 7115",17698,8,Unaired episode 11 of the Triage X series bundled with the 12th manga volume.
∀ Gundam I Earth Light,劇場版∀ガンダムI 地球光,Movie,1,Finished Airing,"Feb 9, 2002",,"Sotsu, Atelier Musa",add some,Sunrise,Unknown,"Action, Drama, Mecha, Military, Sci-Fi, Space",2 hr. 8 min.,PG-13,"6.51, 1127",3847,0,A movie retelling of the first half of the Turn A Gundam series. 
,我家大师兄脑子有坑,ONA,26,Finished Airing,"Apr 4, 2018 to Jun 23, 2018",,bilibili,add some,add some,Manga,"Action, Adventure, Comedy, Historical, Martial Arts",5 min. per ep.,PG-13,"6.51, 365",2453,10,"The hilarious adventures of the eldest apprentice of a sect who has a problem with his brain.

Dongfang Xianyun is reincarnated as the eldest disciple of the Care-free sect. But the only thing that goes through his mind is to make sure he doesn't end up dying by the hands of the ""main character"". Read as he makes no sense to his sibling disciples while avoiding flags left and right.

(Source: MoroseTrans)"
Yamishibai Japanese Ghost Stories 2,闇芝居 2期,TV,13,Finished Airing,"Jul 7, 2014 to Sep 29, 2014",Unknown,TV Tokyo,Sentai Filmworks,ILCA,Original,"Dementia, Horror, Supernatural",4 min. per ep.,PG-13,"6.51, 20276",34744,23,"For the second time, the masked storyteller returns to tell children tales and legends of horror and woe, such as the tale of a ventriloquist's dummy, a locker that grants wishes, a capsule toy machine that returns lost possessions, and a strange food called Ominie-san.

Building on the foundation that was laid by the first, Yami Shibai 2 is a collection of Japanese scary stories of the unknown and the occult that are truly terrifying, narrated in a style of art that mimics kamishibai storytelling. 

[Written by MAL Rewrite]"
Yatterman Night,夜ノヤッターマン,TV,12,Finished Airing,"Jan 11, 2015 to Mar 29, 2015",Sundays at 22 00 (JST),"Yomiuri Telecasting, Starchild Records, Lantis, Half H.P Studio",Funimation,Tatsunoko Production,Original,"Action, Adventure, Comedy, Drama",24 min. per ep.,PG-13,"6.51, 10743",28932,29,"Several generations after the original Yatterman series, Leopard lives with her mother and guardians, Dorothy, Voltkatze, and Elephantus, just outside the prosperous Yatter Kingdom. She lives a happy if impoverished life, unaware of her ancestral ties to the infamous Doronbow Gang, until she discovers a mural of Doronjo, Boyacky, and Tonzura in a sealed off area of her home. It turns out that Dorothy, Voltkatze, and Elephantus are descendants of the villainous gangsters, which is why they have been forbidden from entering the hero Yatterman's Kingdom!

At first, Leopard vows to never engage in villainous actions like her ancestors, but new circumstances may mean that she must go back on her word, donning the identity of villain in search of true justice. "
,映画 妖怪ウォッチ FOREVER FRIENDS,Movie,1,Finished Airing,"Dec 14, 2018",,Toho,add some,OLM,Game,"Comedy, Demons, Kids, Supernatural",1 hr. 40 min.,PG,"6.51, 186",959,5,"1960s --- Tokyo.

Shin is a boy who lived happily despite being poor, loses his mother who is his only family member, and falls into deep misfortune. Itsuki, a boy who saves Shin also lost his older sister. Those two boys are joined by Tae, a girl who can see youkai and together with Shin's guardian spirit Suu-san and new Youkai such as Nekomata, they take on a mysterious incident in order to retrieve the souls of their precious family! And what is the shocking truth that awaits them...!? An origin story for how Lord Enma became the rule of the Yomakai. 

(Source: Wikipedia, edited)"
,百合星人ナオコサン,OVA,1,Finished Airing,"Feb 15, 2012",,Aniplex,add some,ufotable,Manga,"Comedy, Shoujo Ai",28 min.,PG-13,"6.51, 5295",11067,21,"Naoko-san is an alien from the planet Yuri, who is plotting to conquer the Earth by yurifying it. Misuzu is a junior high girl and is always troubled by Naoko-san, who lives on the roof of her house."
,結城友奈は勇者部所属,Movie,1,Finished Airing,"Mar 18, 2017",,add some,add some,W-Toon Studio,Manga,"Slice of Life, Comedy, Magic, Fantasy",7 min.,PG-13,"6.51, 915",3903,4,"The story takes place in the era of the gods, year 300. Yuuna Yuuki lives an ordinary life as a second year middle school student, but she's also a member of the ""Hero Club,"" where club activities involve dealing with a mysterious being called ""Vertex.""

(Source: ANN)"
Africa Salaryman,アフリカのサラリーマン (TV),TV,12,Finished Airing,"Oct 7, 2019 to Dec 23, 2019",Mondays at 00 30 (JST),"Pony Canyon, Movic, Bandai Namco Live Creative, Ai Addiction, Sammy, Kadokawa Media House, Kadokawa, pH Studio",Funimation,HOTZIPANG,Web manga,"Slice of Life, Comedy",23 min. per ep.,PG-13,"6.51, 4824",17867,36,"Africa no Salaryman is a slapstick workplace comedy that follows the adventures of kind Lion, jaded Lizard, and perverted Toucan, as they trudge through office life while also becoming caught up in antics no regular office worker should. 

Of course, most of these are the fault of Toucan, whose selfish actions and lack of filter still haven't gotten him fired. It's up to Lizard and Lion to keep themselves out of trouble and hang on to their jobs at the office. But trouble is never too far away from these savannah-treading folk.

[Written by MAL Rewrite]"
Ah My Buddha,あまえないでよっ!!,TV,12,Finished Airing,"Jul 1, 2005 to Sep 16, 2005",Unknown,add some,"Nozomi Entertainment, Media Blasters",Studio Deen,Manga,"Comedy, Ecchi, Harem, Romance, Supernatural",24 min. per ep.,R+,"6.51, 30273",64563,94,"Satonaka Ikkou, a 16 year old boy, is a first year trainee at the Saienji Buddhist Temple. He was sent there by his parents to be trained by his grandmother, the Saienji Priestess. At the temple he finds himself surrounded by beautiful female priestesses-in-training. Upon seeing a girl naked, Ikko has the ability to turn into a super-monk, performing massive exorcisms for the good of the temple.

(Source: ANN)
"
801 T.T.S. Airbats,青空少女隊,OVA,7,Finished Airing,"Oct 21, 1994 to Aug 21, 1996",,add some,ADV Films,Studio Fantasia,Manga,"Action, Comedy, Military, Romance, Shounen",28 min. per ep.,R+,"6.51, 2354",6027,11,"When aviation mechanic (and anime fanboy) Takuya Isurugi is transferred to the 801st Tactical Training Squadron, he gets more than he bargained for. Moderated by hard-headed veteran ace Mitsuru Konishi, the ""Airbats"" are an all-female aerial acrobatic team consisting of loose cannons Miyuki Haneda and Arisa Mitaka, karaoke freak and gambling genius Sakura Saginomiya, and junk food lover Yoko Shimorenjaku. Both Haneda and Mitaka do not get along with each other, and their rivalry worsens when they both fall for Isurugi. But with the entire JASDF having doubts about the team, the Airbats must work as a team or face total disbandment. "
,ぶれないアイで,Music,1,Finished Airing,"Aug 29, 2014",,add some,add some,add some,Unknown,Music,4 min.,G,"6.51, 834",1488,0,"Burenai Ai de was released on Miku's anniversary. The song is now used for the AR campaign for Rohto Pharmaceutical's new eye drops ""Digi Eye"". Like much of Mitchie's song titles this one has a double meaning, ""ai"" (love) and ""eye"" both being correct translations.

An app was released in August 2014 that would play a partial version of the song and show a 3D Miku dancing on any surface.

(Source: Vocaloid Wiki)"
God Bless Dancougar,超獣機神ダンクーガ ゴッド・ブレス・ダンクーガ,OVA,1,Finished Airing,"Apr 15, 1987",,Ashi Production,add some,Production Reed,Unknown,"Action, Mecha, Sci-Fi",1 hr. 20 min.,PG-13,"6.51, 454",1307,2,"After destroying the Zorbados Empire, the Jyusenki-tai/Cyber Beast Force has expanded and are training new recruits. But after failing to stop a monster that seems to be a remnant of the Zorbados Empire from destroying a city, the CBF is thrown in jail. Now the CBF have to escape from jail and find out what was behind the monster they fought.

(Source: ANN)"
,コードギアス 亡国のアキト 第5章 映像特典 「劇場予告」,Special,1,Finished Airing,"Apr 22, 2016",,add some,add some,add some,Original,"Military, Comedy",8 min.,PG-13,"6.51, 1480",6177,9,Picture drama included in the Code Geass: Boukoku no Akito 5th Blu-ray/DVD release.
Doraemon It's Winter!,冬だ！一番ドラえもん祭り,Special,1,Finished Airing,"Apr 4, 1986",,Asatsu DK,add some,add some,Unknown,"Kids, Adventure, Fantasy, Comedy, Shounen",23 min.,PG,"6.51, 546",1346,2,No synopsis information has been added to this title. Help improve our database by adding a synopsis here.
,ふたつの胡桃,Special,1,Finished Airing,"Aug 15, 2007",,TV Asahi,add some,Shin-Ei Animation,Unknown,Drama,46 min.,PG,"6.51, 322",887,1,Futatsu no Kurumi is a short story following 12-year-old Ayaka as she is teleported back in time to the fire bombing of Tokyo in 1945 and covers her experiences in this very different and unfamiliar environment. (from saizen-fansubs)
,ガッ活!,TV,25,Finished Airing,"Apr 3, 2012 to Sep 18, 2012",Tuesdays at Unknown,Fanworks,add some,NHK,Original,"Comedy, School",5 min. per ep.,G,"6.51, 2110",6583,7,"In a fictional school, ""Tender Tank"" Rareko is constantly opening absurd yet strangely enthusiastic debates, this way creating a lively classroom life. Bringing up tremendous themes, she and her classmates exchange words like sword-strokes, and here and there even a profound remark is slipped in. 

A fun and informative debate comedy, packed into only five minutes each time. 

(Source: AniDB) "
,ゲゲゲの鬼太郎,TV,45,Finished Airing,"Oct 7, 1971 to Sep 28, 1972",Unknown,add some,add some,Toei Animation,Manga,"Adventure, Super Power, Demons, Supernatural",25 min. per ep.,G,"6.51, 288",1657,3,"Kitarou, a ghost, spends his afterlife helping humans in need of his skills. He thwarts the plans of evil spirits who live to torment humanity."
Record of Grancrest War Reminiscence,グランクレスト戦記 追想,Special,1,Finished Airing,"Mar 24, 2018",,"Aniplex, Bandai Namco Entertainment, Good Smile Company, BS11, ABC Animation, Kinoshita Group Holdings, Kadokawa, Cromea, Sonilude",Aniplex of America,A-1 Pictures,Light novel,"Action, Fantasy",23 min.,R,"6.51, 3368",8784,9,A recap of major events and notable characters from the first 11 episode of Grancrest Senki.
,グレネーダー 〜ほほえみの閃士〜,Special,6,Finished Airing,"Jan 28, 2005 to Jun 29, 2005",,"Shochiku, Kadokawa Shoten",add some,Group TAC,Manga,"Comedy, Parody, Ecchi",1 min. per ep.,PG-13,"6.51, 1741",5540,2,"These the DVD extras, including Several omake and a ""making of"" episode."
,遙かなる時空の中で〜八葉抄〜,OVA,2,Finished Airing,"Dec 23, 2005 to Jan 27, 2006",,Yumeta Company,add some,add some,Visual novel,"Fantasy, Comedy, Supernatural, Demons, Historical, Shoujo",21 min. per ep.,PG-13,"6.51, 527",1840,3,A funny side side story of the series.
Hi☆sCoool! SeHa Girls,Hi☆sCoool! セハガール,TV,13,Finished Airing,"Oct 8, 2014 to Dec 24, 2014",Wednesdays at 22 00 (JST),Sega,Discotek Media,TMS Entertainment,Other,"Comedy, Game",11 min. per ep.,PG-13,"6.51, 4341",10368,47,"The story of the anime will revolve around Dreamcast, Sega Saturn, and Mega Drive, who have just enrolled in SeHaGaga Academy at Tokyo's Haneda Ōtorii station. They are given an assignment needed to graduate by a suspicious teacher, and to clear this assignment, the girls need to enter the world of Sega games. The girls must try their best to graduate without incident.

(Source: ANN)"
,ハックルベリー・フィン物語,TV,26,Finished Airing,"Aug 26, 1994 to Mar 3, 1995",Fridays at 18 00 (JST),Enoki Films,add some,Aubec,Novel,Adventure,20 min. per ep.,None,"6.51, 416",1181,0,Based on Mark Twain's famous book about the adventures of young orphan Huckleberry Finn.
,ジャングル大帝・進めレオ,TV,26,Finished Airing,"Oct 5, 1966 to Mar 29, 1967",Wednesdays at 19 00 (JST),add some,add some,Mushi Production,Manga,"Adventure, Shounen",20 min. per ep.,G,"6.51, 620",1924,9,"Jungle Emperor was such a hit in Japan, that Dr. Tezuka went ahead and produced a sequel in 1966, known in Japan as ""The New Jungle Emperor"" or ""Onward, Leo!"" The trouble (for us in the rest of the world) was that he made the series without having a deal with NBC, and he made it more like his original manga story, which means that there were a lot of characters that died and some of the episodes could be depressing. NBC thought that there was no way they could sell that kind of show, and they were quite happy with the 52 episodes they had, so the New Jungle Emperor series wasn`t seen in this country until 1984, when it was given the title Leo The Lion.

This series was supposed to take place a few years after the original Kimba series. Kimba was an adult, with Kitty as his mate, and they had two cubs. Most of all this series was the story of Rune, the male cub, as he grew and learned to be as strong as his father.

For legal reasons, the producers of the English-dubbed version could not use the name Kimba, so they used the original Japanese names for all the characters.

(Source: Official Website)"
K-ON!! Ura-On!!,うらおん!!,Special,9,Finished Airing,"Jul 30, 2010 to Mar 16, 2011",,add some,Sentai Filmworks,Kyoto Animation,Original,Comedy,3 min. per ep.,G,"6.51, 15590",34281,74,"Extra short anime ""Ura-On!!"" included in the limited edition of the K-ON!! Blu-ray. "
Kämpfer für die Liebe,けんぷファー für die Liebe,Special,2,Finished Airing,"Mar 6, 2011",,"Lantis, DAX Production, RAY",Sentai Filmworks,Nomad,Light novel,"Action, Comedy, Ecchi, Shoujo Ai, Super Power",23 min. per ep.,R+,"6.51, 29061",51520,42,"A two-episode special. They are designated as Episodes 13 and 14, and the first episode is a direct sequel to the previous series while the second episode is about the trans-sex of Natsuru."
Nagasaki 1945 ~ The Angelus Bells,NAGASAKI・1945 アンゼラスの鐘,Movie,1,Finished Airing,"Sep 9, 2005",,Mushi Production,add some,add some,Unknown,"Drama, Historical, Military",1 hr. 20 min.,None,"6.51, 126",745,0,"August 1945. In a converted theological seminary on the outskirts of Nagasaki, a young doctor works to help his patients, as unsettling news comes of a new weapon used by the Americans on the city of Hiroshima. When the second nuclear weapon is dropped on Nagasaki, the hospital staff must work to save lives in the midst of the concentric circles of death that their city has become."
,七つの大罪 「罪の告白 電脳グリモワール!」,ONA,10,Finished Airing,"Sep 30, 2016 to Mar 3, 2017",,add some,add some,KIZAWA Studio,Other,"Comedy, Parody",5 min. per ep.,PG-13,"6.51, 708",4418,4,Animated audio-dramas released online.
Arifureta From Commonplace to World's Strongest,ありふれた職業で世界最強,TV,13,Finished Airing,"Jul 8, 2019 to Oct 7, 2019",Mondays at 23 30 (JST),"AT-X, Sony Music Communications, Bushiroad, Toranoana, Hakuhodo DY Music & Pictures, Overlap, FuRyu, Bandai Namco Arts",Funimation,"Asread, White Fox",Light novel,"Action, Adventure, Fantasy, Harem",23 min. per ep.,PG-13,"6.50, 151955",307607,3159,"The ordinary life of 17-year-old otaku Hajime Nagumo is disrupted when he and his classmates are summoned to a fantasy world and tasked with saving mankind. While his classmates are gifted with impressive abilities useful in combat, Hajime is belittled for only gaining an inferior transmutation skill that lacks any real offensive power. 

During an expedition in the Great Orcus Labyrinth, Hajime is betrayed by one of his classmates, plummeting him to the bottom of an abyss. Though he survives the fall, Hajime is faced with menacing monsters and misfortunes that send him spiraling into a grim nightmare. Desperate to live and return home one day, he resolves to fight for his survival—only to meet an imprisoned vampire he names Yue, who is also seeking to escape the labyrinth. Taking an interest in him, Yue and a few others along the way accompany Hajime on his journey to find a way back home, while steadily transforming from commonplace to the world's strongest. 

[Written by MAL Rewrite]"
Battle Athletes,バトルアスリーテス大運動会,OVA,6,Finished Airing,"May 25, 1997 to Jun 25, 1998",,"TV Tokyo, Genco, Pioneer LDC",Geneon Entertainment USA,AIC,Original,"Action, Comedy, Ecchi, Sci-Fi, Shounen, Space, Sports",32 min. per ep.,PG-13,"6.50, 1718",4579,8,"It is the year 4999 - mankind has long abandoned war in favor of intergalactic competition through athletic events. One of which is an all-female contest for the coveted ""Cosmo Beauty"" title. Akari Kanzaki has just entered the University Satellite in hopes of becoming the latest Cosmic Beauty - a title held by her mother long ago. On her first few days in the university, she meets new friends, encounters fierce rivals, and struggles to become the best of all the Battle Athletes. 

(Source: ANN)"
,美男高校地球防衛部HAPPY KISS!,TV,12,Finished Airing,"Apr 9, 2018 to Jul 2, 2018",Mondays at 01 35 (JST),Sotsu,Ponycan USA,Studio Comet,Original,"Comedy, Magic, Parody, School, Slice of Life",24 min. per ep.,PG-13,"6.50, 2383",9174,36,"In the northern Kanto area in Japan, there is Binan City…

At Binan High School, as per usual, the “Earth Defense Club (lol)” was a club that did nothing. The club members Kyoutarou Shuzenji, Ryouma Kirishima, Nanao Wakura, Taishi Manza, and Ichiro Dogou nonchalantly enjoyed tea while having pointless conversations that amount to nothing.

All of them have now gathered at Kurotama Bath after school. When Ryouma pulls Kyoutarou Shuzenji by his arm out of water that he claims feels too good, together with his towel comes a pretty boy in strange clothing.

These five boys are then dragged into a battle for the heir of the magical kingdom, Honila Land...

(Source: KA)"
