name_english,name_japanese,show_type,episodes,status,aired,broadcast_time,producers,licensors,studios,source,genres,episode_length,rating,score_and_scorers,members,favorites,description
Macron 1,戦国魔神ゴーショーグン,TV,26,Finished Airing,"Jul 3, 1981 to Dec 28, 1981",Unknown,TV Tokyo,"Discotek Media, Saban Entertainment",Production Reed,Original,"Action, Sci-Fi, Parody, Mecha",24 min. per ep.,PG-13,"6.58, 407",2036,1,"A meteor strikes the Earth and is found to emanate a powerful new energy called Beamler, which is used to power a battle robot, GoShogun, and a teleporting fortress, Good Thunder. The Docougar Crime Syndicate, lead by crime lord Neo Neros, try to steal the secret of the energy from the inventor of GoShogun, but he kills himself rather than let them acquire it. His son is targeted by Neo Neros next, but he is taken in by the crew aboard Good Thunder, who travel the world fighting NeoNeros's forces with GoShogun. 

(Source: Wikipedia) "
,スケットダンス SDキャラフラッシュアニメ,ONA,16,Finished Airing,"Mar 7, 2011 to Oct 14, 2011",,add some,add some,Tatsunoko Production,Unknown,"Comedy, School, Shounen",1 min. per ep.,PG-13,"6.58, 785",3047,0,"The SD Character Flash Anime is a special addition to the anime series' official website. Each ""episode"" features a different character, drawn in a super-deformed style, set to a song sung by the character's seiyuu."
At The Mercy of The Sky Specials,宙のまにまに,Special,3,Finished Airing,"Sep 2, 2009 to Dec 16, 2009",,Studio Comet,add some,add some,Manga,"Slice of Life, Comedy, School, Seinen",2 min. per ep.,PG-13,"6.58, 2622",5286,3,"Extra anime shorts included on DVD.

Episode 1: Summer Memories (Vol. 1)
Episode 2: The Meteor Distance (Vol. 3)
Episode 3: Twinkle Star (Vol. 5)

Note: Music video specials are not included in the entry as they don't contain any new scenes."
Passage of Time Tokyo Station,時季（とき）は巡る～TOKYO STATION～,ONA,1,Finished Airing,"Jun 24, 2014",,add some,add some,A-1 Pictures,Original,Slice of Life,5 min.,G,"6.58, 2157",4269,4,"Misaki, a 25-year-old woman who is soon to be married, finds an old photo taken at Tokyo Station and an old, broken pocket watch from her late father. Her father worked at Tokyo Station during his life and was a very strict man in her memory, but she saw his smile from the old photo that she's never seen before. Misaki, in attempt to have the old pocket watch repaired, discovers that a watch store existed in Tokyo Station in the past."
,殿といっしょ,OVA,1,Finished Airing,"Mar 25, 2010",,Frontier Works,add some,Gathering,4-koma manga,"Comedy, Historical, Parody, Samurai, Seinen",37 min.,PG-13,"6.58, 1701",3526,7,Comedy parodying famous samurai generals and historical events.
Tekkaman Blade Burning Clock,宇宙の騎士テッカマンブレード,OVA,1,Finished Airing,"Nov 30, 1999",,add some,add some,Tatsunoko Production,Unknown,"Action, Mecha, Sci-Fi, Shounen",9 min.,R,"6.58, 671",1757,1,"The first OVA, Burning Clock, tells the story of the Aiba family, goes into further detail about Shinya and Takaya's rivalry."
Ronin Warriors Legend of Kikoutei,鎧伝サムライトルーパー輝煌帝伝説,OVA,4,Finished Airing,"Oct 8, 1989 to Jan 11, 1990",,add some,"Bandai Entertainment, Discotek Media",Sunrise,Unknown,"Adventure, Samurai, Fantasy, Shounen",30 min. per ep.,PG-13,"6.58, 786",2059,5,"A strange, silent warrior appears. When the Inferno armor is summoned to battle him, the mysterious warrior calls forth his own armor—a black copy of the Inferno armor! Now, the warriors will find themselves half a world away fighting once more to save humanity, but this time, from their own armor!

(Source: AniDB)"
Yo-kai Watch,妖怪ウォッチ,TV,214,Finished Airing,"Jan 8, 2014 to Mar 30, 2018",Fridays at 18 30 (JST),"TV Tokyo, Dentsu",Dentsu Entertainment USA,OLM,Game,"Comedy, Demons, Kids, Supernatural",23 min. per ep.,G,"6.58, 3192",17617,157,"Primary school student Keita Amano's curiosity is as innocent as any other child's his age. But when one day he decides to venture deeper into the forest, he encounters a small and mysterious capsule. Out from its depths comes Whisper. After 190 years of imprisonment, this ghost-like creature is glad that someone has been kind enough to set him free. He decides to reward Keita by becoming his guardian against supernatural forces. Whisper is one of many Youkai that exist in the world, and provides Keita with a special Youkai Watch, which enables him to see and interact with all the other Youkai.

Youkai Watch follows Keita, Whisper and the cat spirit Jibanyan as they encounter Youkai, befriend them, fix all the trouble that they so often cause, and, with the help of the watch, use the powers of previously encountered Youkai to aid them. Young Keita may have been just an ordinary primary school student when he first encountered the Youkai, but the many adventures that follow his discovery provide him with invaluable experiences and precious life lessons that help him grow."
Norn9,NORN9 ノルン+ノネット,TV,12,Finished Airing,"Jan 7, 2016 to Mar 31, 2016",Thursdays at 21 30 (JST),"Frontier Works, Sotsu, AT-X, Orange, NBCUniversal Entertainment Japan, Tokyo MX, i0+, famima.com, Hakuhodo DY Music & Pictures, Docomo Anime Store, TEAM Entertainment Inc., Chugai Mining, Medicos Entertainment, Toshiba Digital Frontiers",Sentai Filmworks,Kinema Citrus,Visual novel,"Sci-Fi, Adventure, Romance, Fantasy, Josei",24 min. per ep.,PG-13,"6.57, 22695",67915,247,"In a futuristic era, ""The World"" is a peace-bringing entity. Though no one knows its location, it has watched over Earth for so long that war has become merely a fable. The airship Norn's task is to deliver nine ability users to The World.

After collecting the last person, Norn takes off. Included onboard are eight men and three women—Koharu, who has finally escaped her loneliness and detests her destructive power; Mikoto Kuga, born to a noble family, who uses her barrier skill to protect the Norn and those it carries; and Nanami Shiranui, whose ability only brings pain, and who wishes to die for a past sin she has committed. While en route, suspicions arise amongst the passengers when they realize there are too many people onboard.

As they try to determine who has snuck aboard, the ship is attacked by an unknown assailant aiming to stop the Norn's progress at all costs. From this chaos arises questions: why were they granted powers, and what must they do once they reach The World?

[Written by MAL Rewrite]"
Ooya-san wa Shishunki!,大家さんは思春期！,TV,12,Finished Airing,"Jan 10, 2016 to Mar 27, 2016",Sundays at 22 27 (JST),"Genco, bilibili",add some,Seven Arcs Pictures,4-koma manga,"Comedy, Slice of Life",2 min. per ep.,PG-13,"6.57, 20404",39836,30,"Maeda has just moved into his new apartment to live by himself. While unpacking, a cute middle school student named Chie Satonaka suddenly appears in his room. She introduces herself as his new landlord, which pleasantly surprises him as he has never seen a landlord so young. His excitement is boosted further when the gorgeous Reiko Shirai, who lives directly next to him, also introduces herself as his new neighbor.

Ooyasan wa Shishunki! follows the everyday lives of Maeda and his newfound acquaintances, where each day presents itself as an opportunity for new events to unfold and new bonds to be forged.

[Written by MAL Rewrite]"
