name_english,name_japanese,show_type,episodes,status,aired,broadcast_time,producers,licensors,studios,source,genres,episode_length,rating,score_and_scorers,members,favorites,description
Ground Control to Psychoelectric Girl,電波女と青春男,TV,12,Finished Airing,"Apr 15, 2011 to Jul 1, 2011",Unknown,"Starchild Records, TBS","NIS America, Inc.",Shaft,Light novel,"Sci-Fi, Slice of Life, Comedy",24 min. per ep.,PG-13,"7.19, 103544",242542,1024,"Makoto Niwa meticulously tallies the amount of positive and negative youthful experiences he engages in as if to grade his own life. When his parents go overseas, he moves to a new town to live with his aunt, welcoming the change and ready for a fresh start. However, as ordinary as he had imagined his adolescence to be, he could never have taken the existence of an enigmatic long-lost cousin into account.

Upon moving into his aunt's house, he discovers the cousin he never knew about: Erio Touwa. Despite being Makoto's age, she couldn't be more different: Erio chooses to wrap herself in a futon all day rather than to go to school. She even claims to be an alien, and with a speech pattern and personality to back it up, any chance of Makoto's dreamt-of normal life is instantly tossed out the window.

As he meets a string of other eccentric girls in town, Makoto must face the possibility of seeing his youth points in the red. However, he might be surprised by how thrilling an abnormal youth can be.

[Written by MAL Rewrite]"
Dragon Ball Episode of Bardock,ドラゴンボール エピソード オブ バーダック,Special,1,Finished Airing,"Dec 17, 2011",,add some,add some,Toei Animation,Manga,"Action, Sci-Fi, Adventure, Comedy, Super Power, Martial Arts, Fantasy, Shounen",19 min.,PG-13,"7.19, 46362",74935,80,"Shown at Jump Festa 2012, held in December, 2011.

Bardock, Goku's father, who was supposed to have died when Freeza's attack hit him along with the Planet Vegeta, was sent way back in time where the planet was inhabited by strange creatures. There, he meets Freeza's ancestor, a space pirate named Chilled, and fights him to protect the planet.

(Source: AniDB)"
,GEAR戦士 電童,TV,38,Finished Airing,"Oct 4, 2000 to Jun 27, 2001",Wednesdays at 18 00 (JST),Yomiko Advertising,add some,Sunrise,Unknown,"Action, Adventure, Mecha, School, Sci-Fi, Space",23 min. per ep.,PG,"7.19, 848",2579,13,"The story takes place in the future where war machines from evil mechanical alien empire Garufa finally reaches Earth. In order to protect earth, an Earth defense organization called GEAR (Guard Earth and Advanced Reconnaissance) is formed. GEAR has an ultimate weapon in a form of war mecha, GEAR Fighter Dendoh, which is piloted by two elementary school students, namely Kusanagi Hokuto and Izumo Ginga. Can the friendship between Hokuto and Ginga unleashed the full potential power of Dendoh in order to fight Garufa? 

(Source: AniDB)"
,げんしけん オリジナルアニメDVD,OVA,1,Finished Airing,"Dec 20, 2013",,add some,add some,Production I.G,Manga,"Comedy, Parody, Slice of Life",23 min.,R,"7.19, 6892",14636,5,Bundled with the limited edition of the 15th volume of the manga. 
Girls & Panzer OVAs,ガールズ&パンツァー,Special,6,Finished Airing,"Dec 21, 2012 to Jun 21, 2013",,add some,Sentai Filmworks,Actas,Original,"Military, School",12 min. per ep.,PG-13,"7.19, 14875",28495,27,Mini episodes bundled with Blu-rays and DVDs.
,GS（ゴーストスイーパー）美神,TV,45,Finished Airing,"Apr 11, 1993 to Mar 6, 1994",Sundays at 08 30 (JST),add some,Sentai Filmworks,Toei Animation,Manga,"Comedy, Supernatural",24 min. per ep.,PG-13,"7.19, 3158",9500,32,"Reiko Mikami runs a business known as GS (Ghost Sweeper) Mikami, where she exorcises any evil that is bothering people. Her assistant, Tadao, only works for Reiko to see her nude one day. Too bad he isn't getting paid much for his job anyway. Later, Reiko and Tadao meet a spirit named Oniku who comes to help them in solving the mysteries of the supernatural. 

(Source: AnimeNfo)"
Himouto! Umaru-chan,干物妹！うまるちゃん,TV,12,Finished Airing,"Jul 9, 2015 to Sep 24, 2015",Thursdays at 02 14 (JST),"AT-X, TOHO animation, Good Smile Company, Shueisha, BS11, Jinnan Studio, RAY",Sentai Filmworks,Doga Kobo,Manga,"Comedy, School, Seinen, Slice of Life",24 min. per ep.,PG-13,"7.19, 242837",453146,3782,"People are not always who they appear to be, as is the case with Umaru Doma, the perfect high school girl—that is, until she gets home! Once the front door closes, the real fun begins. When she dons her hamster hoodie, she transforms from a refined, over-achieving student into a lazy, junk food-eating otaku, leaving all the housework to her responsible older brother Taihei. Whether she's hanging out with her friends Nana Ebina and Kirie Motoba, or competing with her self-proclaimed ""rival"" Sylphinford Tachibana, Umaru knows how to kick back and have some fun!

Himouto! Umaru-chan is a cute story that follows the daily adventures of Umaru and Taihei, as they take care of—and put up with—each other the best they can, as well as the unbreakable bonds between friends and siblings.

[Written by MAL Rewrite]"
,イナズマイレブンGO クロノ・ストーン,TV,51,Finished Airing,"Apr 18, 2012 to May 1, 2013",Wednesdays at 19 00 (JST),add some,add some,OLM,Game,"Sports, Super Power, Shounen",23 min. per ep.,G,"7.19, 19994",34678,287,"Inazuma Eleven Go: Chrono Stone is set after the Holy Road Soccer Tournament. The hero of of the moment, Tenma Matsukaze, traveled all over Japan to teach soccer to kids.

He returns to Raimon Junior High School after completing his mission, but to his surprise, it's no longer the same Raimon Junior High that he remembers. The soccer club is non-existent, and the members of the champion team in the Holy Road Soccer Tournament have no recollection of taking part in the tournament. They neither remember Tenma nor the game of soccer they loved. As Tenma is baffled by this twist, Alpha, the leader of the Route Agents and captain of Protocol Omega team, suddenly appears before him. Alpha declares that he and his team are responsible for wiping out passion for soccer in Raimon along with the memories of the soccer club members: and Tenma himself is next.

That's when a strange boy named Fei Rune appears just in time to save him. Just who is Fei, and why does Alpha want to eliminate soccer for good? Tenma knows that he needs to do everything in his power to emerge victorious. It's a battle that could seal the fate of soccer forever."
Valvrave the Liberator,革命機ヴァルヴレイヴ,TV,12,Finished Airing,"Apr 12, 2013 to Jun 28, 2013",Unknown,"Aniplex, Dentsu, Mainichi Broadcasting System, Movic, Bandai, Bandai Namco Entertainment",Aniplex of America,Sunrise,Original,"Action, Military, Space, Mecha",24 min. per ep.,R,"7.19, 66110",140190,689,"In the 71st year of the True Era, humans have successfully expanded into space and have started living in independent galactic colonies. The world itself is split between two major nations: the Atlantic Rim United States (ARUS) and the Dorssia Military Pact Federation (Dorssia)—superpowers that wage war against each other on Earth and far into outer space. In this war-torn era, a third faction comprised of Japan and Islands of the Oceanian Republic (JIOR), reside peacefully and prosper economically, maintaining neutrality between themselves and their militant neighbors.

Kakumeiki Valvrave commences in an outer space JIOR colony, where 17-year-old Haruto Tokishima's peaceful life is turned upside down as a sudden Dorssian fleet breaches the neutral colony. Their objective is to seize the Valvraves: powerful, but rumored mechanized weapons hidden deep within Haruto's school, Sakimori Academy. In the ensuing chaos, Haruto stumbles upon one of the targeted Valvraves. With his friends' lives in peril, Haruto enters the mecha and seals a contract for its power in exchange for his humanity. With the aid of L-elf—an enigmatic Dorssian agent and gifted strategist—Haruto and the Valvrave initiate a revolution to liberate the world.

[Written by MAL Rewrite]"
Mars Daybreak,絢爛舞踏祭ザ･マーズ･デイブレイク,TV,26,Finished Airing,"Apr 1, 2004 to Sep 23, 2004",Unknown,add some,Bandai Entertainment,Bones,Original,"Adventure, Comedy, Mecha, Military, Romance, Sci-Fi, Shounen",23 min. per ep.,PG-13,"7.19, 6632",18418,33,"Mars is now almost entirely covered in water. Humanity exists in large city-ships that float through the open seas. But life is hard for those who live on Mars—the economy is in bad shape, work is scarce, and food is expensive and highly prized. Gram and his friends try to do the best they can, but the work keeps drying up. Some have taken to a life of piracy to combat the corruption in the government; one such group is the pirates of the feared Ship of Aurora. And the Earth government, which rules Mars, has dispatched a new team of military pilots to combat them. In their specialized mecha called Round Bucklers, they must make the seas of Mars safe for humanity. Caught in the wrong place at the wrong time, Gram finds himself on the run with the most notorious pirates on Mars. But here's the thing—he's starting to like them!

(Source: Bandai Entertainment)"
,君が主で執事が俺で,TV,13,Finished Airing,"Jan 6, 2008 to Mar 30, 2008",Unknown,"Lantis, Studio Jack, Good Smile Company",add some,A.C.G.T.,Visual novel,"Comedy, Ecchi, Harem, Parody, Romance",25 min. per ep.,R+,"7.19, 45909",97687,231,"Based On a Visual Novel developed by Minato Soft.

Due to family troubles, Ren Uesugi and his sister, Mihato, leave their home. They end up moving to the city but find themselves with a lack of money. Somehow they are able to find work in the form of the Kuonji family's mansion, being employed as servants to the three sisters of the Kuonji family: Shinra, Miyu, and Yume. Being a servant also associates Ren with the mansion's additional servants and the Kuonji sisters' friends.

(Source: Wikipedia)"
Lord Marksman and Vanadis,魔弾の王と戦姫 (ヴァナディース),TV,13,Finished Airing,"Oct 4, 2014 to Dec 27, 2014",Saturdays at 20 00 (JST),"Media Factory, Movic",Funimation,Satelight,Light novel,"Adventure, Ecchi, Fantasy, Harem, Romance",24 min. per ep.,R,"7.19, 127813",252801,849,"In a fantasy version of Europe, a war between enemy countries is brewing. One of these countries, Zhcted, has its seven regions ruled by War Maidens, known as Vanadis. Equipped with powerful dragon-carved weapons, Eleonora ""Elen"" Viltaria, one of the Vanadis, launches an invasion against their neighboring rival country of Brune. Eventually, Tigrevurmud ""Tigre"" Vorn, a young archer and an earl for Brune's region of Alsace, has his entire army decimated at Elen's hands. In a strange twist of events, Elen spares Tigre, and gives him the order, ""Become mine!"" What could be the meaning behind this new alliance?

Adapted from the light novel written by Tsukasa Kawaguchi, Madan no Ou to Vanadis is an epic adventure filled with complex war tactics and beautiful women. Trapped in a multinational conflict, Tigre and Elen are swept up in a war filled with dark secrets, conspiracies, and corruption.

[Written by MAL Rewrite]"
Mahoromatic Automatic Maiden,まほろまてぃっく,TV,12,Finished Airing,"Oct 5, 2001 to Dec 28, 2001",Unknown,"TBS, Pioneer LDC","Sentai Filmworks, Geneon Entertainment USA","Gainax, Shaft",Manga,"Comedy, Ecchi, Military, Romance, Sci-Fi",24 min. per ep.,R+,"7.19, 22534",52308,194,"Vesper is a secret agency fighting an army of alien invaders by using super-powerful battle androids. Mahoro is Vesper's most powerful battle android and has won many battles, but she has little operating time left and soon will cease to function. However, if she lays down her arms and conserves her remaining power, the time she has left can be prolonged to just over a year. Mahoro is given an opportunity to live the remaining time she has as a normal human. She chooses to live as a maid for Suguru, a phenomenally messy middle school student who lives by himself after his family passed away.

(Source: ANN)"
Arte,アルテ,TV,12,Finished Airing,"Apr 4, 2020 to Jun 20, 2020",Saturdays at 22 00 (JST),"MediaNet, Toei Video, KlockWorx, flying DOG, Nikkatsu, Asmik Ace, BS Fuji, NBCUniversal Entertainment Japan, Tokyo MX, Glovision, North Stars Pictures, RAY, Muse Communication",Funimation,Seven Arcs,Manga,"Drama, Historical, Romance, Seinen, Slice of Life",24 min. per ep.,PG-13,"7.18, 26888",72065,176,"In the 16th century, the city of Florence booms with cultural and creative revival in celebration of the Renaissance. Arte, a delightful young lady from an aristocratic family, dreams of being an artist and contributing to the renewal of civilization. However, with her father's death, she ends up losing the only person who believed in her passion for art. Now she is expected to marry a nobleman and live as a refined housewife without disgracing her family name. Reluctant to accept her fate, the headstrong Arte steps into the streets in search of a master artisan to take her on as an apprentice.

In her quest for a mentor, Arte has to face harsh reality when she is completely shunned for being a female artist. No one believes that women are capable of fine craftsmanship, and therefore none are willing to accept her. Luckily, a renowned artisan by the name of Leo is persuaded to take her as his disciple since he has none anyway. And thus, Arte's new life begins, far from the comfort of her noble upbringing. As an apprentice, she must earn her keep while tackling various challenges along the difficult path to becoming a full-fledged, master artisan.

[Written by MAL Rewrite]"
Blood Lad OVA,ブラッドラッド 我輩は猫ではない,OVA,1,Finished Airing,"Dec 4, 2013",,Kadokawa Shoten,Viz Media,Brain's Base,Manga,"Action, Comedy, Demons, Seinen, Supernatural, Vampire",27 min.,PG-13,"7.18, 46831",86534,62,Bundled with the tenth limited-edition volume of Blood Lad manga.
Buddy Complex,バディ・コンプレックス,TV,13,Finished Airing,"Jan 6, 2014 to Mar 31, 2014",Mondays at 00 00 (JST),"Bandai Visual, Lantis, Bandai Namco Live Creative, Bandai Namco Games, Banpresto, Bandai Channel",Funimation,Sunrise,Original,"Action, Sci-Fi, Mecha",24 min. per ep.,PG-13,"7.18, 33187",69986,194,"When ordinary high school student Aoba Watase is suddenly targeted by a giant robot known as a ""Valiancer,"" he is saved by his mysterious classmate Hina Yumihara. After revealing that she and their robotic enemy are from the future, Hina suddenly propels Aoba 70 years forward in order to prevent his death.

Upon arrival, Aoba finds himself in the cockpit of a Valiancer called ""Luxon,"" stuck in the midst of a firefight between the military forces of the Free Pact Alliance (FPA) and Zogilia Republic. After he shows high compatibility with an FPA pilot named Dio Weinberg, the two perform a successful ""coupling,"" allowing them to share experiences and subsequently increase their capabilities and skills. Although Aoba is able to survive this unexpected battle, he is taken into custody by the FPA ship Cygnus, who wishes to interrogate him. While the student's main concern is whether he will ever be able to return home, what he doesn't realize is that he is about to get caught up in a war to protect the world.

[Written by MAL Rewrite]"
Code Geass Akito the Exiled 2 - The Torn-Up Wyvern Picture Drama,コードギアス 亡国のアキト 第2章 引き裂かれし翼竜 ピクチャードラマ,Special,1,Finished Airing,"Dec 25, 2013",,add some,add some,Sunrise,Unknown,"Action, Comedy, Military",12 min.,PG-13,"7.18, 4304",14012,55,"Special included in the Code Geass: Boukoku no Akito 2 BD/DVD release.

"
Cyber City,CYBER CITY OEDO 808 (サイバーシティ オーエド ハチマルハチ),OVA,3,Finished Airing,"Jun 21, 1990 to Oct 4, 1991",,Japan Home Video,Central Park Media,Madhouse,Original,"Action, Adventure, Police, Sci-Fi",45 min. per ep.,R,"7.18, 7618",18852,146,"It is the year 2808. Three convicts are recruited as members of the Cyber Police to keep major criminal activity in Oedo (formerly Tokyo) in check. In return, their life sentences will be reduced by a few years for every mission accomplished. However, to ensure that these convicts are doing their job, the police have secured special collars around their necks. If they attempt to remove their collars or fail to meet the time limit of their mission, the collars will self-destruct. 

(Source: ANN)"
The Mystic Archives of Dantalian Ibarahime,ダンタリアンの書架 荊姫,OVA,1,Finished Airing,"Aug 9, 2012",,"TV Tokyo, Kadokawa Shoten, Kadokawa Pictures Japan, KlockWorx",add some,Gainax,Light novel,"Action, Historical, Mystery",24 min.,PG-13,"7.18, 9725",19149,13,"A DVD containing an all new, original anime episode bundled with the fifth volume of Chako Abeno's Dantalian no Shoka manga adaptation. "
Digimon Fusion,デジモンクロスウォーズ～悪のデスジェネラルと七つの王国～,TV,24,Finished Airing,"Apr 3, 2011 to Sep 25, 2011",Sundays at 06 30 (JST),TV Asahi,Flatiron Film Company,Toei Animation,Original,"Action, Adventure, Fantasy, Comedy, Shounen",25 min. per ep.,PG,"7.18, 10731",21186,50,"Returning to the Digital World, Taiki and Shoutmon learn that the Bagra Army has taken it over and reformatted the world to have Seven Kingdoms, each ruled by a general. 

(Source: AniDB)"
Dirty Pair,ダーティペア,TV,24,Finished Airing,"Jul 15, 1985 to Dec 26, 1985",Unknown,Studio Nue,Nozomi Entertainment,Sunrise,Light novel,"Adventure, Comedy, Police, Sci-Fi",25 min. per ep.,PG-13,"7.18, 4276",20742,150,"If you're in a big trouble, call the World Welfare Work Association or WWWA. They will send out a team of highly trained capable agents called Trouble Consultants who can solve your problems. But if the team they send you is the Dirty Pair, there will be a lot of collateral damage aside from solving your problems.

(Source: AniDB)"
Doraemon the Movie Nobita in the New Haunts of Evil -Peko and the Five Explorers-,映画 ドラえもん 新・のび太の大魔境～ペコと5人の探検隊～,Movie,1,Finished Airing,"Mar 8, 2014",,add some,add some,Shin-Ei Animation,Unknown,"Adventure, Comedy, Fantasy, Kids",1 hr. 49 min.,PG,"7.18, 1822",3105,3,"This is a remake of the 1982 film, Doraemon: Nobita's Great Demon, which was written by original Doraemon co-creator Fujiko F. Fujio.

(Source: Wikipedia)"
,ギャラクシーエンジェルＡ,Special,2,Finished Airing,"Nov 28, 2003",,Broccoli,Bandai Entertainment,add some,Unknown,"Comedy, Sci-Fi",13 min. per ep.,PG,"7.18, 1282",3216,2,Specials from Galaxy Angel 3 DVDs.
GARO -VANISHING LINE-,牙狼〈GARO〉-VANISHING LINE-,TV,24,Finished Airing,"Oct 7, 2017 to Mar 31, 2018",Saturdays at 01 23 (JST),Tohokushinsha Film Corporation,Funimation,MAPPA,Original,"Action, Demons, Supernatural, Fantasy",24 min. per ep.,R,"7.18, 16805",57243,115,"Corruption looms over the prosperous Russell City, where manifestations of negative emotions called Horrors cause chaos and mayhem. The Makai Order is the last bastion of hope against these unholy creatures. Using several small businesses as fronts, they deploy powerful Makai Knights and magical Makai Alchemists to combat the Horror threat. 

Within this secretive order, the highest rank of Golden Knight has been bestowed upon a large, powerful man named Sword, granting him use of the Garo armor and blade. He alone knows of a plot that threatens the entire Makai Order, with his only hint being the phrase “El Dorado."" While fighting a Horror, he encounters Sophia ""Sophie"" Hennis, a teenage girl whose brother's disappearance years ago is also linked to the same phrase. The two agree to work together to uncover the truth behind ""El Dorado"" and the disappearance of Sophie's brother.

[Written by MAL Rewrite]"
Gingitsune Messenger Fox of the Gods,ぎんぎつね,TV,12,Finished Airing,"Oct 7, 2013 to Dec 23, 2013",Mondays at 01 05 (JST),"TV Tokyo, Lantis, MediaNet, Pony Canyon, Movic, AT-X, KlockWorx, Glovision, Shueisha",Sentai Filmworks,Diomedea,Manga,"Seinen, Slice of Life, Supernatural",24 min. per ep.,PG-13,"7.18, 19918",48412,91,"Gintarou is a fox spirit that has been protecting the small Inari temple since the Edo era. Saeki Makoto's family possesses the power to see the gods' agent, but the ability is limited to one living relative at a time. When Makoto's mother passed away while she was still young, Makoto inherited the ability as the sole remaining family member. With the help of fox spirit's power, Makoto and Gintarou help the people of their community, in spite of their many differences.

(Source: MangaHelpers, edited)"
,ゴブリンスレイヤー -GOBLIN'S CROWN-,Movie,1,Finished Airing,"Feb 1, 2020",,Hakuhodo DY Music & Pictures,add some,White Fox,Light novel,"Action, Adventure, Fantasy",1 hr. 25 min.,R,"7.18, 38546",124822,219,"Goblin Slayer and his party head up to the snowy mountains in the north after receiving that request from the Sword Maiden. A small village gets attacked, they encounter a mysterious chapel, and something about how these goblins are acting bothers the Goblin slayer.

First 25 minute is a recap of season 1. Movie is an adaption of the fifth light novel.

(Source: Crunchyroll, Goblin Slayer Wiki)"
,ガンダムビルドファイターズ GMの逆襲,ONA,1,Finished Airing,"Aug 25, 2017",,Sotsu,add some,Sunrise,Original,"Action, Sci-Fi, Mecha",32 min.,G,"7.18, 3325",6750,8,"The day before the ceremony marking the completion of the Yajima Stadium, Nils Nielsen invites Sei Iori, Meijin Kawaguchi, and others to an exhibition battle using the new large-scale battle system he has designed. Now that they are all reunited, Sei attempts to show off the Build Strike Cosmos that he has upgraded for the exhibition, but then he notices something missing... Meanwhile, somebody takes control of the stadium's systems, sealing Sei and the others inside. Before them appears a mysterious group, which has come to challenge them to Gunpla Battle.

(Source: Sunrise)"
Genocidal Organ,虐殺器官,Movie,1,Finished Airing,"Feb 3, 2017",,Twin Engine,Funimation,"Manglobe, Geno Studio",Novel,"Military, Sci-Fi, Psychological",1 hr. 54 min.,R+,"7.18, 8386",35514,107,"The war on terror exploded, literally, the day Sarajevo was destroyed by a homemade nuclear device. The leading democracies transformed into total surveillance states, and the developing world has drowned under a wave of genocides. The mysterious American John Paul seems to be behind the collapse of the world system, and it's up to intelligence agent Clavis Shepherd to track John Paul across the wreckage of civilizations and to find the true heart of darkness—a genocidal organ.

(Source: Viz Media)"
Hayate the Combat Butler! Movie,劇場版 ハヤテのごとく! HEAVEN IS A PLACE ON EARTH,Movie,1,Finished Airing,"Aug 27, 2011",,"TV Tokyo, Geneon Universal Entertainment, Shogakukan-Shueisha Productions, Half H.P Studio, Shogakukan Music & Digital Entertainment",Sentai Filmworks,Manglobe,Manga,"Harem, Comedy, Parody, Shounen",1 hr. 9 min.,PG-13,"7.18, 15575",31675,45,"Hayate, Nagi and the gang spend the last days of summer break at Nishizawa's countryside vacation home. But a mysterious spirit has concocted a scheme to separate the butler from his young mistress. 

(Source: ANN) "
HeatGuy J,ヒートガイジェイ,TV,25,Finished Airing,"Oct 2, 2002 to Mar 26, 2003",Wednesdays at 01 50 (JST),"Bandai Visual, TBS","Funimation, Geneon Entertainment USA",Satelight,Original,"Action, Adventure, Mecha, Police, Sci-Fi",24 min. per ep.,PG-13,"7.18, 5347",15230,62,"In the city of Judoh, Claire Leonelli has inherited leadership of the Mafia group ""Vampire"" following the death of his father. To keep Claire's and other criminal activities in check, the city's Bureau of Urban Safety has Special Services Division operative Daisuke Aurora and the super android codenamed ""J"" (whose identity is apparently kept in secrecy, as androids are banned in the city). With both of them around, crime now has little room to breathe in Judoh.

(Source: ANN)"
"Hetalia Axis Powers Paint it, White!","銀幕ヘタリア Axis Powers Paint it, White (白くぬれ！)",Movie,1,Finished Airing,"Jun 5, 2010",,Frontier Works,Funimation,Studio Deen,Web manga,"Comedy, Historical, Parody",1 hr. 20 min.,PG-13,"7.18, 28876",51297,320,"One day, aliens from the planet Pict launch a devastating invasion on Earth. Their sole purpose is to transform all of humanity into ""Noppera""—featureless creatures with plain white skin, glowing antennae, and no face. This prompts the world's nations to counterattack, but they are all ultimately defeated, as they each launched their offensives separately. 

And so, both the Allied and Axis nations of Hetalia Axis Powers Movie: Paint it, White must band together and unite their powers to stop the alien invasion and save their planet.

[Written by MAL Rewrite]"
