name_english,name_japanese,show_type,episodes,status,aired,broadcast_time,producers,licensors,studios,source,genres,episode_length,rating,score_and_scorers,members,favorites,description
C³ - CubexCursedxCurious,シーキューブ,TV,12,Finished Airing,"Oct 1, 2011 to Dec 17, 2011",Unknown,Starchild Records,Funimation,Silver Link.,Light novel,"Action, Comedy, Ecchi, School, Supernatural",24 min. per ep.,R,"6.67, 68737",151916,257,"From the light novel series written by Minase Hazuki, comes a story of love, action, and comedy. Yachi Haruaki is a high school boy who is naturally resistant to curses. After his father sends him a mysterious black cube, Haruaki awakes to find a nude girl named Fear standing in his kitchen. She’s the human form of the cursed black cube – and an instrument of torture! Utilizing her special abilities, Fear fights alongside Haruaki to defeat other cursed instruments and their owners.

(Source: FUNimation)"
Dino Mech Gaiking,大空魔竜ガイキング,TV,44,Finished Airing,"Apr 1, 1976 to Jan 27, 1977",Unknown,Dynamic Planning,Discotek Media,Toei Animation,Original,"Adventure, Mecha, Sci-Fi, Shounen",24 min. per ep.,PG-13,"6.67, 447",1775,4,"Earth is still in danger: aliens from planet Zeraz are willing to invade our planet because theirs is being swallowed by a Black Hole. Led by Great Darius and his four generals, they begin seeding death and destruction. When an ESP warrior is killed by aliens, professor Hi-Tech understands the danger and builds the huge Space Dragon (Daiku Maryuu) piloted by Pete, and the gint robot Gaiking whose pilot is Sanshiro Shiwobuki, an ex-baseball player. Daiku Maryuu is a big dragon shaped spaceship and his head is the Gaiking torso. When the Gaiking enters the action, Daiku Maryuu launches other Gaiking's components and then it re-unite neck with tail, becoming unbreakable.

The story chronicled the battle between the crew of the semi-transformable carrier Daikuu Maryuu and the Super Mecha Gaiking against an invading race of aliens from the planet Zela, whose home planet is facing destruction by a black hole. The robot Gaiking was piloted by a baseball star named Sanshiro Tsuwabuki (Sanshiro's name was changed to Aries Astonopolis for the English version of the show with the carrier being called the ""Great Space Dragon"", a literal translation of ""Daikuu Maryuu"". Gaiking was notable for being one of the few super robot series to take place in real places outside of Japan, and for being the first Super Robot series to have a mobile carrier for the chief robots.

(Source: ANN)"
"So, I Can't Play H!",だから僕は、Hができない。,TV,12,Finished Airing,"Jul 6, 2012 to Sep 25, 2012",Fridays at 11 00 (JST),"Geneon Universal Entertainment, Sotsu, Lantis, AT-X, KlockWorx, Fujimi Shobo",Sentai Filmworks,feel.,Light novel,"Comedy, Supernatural, Romance, Ecchi",25 min. per ep.,R+,"6.67, 163185",319507,799,"NEVER make a deal with a wet goddess you've only just met. That's a lesson Ryosuke Kaga learns the hard way when he foolishly agrees to let Lisara Restole use some of his ""essence"" to stay in this world. Because despite her smoking hot appearance, Lisara's actually a Shinigami, a Goddess of Death. However, she DOESN'T steal years off his life like any decent Shinigami would do. Oh no, instead she sucks him dry of something much more perverse by leeching off his lecherous spirit and draining his ability to enjoy... er... the things that teenage boys normally spend most of their time thinking about! And now that he's been de-debased and de-debauched by her un-dirty trick, the poor regenerated degenerate's only hope of getting his licentiousness renewed is to join the queen of mental-clean on her quest, since when she leaves our mortal plane he regains his normal immorality! But the termination of the probation of his reprobation isn't guaranteed, because Goddesses of Death can be really harsh mistresses and it's going to be anything but easy to go back to being sleazy! 

(Source: Sentai Filmworks) "
,달려라 하니,TV,13,Finished Airing,"Aug 14, 1988 to Nov 20, 1988",Unknown,KBS,add some,Daewon Media,Unknown,Sports,28 min. per ep.,G,"6.67, 135",576,1,"Hany is a small tomboy and slightly troublesome teenager who lives life a bit carelessly on her own since her Father lives abroad due to work in the Middle East and her Mother died when she was very small. The only thing Hany is very good at is running~ fast! Hong Du-kke is a new track and field coach of her school and takes notice in her talent and gets her to train with him.

(Source: Cute in Korea)"
The Devil Lady,デビルマンレディー,TV,26,Finished Airing,"Oct 10, 1998 to May 8, 1999",Sundays at 01 40 (JST),Dynamic Planning,ADV Films,TMS Entertainment,Manga,"Action, Psychological, Drama, Horror",25 min. per ep.,R+,"6.67, 4244",17318,82,"Fudo Jun is a beautiful supermodel who is idolized by many. She also has a dark secret that not even she knows about at first, for within her veins run the genes that hold the next step in the evolution of mankind. The same blood as the beastlike superhumans that terrorize the city. Unlike the rest of them, though, Jun has managed to hold a tenuous grip onto her humanity, and she is recruited by the mysterious Asuka Ran, member of a secret organization within the government, aimed at controlling, if not eliminating, these berserk destroyers of mankind. Jun, as Devilman Lady, must now exterminate her own kind, but how much longer can she keep her sanity in a situation she never chose in the first place?

(Source: ANN)"
Dirty Pair Flash,ダーティペアFLASH,OVA,6,Finished Airing,"Jan 21, 1994 to Jun 21, 1994",,"VAP, Studio Jack","ADV Films, Nozomi Entertainment",Sunrise,Light novel,"Action, Adventure, Police, Comedy, Sci-Fi",27 min. per ep.,PG-13,"6.67, 2641",6983,21,"Kei and Yuri were originally junior auxiliary agents in the Worlds Works and Welfare Agency (W.W.W.A. or 3WA for short) when the two were paired together under the codename ""Lovely Angels."" Kei was coming off her fourth probation for something she had done, and Yuri's dating exploits were common knowledge, not to mention the two had an instant dislike for each other when they met.

At first, Kei and Yuri refused to work with each other, and Kei even resigned from the 3WA. Afterwards, the two continued to work together, although they earned their nickname, ""the Dirty Pair"" because of all the collateral damage the two (unintentionally) cause in the completion of their cases. And even though the two now get along with one another, they continue to bicker and complain to each other.

Although it is often said that these are younger versions of the original Lovely Angels Kei and Yuri, in truth this series is an alternate universe telling of Dirty Pair, set in the years 2248-49.

(Source: Wikipedia)"
,ドラミ＆ドラえもんズ ロボット学校七不思議！？,Movie,1,Finished Airing,"Mar 2, 1996",,add some,add some,add some,Unknown,Fantasy,31 min.,PG,"6.67, 460",1120,2,"At the graduation day in Robot School, mysterious flow pulls in all of Dorami's friends and classmates, including Doraemon. Doraemons coming to the rescue, trying to solve this mystery and reveal one who stay behind all of this."
Dragon Ball Z The World's Strongest,ドラゴンボールZ この世で一番強いヤツ,Movie,1,Finished Airing,"Mar 10, 1990",,add some,Funimation,Toei Animation,Manga,"Action, Adventure, Comedy, Fantasy, Sci-Fi, Shounen",1 hr.,PG-13,"6.67, 52823",85922,32,"The evil Dr. Wheelo has resurrected his brain into a robot and now desires to inhabit the body of the world's strongest warrior. This means he must face Son Goku and company in a fight for Goku's life. 

(Source: ANN)"
Dragonaut - The Resonance,ドラゴノーツ-ザ・レソナンス-,TV,25,Finished Airing,"Oct 4, 2007 to Mar 27, 2008",Unknown,"Nihon Ad Systems, Sotsu Music Publishing",Funimation,Gonzo,Original,"Action, Drama, Fantasy, Mecha, Romance, Sci-Fi",25 min. per ep.,R+,"6.67, 27555",65139,109,"Twenty years prior to the story's beginning, an asteroid headed for Earth destroys Pluto. Due to Pluto's destruction, the asteroid, which is dubbed Thanatos, becomes temporarily stagnant. Now, in order to avoid Earth's impending destruction, the International Solarsystem Development Agency (ISDA) works on the ""D-Project"", and creates the ""Dragonaut"" after finding a dragon egg under the ocean. This weapon's primary purpose is to destroy the asteroid when the time comes. However, they soon find out that the asteroid is not their only threat, as powerful dragon-like creatures, which are bent on destruction, appear on Earth.

After witnessing a murder by one of the creatures, Jin Kamishina, a lonely 18-year-old boy who lost his family in a shuttle accident two years ago, gets involved in the mysteries of the dragons and becomes the chosen pilot of the Dragonaut. Helping him on his journey is Toa, a mysterious girl who saves him from falling to his death after the creature attacks him. As they get deeper into the mysteries of the dragons, they encounter new friends and enemies, and also begin to develop a closer relationship. 

(Source: Wikipedia)"
,凡人修仙传之凡人风起天南,ONA,16,Currently Airing,"Jul 25, 2020 to ?",,bilibili,add some,"Original Force, Wan Wei Mao Donghua",Novel,"Action, Adventure, Historical, Fantasy",18 min. per ep.,None,"6.67, 170",1626,7,"A poor and ordinary boy from a village joins a minor sect in Jiang Hu and becomes an Unofficial Disciple by chance. How will Han Li, a commoner by birth, establish a foothold for himself in in his sect? With his mediocre aptitude, he must successfully traverse the treacherous path of cultivation and avoid the notice of those who may do him harm. This is a story of an ordinary mortal who, against all odds, clashes with devilish demons and ancient celestials in order to find his own path towards immortality.

(Source: Wuxia World)"
Fumiko's Confession,フミコの告白,ONA,1,Finished Airing,"Nov 8, 2009",,add some,add some,add some,Original,Comedy,2 min.,PG-13,"6.67, 14060",22514,13,"Story about Fumiko, a schoolgirl who just confessed her love. But she gets turned down because the boy wants to concentrate on baseball training. Crying and running downhill through the town, she gains more and more speed..."
,ガールズ＆パンツァー 日本戦車道連盟ニュース,Special,2,Finished Airing,"Jun 21, 2013",,"Lantis, Movic, Showgate",add some,Actas,Original,Comedy,3 min. per ep.,PG-13,"6.67, 727",3733,3,Specials included in the Blu-ray/DVD volume 6.
,一騎当千 集鍔闘士血風録,OVA,1,Finished Airing,"Nov 12, 2011",,add some,Funimation,Arms,Manga,"Action, Ecchi, Martial Arts, Super Power, School",43 min.,R+,"6.67, 5156",14515,3,Ikkitousen OVA.
,イナズマイレブンＧＯ ギャラクシー,TV,43,Finished Airing,"May 8, 2013 to Mar 19, 2014",Unknown,add some,add some,OLM,Game,"Shounen, Sports, Super Power",23 min. per ep.,G,"6.67, 15780",28740,107,"After fighting to free the game of soccer in Japan from the Fifth Sector, the country's soccer squads can once again look forward to stepping onto the field. However, a new challenge will emerge for Japanese players in the form of the Football Frontier International Vision 2, a new tournament that will bring together the best teams each country can assemble.

Tenma Matsukaze and his Raimon teammates, Takuto Shindou and Kyousuke Tsurugi, are once again part of the action as they have been selected to play for the Japanese representative, Inazuma Japan. Much to their surprise, the coach selects eight other players that have no previous experience playing soccer!

Team Inazuma Japan will have a huge mountain to climb, building chemistry and skills as they go along. What they don’t know is that the tournament will set the stage for something much bigger, something out of this world in Inazuma Eleven Go: Galaxy!"
,イナズマイレブンGO TCG CM NG集,Special,1,Finished Airing,"Nov 22, 2012",,add some,add some,OLM,Unknown,Comedy,6 min.,G,"6.67, 806",2286,2,Compilation and bloopers of the Inazuma Eleven Go Trading Card Game commercials presented by Wonderbot.
,ジュエルペット ハッピネス,TV,52,Finished Airing,"Apr 6, 2013 to Mar 29, 2014",Unknown,"TV Tokyo, Sotsu, Sanrio",add some,Studio Comet,Original,"Fantasy, Magic, Shoujo",24 min. per ep.,PG,"6.67, 525",2434,16,"The series focuses on the main heroine Chiari Tsukikage and her friends on managing the Jewelpet Cafe. One day at the magical world of Jewel Land, Lady Jewelina entrusted Ruby the Magical Jewel Box with a mission to make friends and collect Magic Jewels. At the same time she needs to attend the Jewel Academy to do so and open a shop called the Jewelpet Cafe. However with her friends, things didn't go well as planned with several failed mishaps happened to her and the students being scared, in the point of Ruby giving up. But when she met a young girl named Chiari Tsukikage and decides to help, Ruby's life is about to change forever. Now, she and her friends now must work together for the cafe to prosper, stick together through good and bad luck as well as protecting the Jewel Box from being stolen.

(Source: Jewelpet Wikia)"
Jubei-chan the Ninja Girl Secret of the Lovely Eyepatch,十兵衛ちゃん ーラブリー眼帯の秘密,TV,13,Finished Airing,"Apr 6, 1999 to Jun 29, 1999",Tuesdays at 01 15 (JST),Bandai Visual,"Bandai Entertainment, Media Blasters",Madhouse,Original,"Action, Adventure, Comedy, Drama, Shounen",25 min. per ep.,PG-13,"6.67, 6366",15323,31,"Jiyu Nanohana is an ordinary schoolgirl until she runs across a scatterbrained 300 year old samurai who tells her that she is the reincarnation of Yagyu Jubei. With the help of the ""Lovely Eyepatch"" she transforms into the legendary swordsman whenever she needs to use his awesome fighting ability, which she needs to do quite often as a rival clan is dead set on conquering Yagyu to satisfy an old family grudge.

(Source: ANN)
"
,クジラの跳躍,Movie,1,Finished Airing,"Nov 14, 1998",,"Bandai Visual, Ai ga areba Daijobu",add some,Tamura Shigeru Studio,Original,"Drama, Fantasy, Kids",22 min.,G,"6.67, 2900",6722,24,"Time has come to a standstill. A whale appears from a glassy ocean and spends half a day soaring gracefully across the skies. What makes this works extraordinary is the artist's decision to use the transparency and visual bulk of 3D computer graphics only for the un-moving ocean and glaciers. The people, whale, and ships are all hand-drawn, and with this contrast, he invites the viewer into a different world. This is a poem written in animation, the creation of a true fantasy. This project was a considerable under taking, and the results are marvelous.

(Source: ANN)"
Kurogane Communication,鉄コミュニケイション,TV,24,Finished Airing,"Oct 5, 1998 to Mar 29, 1999",Mondays at 19 00 (JST),Pony Canyon,Media Blasters,APPP,Manga,"Action, Adventure, Drama, Sci-Fi",15 min. per ep.,R+,"6.67, 1095",4509,3,"In the aftermath of a great and terrible war, Haruka finds herself the last surviving human on Earth. Though humanity may have been wiped out, she is not entirely alone. Advanced robots have survived the apocalypse, and Haruka lives with five who care for her: Spike, a boyish android who is very attached to her; Trigger, hot-tempered with a penchant for firearms; Cleric, the intelligent problem solver; Reeves, whose thoughtfulness overshadows his intimidating appearance; and Angela, a sword wielding recluse with an aversion towards humans. Residing in a high-rise building at the center of the city, Haruka lives a relatively peaceful life with her mechanical family.

However, her life is far from a stable one. Not only is a lack of resources a concern, but violent, remnant robots from the war roam free, ready to destroy whomever they meet. Kurogane Communication follows Haruka as she tries to survive in an apocalyptic world while facing many dangers that will challenge her daily life.

[Written by MAL Rewrite]"
Mobile Suit Gundam ZZ,機動戦士ガンダムZZ,TV,47,Finished Airing,"Mar 1, 1986 to Jan 31, 1987",Saturdays at 17 30 (JST),"Sotsu, Nagoya Broadcasting Network",Nozomi Entertainment,Sunrise,Original,"Space, Comedy, Mecha, Military, Drama, Sci-Fi",24 min. per ep.,PG-13,"6.67, 13850",29611,124,"In Universal Century 0088, the Anti-Earth Union Group (AEUG) has emerged victorious in its war with the Earth Federation's Titans at the cost of devastating losses. Neo-Zeon, the third faction in the war formerly known as Axis Zeon, remains as powerful as ever. Led by Newtype Haman Karn, Neo-Zeon has been implementing plans to take over both Earth and the space colonies.

The AEUG flagship Argama heads to the Side 1 colony Shangri-La for repairs. Living in the colony is Judau Ashta, a 14-year-old junk dealer who is struggling to make enough money to put his younger sister through school. Upon the discovery of an escape pod containing a former Titans pilot, Judau and his friends are quickly led to the Argama in hopes of stealing a mobile suit which they can sell for a fortune. However, with the arrival of a Neo-Zeon ship seeking to defeat the Argama, Judau and his friends are dragged into to a conflict that will bring them across space and Earth.

[Written by MAL Rewrite]"
,アイドリッシュセブン『MONSTER GENERATiON』,Music,1,Finished Airing,"Jul 23, 2015",,add some,add some,NAZ,Game,Music,1 min.,G,"6.67, 931",1972,3,Official music video for IDOLiSH7's MONSTER GENERATiON album.
,A.I.C.O. -Incarnation-,ONA,12,Finished Airing,"Mar 9, 2018",,"Bandai Visual, Lantis, Hakuhodo DY Music & Pictures, Yamasa, Netflix",add some,Bones,Original,"Action, Sci-Fi",24 min. per ep.,R,"6.66, 31951",72154,151,"In 2035, an incident known as “The Burst” occurs at a Japanese research facility,  giving birth to the rapidly expanding, consuming, and self-replicating ""Matter."" Snaking its way through the remains of dams and military facilities in the Kurobe Gorge, the hostile Matter is besieged by task forces trying to prevent it from reaching the ocean and mercenaries seeking the truth behind its existence.

Aiko Tachibana lives under constant medical surveillance after being rescued from the Matter. She spends her days waiting out her recovery by making paper planes. Soon, her daily life at school is disturbed by the arrival of transfer student Yuuya Kanzaki, who proceeds to point out a number of inconsistencies regarding her body. Why is she never injured, and why does she suddenly no longer need her wheelchair? He claims that there is more to her existence than she has been led to believe, and that she alone holds the key to ending The Burst.

With many factions now interested in Aiko, she and Yuuya must gather allies and embark on a dangerous pilgrimage into the heart of the infested gorge before the net can close around them. To escape the conspiracy moving against them, the pair must face off against the Matter—an enemy that flows like water.

[Written by MAL Rewrite]
"
Broken Blade Picture Drama,ブレイクブレイド ピクチャードラマ,Special,6,Finished Airing,"Jul 23, 2010 to Jul 22, 2011",,add some,add some,"Production I.G, Xebec",Unknown,"Comedy, Fantasy",4 min. per ep.,PG-13,"6.66, 1940",5837,6,DVD/BD extra.
,チョッちゃん物語,Movie,1,Finished Airing,"Mar 20, 1996",,Triangle Staff,add some,add some,Unknown,"Slice of Life, Historical, Drama",1 hr. 16 min.,G,"6.66, 172",978,2,"This feature length film is based on autobiography of Cho ""Chocchan"" Kuroyanagi, who is better known as the mother of an actress Tetsuko Kuroyanagi.

The story starts in pre-World War 2 Japan when Chocchan marries violinist despite the objection of both of their families. They live in poverty, have three children and are happy together. Any misfortune they face with a smile. But new obstacle for their happiness comes when the war breaks out and Chocchan's husband must leave for the front..."
Super Heavy God Gravion Zwei,超重神グラヴィオンツヴァイ,TV,12,Finished Airing,"Jan 8, 2004 to Mar 25, 2004",Unknown,add some,ADV Films,Gonzo,Original,"Adventure, Comedy, Mecha, Sci-Fi, Shounen",23 min. per ep.,R+,"6.66, 3073",7499,14,"After Gravion was able to use its ultimate attack, the Zeravire threat seemed to have temporary stopped. However when it rises back up all of a sudden, the Earth Gult and its trump card, the super robot Gravion, is needed to defend this world again. All this while, the EFA is planning to create their own weapons to counter the Zeravire, the Grand Trooper. Now as they attempt to fend off the Zeravire, the people of the Earth Gult and EFA must protect their future as well as confront their pasts, and unveil the mysteries of the Zeravire.

(Source: ANN)"
,シンデレラガールズ劇場 第2期,TV,13,Finished Airing,"Oct 3, 2017 to Dec 26, 2017",Tuesdays at 21 55 (JST),"Frontier Works, Half H.P Studio, Nippon Columbia, Bandai Namco Entertainment, Anime Consortium Japan",Crunchyroll,"Gathering, Lesprit",4-koma manga,"Slice of Life, Comedy",3 min. per ep.,PG-13,"6.66, 2725",7143,12,The second season of Cinderella Girls Gekijou.
Code Realize ~Guardian of Rebirth~,Code Realize ～創世の姫君～,TV,12,Finished Airing,"Oct 7, 2017 to Dec 23, 2017",Saturdays at 20 00 (JST),"Frontier Works, Lantis, AT-X, DAX Production, Asmik Ace, Sony Music Communications, Hakuhodo DY Music & Pictures, Chugai Mining, Kadokawa",Funimation,M.S.C,Visual novel,"Military, Historical, Romance, Fantasy, Josei",23 min. per ep.,PG-13,"6.66, 17221",63399,246,"Within Cardia Beckford's hazy memories, she can recall her father Isaac and the home where she lives alone, feared as a monster by the townsfolk—for in her body, she carries a deadly substance. Embedded in her chest by her father, the eternally beating heart—also known as Horologium—has the capability to produce infinite power. However, it also makes her skin destroy anything it touches.

Many in London seek the Horologium, including the terrorist organization Twilight, with whom Isaac is rumored to have close ties. To obtain the Horologium's power, the British military forces Cardia to leave her home as their prisoner. But on the road, she is whisked away by the gentleman thief Arsène Lupin, who says he will steal her heart. Joining Lupin and his companions, Cardia begins a journey to discover the truth behind Isaac's connection with Twilight, her missing memories, and the Horologium within her chest.

[Written by MAL Rewrite]"
,コヨーテ ラグタイムショー,TV,12,Finished Airing,"Jul 4, 2006 to Sep 19, 2006",Unknown,"KlockWorx, Studio Mausu, Toshiba Entertainment","ADV Films, Funimation",ufotable,Original,"Action, Adventure, Comedy, Mecha, Sci-Fi, Shounen",24 min. per ep.,PG-13,"6.66, 7171",17579,32,"Mister is a ""coyote"" or space faring outlaw who has been sitting in prison for a year for a traffic offense. Ten days from release, he breaks out with the help of his old partners Bishop and Katana. He then seeks out Franka who has been left in his care by her dead father and takes her on a journey to find her father's treasure. On their heels are the federal investigators Angelica and Chelsea as well as the android assassins of the Criminal Guild, Madame Marciano's Twelve Sisters.

(Source: ANN)"
Dragon Quest Great Adventure of Dai,ドラゴンクエスト ダイの大冒険,Movie,1,Finished Airing,"Jul 20, 1991",,add some,add some,Toei Animation,Game,"Adventure, Demons, Magic, Fantasy, Shounen",31 min.,G,"6.66, 471",1785,4,"It starts with a kid named Dai remembering a story told to him by his grandfather, the monster magician Brass, about the defeat of the Demon Lord Hadlar by the hands of a hero who, as the story progresses, is known to be Avan."
,エクスドライバー the Movie,Movie,1,Finished Airing,"Apr 20, 2002",,"Bandai Visual, Genco",Geneon Entertainment USA,Actas,Original,"Action, Adventure, Cars, Comedy, Sci-Fi, Shounen",1 hr. 2 min.,PG-13,"6.66, 1970",4082,2,"After winning domestic preliminary round, Lisa, Lorna, and Soichi advance to ex-Driver world race competition held in Los Angeles as representative team from Japan. Like a bad omen, they encountered a reckless AI car the first night they arrived at Los Angeles. Although they successfully stopped the car, the local police department is not very happy about that and insists to examine their car overnight. 

However, the problem did not stop just there. The daughter of the United States team`s sponsor, Angela, has gone missing. Lorna realized that Angela was on the reckless AI car before. Soichi who guessed that Angel could be in danger then start looking for her. But Soichi got captured by a mysterious man, and he shocked to find Angela is also there. 

During the confinement inside a warehouse, Soichi finds out that apparently there is a connection between the series of incident and illegal gambling on the ex-Driver world race competition. Now Soichi must escape from the warehouse with Angela... 

(Source: AniDB)"
The Illusionary Golden Bowl,アイシールド21 幻のゴールデンボウル,Special,1,Finished Airing,"Aug 6, 2004",,Bandai Visual,add some,Production I.G,Manga,"Sports, Shounen",29 min.,PG,"6.66, 3132",7497,14,"The Uraharajuku Boarders may have been knocked out of the Kantou Tournament, but a mysterious proposition from a mysterious man may influence the Governor, a graduate of Uraharajuku High School, to allow Uraharajuku to play Sena Kobayakawa and the Deimon Devilbats in the equally mysterious Golden Bowl, whose winner will seemingly receive a place in the Kantou Tournament. However, when Sena and company arrive at the field, they find the Golden Bowl may be something they didn't bargain for against opponents they may not be able to beat. 

(Source: ANN)"
