name_english,name_japanese,show_type,episodes,status,aired,broadcast_time,producers,licensors,studios,source,genres,episode_length,rating,score_and_scorers,members,favorites,description
,劇場版 はいからさんが通る 前編 ～紅緒、花の17歳～,Movie,1,Finished Airing,"Nov 11, 2017",,"Kodansha, Warner Bros. Japan, KlockWorx, Tokyo MX, Asahi Shimbun",Eleven Arts,Nippon Animation,Manga,"Comedy, Historical, Romance, Shoujo",1 hr. 37 min.,PG-13,"7.51, 3964",15447,51,"The story follows Benio ""Haikara-san"" Hanamura, who lost her mother when she was very young and has been raised by her father, a high-ranking official in the Japanese army. As a result, she has grown into a tomboy—contrary to traditional Japanese notions of femininity, she studies kendo, drinks sake, dresses in often outlandish-looking Western fashions instead of the traditional kimono, and is not as interested in housework as she is in literature. She also rejects the idea of arranged marriages and believes in a woman's right to a career and to marry for love.

(Source: ANN)"
Hellsing,Hellsing [ヘルシング],TV,13,Finished Airing,"Oct 11, 2001 to Jan 17, 2002",Unknown,"Fuji TV, Pioneer LDC","Funimation, Geneon Entertainment USA",Gonzo,Manga,"Action, Horror, Supernatural, Vampire, Seinen",23 min. per ep.,R,"7.51, 276843",523872,5616,"Hellsing, an organization specializing in dealing with supernatural threats, is called in to eliminate a vampire that is turning the villagers of Cheddar into ghouls. To put an end to this, the leader of the organization, Sir Integra Fairbrook Wingates Hellsing, dispatches her most formidable asset: a powerful vampire known as Alucard.

Armed with only a single handgun, Alucard wreaks havoc on the monsters plaguing Cheddar. However, a young police officer, Seras Victoria, gets caught up in the chaos and becomes mortally wounded as a result. Taking pity on the girl, Alucard gives her a choice: die as a human or live on as a vampire. Seras accepts his offer and begins a new life as a member of Hellsing.

Though it was her decision, Seras struggles with the fact that she is no longer human. Nevertheless, she must embrace being a creature of the night soon if she wants to survive on the front lines in the fight between humans and the supernatural.

[Written by MAL Rewrite]"
Excel Saga,へっぽこ実験アニメーション エクセル♥サーガ,TV,26,Finished Airing,"Oct 8, 1999 to Mar 31, 2000",Fridays at 01 45 (JST),Victor Entertainment,"ADV Films, Funimation",J.C.Staff,Manga,"Comedy, Parody, Sci-Fi, Shounen",24 min. per ep.,R,"7.51, 39264",91479,934,"It's hard to take over the world, and the enigmatic Il Palazzo, head of the ACROSS organization, knows this, so he aims to start small by conquering the city of Fukuoka. Two young officers, the Excel and her partner Hyatt, are tasked with executing this plan, but standing in their way are the City Security workers, a group consisting of three (mostly) normal guys, a very severe girl, and some robots. Regardless of simplicity, Excel and Hyatt always manage to screw up their missions, which usually result in death and lots of destruction.

Heppoko Jikken Animation Excel♥Saga chronicles the elaborate troubles that the ACROSS officers get themselves into, as Excel and Hyatt never fail to do their jobs improperly.

[Written by MAL Rewrite]
"
Stars Align,星合の空,TV,12,Finished Airing,"Oct 11, 2019 to Dec 27, 2019",Fridays at 01 58 (JST),"TBS, Movic, Magic Capsule, flying DOG",Funimation,8bit,Original,"Slice of Life, Sports, Drama, School",24 min. per ep.,PG-13,"7.51, 39316",91736,874,"Constantly outperformed by the girls' club, the boys' soft tennis club faces disbandment due to their poor skills and lack of positive results in matches. In desperate need of members, Toma Shinjou is looking to recruit capable players, but he fails to scout anyone. Enter Maki Katsuragi, a new transfer student who demonstrates great reflexes when he catches a stray cat in his classroom, instantly capturing Toma's attention. With his interest piqued, Toma ambitiously asks Maki to join the boys' team but is quickly rejected, as Maki doesn't wish to join any clubs. Toma refuses to back down and ends up persuading Maki—only under the condition that Toma will pay him for his participation and cover other club expenses. 

As Maki joins the team, his incredible form and quick learning allow him to immediately outshine the rest of the team. Although this gives rise to conflict among the boys, Maki challenges and pushes his fellow team members to not only keep up with his seemingly natural talent, but also drive them to devote themselves to the game they once neglected. 

This story focuses on the potential of the boys' soft tennis club and their discovery of their own capability, while also enduring personal hardships and dealing with the darker side of growing up in middle school.

[Written by MAL Rewrite]"
,今際の国のアリス,OVA,3,Finished Airing,"Oct 15, 2014 to Feb 16, 2015",,Barnum Studio,add some,"Silver Link., Connect",Manga,"Action, Psychological, Supernatural, Thriller, Shounen",23 min. per ep.,R,"7.51, 13504",30919,83,"Ryouhei Arisu is a high school student with no ambitions and just wants to escape from what he feels is a meaningless reality. One night when he is with his two friends Daikichi Karube and Chouta Segawa, they see an abnormally large firework shoot into the sky, an event which signals a permanent change in their lives.

Blinded by the incredibly bright explosion, the three find themselves transported to what is known as the Borderland. The only inhabitants of this world are participants of a deadly game where specific tasks must be accomplished if they wish to survive. As the three begin playing to determine how they can get back home, Ryouhei finds himself feeling alive for the very first time in his life.

[Written by MAL Rewrite]"
,頭文字D to the Next Stage ～プロジェクトDへ向けて～,Special,1,Finished Airing,"Mar 22, 2003",,"OB Planning, Fuji TV",add some,add some,Manga,"Action, Cars, Sports, Drama, Seinen",1 hr. 10 min.,PG-13,"7.51, 2499",7399,1,"A special that comes with the Fourth Stage DVD-BOX. It is comprised of a recap from First Stage to Third Stage, along with staff commentary and sneak preview of the making of the Fourth Stage."
Kakuriyo Bed and Breakfast for Spirits,かくりよの宿飯,TV,26,Finished Airing,"Apr 2, 2018 to Sep 24, 2018",Mondays at 22 30 (JST),"flying DOG, Kadokawa",Funimation,Gonzo,Novel,"Demons, Drama, Romance, Supernatural",23 min. per ep.,PG-13,"7.51, 29753",92016,855,"Female college student Aoi inherited her deceased grandfather's ability to see ayakashi. One day, while Aoi is feeding some ayakashi, a demon appears! He declares that Aoi's grandfather owed a great debt, and as compensation, Aoi must marry the demon! Aoi refuses, and decides to pay off the debt by working.

(Source: MU)"
,からかい上手の高木さん ウォータースライダー,OVA,1,Finished Airing,"Jul 12, 2018",,add some,add some,Shin-Ei Animation,Manga,"Slice of Life, Comedy, Romance, Shounen",23 min.,PG-13,"7.51, 27272",52473,129,Special episode bundled with the 9th volume of the manga based on Chapter 57-59.
,みなみけ べつばら,OVA,1,Finished Airing,"Jun 23, 2009",,add some,add some,Asread,Manga,"Comedy, Slice of Life",25 min.,PG-13,"7.51, 14147",26768,14,"Valentine's Day is approaching; Hosaka is still trying to express his love to Haruka by cooking, cross-dressing Mako-chan fears to be found out, Kana-""sensei"" teaches the other girls how to ""win"" Valentine's Day, and Fujioka is desperately trying to receive Kana's chocolate."
My Sister Momoko,もも子、かえるの歌がきこえるよ。,Movie,1,Finished Airing,"Jul 23, 2003",,Magic Bus,add some,add some,Book,"Drama, School, Slice of Life",1 hr. 19 min.,G,"7.51, 944",2924,15,"Momoko, who attends a special school, is both mentally and physically disabled. Every morning she becomes peevish because she can't go to the ordinary school with her twin brother Riki. Her family soothes Momoko by singing her favorite song ""The Song of Frogs.""

One day, Momoko shouts encouragement to Riki who's playing dodgeball at an open classroom day and Riki's team wins the game. Ryuji, whose team lost the game, is not impressed and demands that Riki stop bringing his 'idiot sister' to school. Riki totally loses control and hits Ryuji with all his might.

The following year, an experiment in integrated education is implemented and Momoko begins to attend Riki's school. Unfortunately, her physical condition takes a turn for the worse and she's sent to a hospital. Riki and all her classmates want to cheer her up and they set a goal of winning a relay race so that they would be able to tell Momoko the good news. Meanwhile, the fastest sprinter, Ryuichi, insists that he won't be taking part in the race.

(Source: Eleven Arts)"
,エンジェルビーツ! アナザーエピローグ,Special,1,Finished Airing,"Dec 22, 2010",,"Aniplex, Visual Art's",add some,P.A. Works,Original,"Supernatural, Drama, School",2 min.,PG-13,"7.50, 121511",202417,271,"Disillusioned with the afterlife, a new student causes a scene during a classroom test and expresses his doubts about whether getting good grades can really lead to escaping the school and ascending to Heaven. Afterwards,  he is confronted by the new student council president—a familiar face whose past experiences give him powerful insight into the true nature of the school and first-hand knowledge regarding the futility of rebellion.

[Written by MAL Rewrite]"
,エンジェル伝説,OVA,2,Finished Airing,"Dec 13, 1996",,add some,add some,Toei Animation,Manga,"Action, Comedy, School",24 min. per ep.,R,"7.50, 14054",25350,114,"When Seikichi Kuroda—self-proclaimed ""guardian"" and head thug of Hekikuu High School—hears rumors of a first-year transfer student named Seiichirou Kitano terrorizing his entire class, Seikichi tries to intimidate him through authority. However, things go awry when he witnesses something horrifying—Seiichirou has a face so dreadful and haunting that even Seikichi hurries away in fear.

But despite his menacing appearance, Seiichirou has a heart of gold. Inhibited by his poor communication skills and fear-inducing looks, he has never managed to convey his true self to his terrified peers, resulting in his lifelong ostracization. Now the new guardian, Seiichirou discovers that sometimes friends can be found in the most unlikely places and through the most unusual circumstances.

[Written by MAL Rewrite]"
Aura Koga Maryuin's Last War,AURA～魔竜院光牙最後の闘い～,Movie,1,Finished Airing,"Apr 13, 2013",,"Sotsu, Lantis, Pony Canyon, Movic, Delfi Sound, Marvelous AQL",Sentai Filmworks,AIC ASTA,Light novel,"Supernatural, Drama, Romance, School",1 hr. 23 min.,R+,"7.50, 18461",41768,153,"Ichirou Satou is an ordinary high school student who pretended that he was a hero by the name of ""Maryuuin Kouga"" back in middle school, which led to others frequently bullying him. Now that he has left this embarrassing phase behind, he does his best to avoid standing out and live a peaceful life, although he feels the world has become quite dull. But when he makes his way back to school one night to grab a textbook he left in class, he runs into a strange girl wearing a costume.

This girl, Ryouko Satou, happens to be his classmate and is affected by the exact same condition that he once had, holding on to a delusion that she is someone else and dressing up to reflect this. The very next day, Ichirou is asked by his teacher to become friends with Ryouko, to which he adamantly refuses, unwilling to be reminded of his own history. When he sees that she is being bullied just as he once was, however, the boy makes it his responsibility to take care of her and break her free from that which what once plagued him—the perfect job for Maryuuin Kouga.

[Written by MAL Rewrite]"
,BNA ビー・エヌ・エー,ONA,12,Finished Airing,"Apr 9, 2020 to May 6, 2020",,"Movic, Fuji TV, Ultra Super Pictures, BS Fuji, TOHO animation, Hakuhodo DY Media Partners, Bandai Spirits",add some,Trigger,Original,"Action, Super Power, Fantasy",22 min. per ep.,PG-13,"7.50, 86084",183880,1573,"Throughout history, humans have been at odds with Beastmen—a species capable of changing shape due to their genetic ""Beast Factor."" Because of this conflict, Beastmen have been forced into hiding. Anima City serves as a safe haven for these oppressed individuals to live free from human interference.

During a festival celebrating the town's 10th anniversary, Michiru Kagemori, a human who suddenly turned into a tanuki, finds that Anima City is a far cry from paradise. After witnessing an explosion in the square, she is confronted by Shirou Ogami, a seemingly indestructible wolf and sworn protector of all Beastmen. As they pursue the criminals behind the bombing, the two discover that Michiru is anything but an ordinary Beastman, and look to investigate her mysterious past and uncanny abilities. Could she turn out to be the missing link between Humans and Beastmen?

[Written by MAL Rewrite]"
Bobobo-bo Bo-bobo,ボボボーボ・ボーボボ,TV,76,Finished Airing,"Nov 8, 2003 to Sep 30, 2005",Unknown,"Avex Entertainment, Dentsu, TV Asahi",Discotek Media,Toei Animation,Manga,"Sci-Fi, Adventure, Comedy, Shounen",25 min. per ep.,PG-13,"7.50, 24701",69749,948,"In a futuristic world, the Maruhage Empire is a militant organization out to steal everyone's hair, and thus their freedom. But a brave man with an afro of gold and nose hairs of steel stands up against their tyranny. Bobobo-bo Bo-bobo, trained in the ways of hair, rescues a teenager named Beauty from the grunts of the Maruhage Empire. Together, they start on a journey to defeat Emperor Tsuru Tsurulina IV. As Bo-bobo meets new friends and battles foes along the way, so too does he begin his quest to save all the hairs of the world!

Light-hearted and comical, Bobobo-bo Bo-bobo details a wacky adventure in which Bo-bobo and his companions fight all sorts of villains and deviants within the Maruhage Empire, all the while having a fun and exciting adventure.

[Written by MAL Rewrite]"
,DAYS東院学園戦！,OVA,3,Finished Airing,"Mar 16, 2018 to Jul 17, 2018",,add some,add some,MAPPA,Manga,"Sports, School, Shounen",26 min. per ep.,None,"7.50, 3750",18178,56,"Sequel to DAYS.

It will depict the All-Japan High School Soccer Tournament's Tokyo Preliminary Round with Touin Academy.

(Source: anilist.co)"
Hal,ハル,Movie,1,Finished Airing,"Jun 8, 2013",,"Production I.G, Shochiku, Pony Canyon",Funimation,Wit Studio,Original,"Sci-Fi, Drama, Romance, Shoujo",1 hr.,PG-13,"7.50, 51757",103436,316,"Kurumi is a beautiful young woman whose beloved boyfriend, Hal, died in a sudden airplane accident. Left heartbroken and gloomy, she isolates herself in a small house. But this soon comes to change when her grandfather requests the help of a humanoid robot named Q01.

Taking on the appearance of Hal, Q01 is sent to Kurumi's house in order to save her from her state of despair. As Hal returns day after day and increases his efforts, Kurumi, despite her initial reluctance, slowly begins to open up to him and break free from her depression. But there is more to Hal than meets the eye, and these two will soon learn an unexpected truth about this relationship between a human and an android.

[Written by MAL Rewrite]"
Sound! Euphonium the Movie Welcome to the Kitauji High School Concert Band,劇場版 響け！ユーフォニアム～北宇治高校吹奏楽部へようこそ～,Movie,1,Finished Airing,"Apr 23, 2016",,"Lantis, Shochiku",add some,Kyoto Animation,Novel,"Music, School",1 hr. 43 min.,PG-13,"7.50, 5966",19517,19,"After swearing off music due to an incident at the middle school regional concert band competition, euphonist Kumiko Oumae enters high school hoping for a fresh start. As fate would have it, she ends up being surrounded by people with an interest in the high school brass band. Kumiko finds the motivation she needs to make music once more with the help of her bandmates, some of whom are new like novice tubist Hazuki Katou; veteran contrabassist Sapphire Kawashima; and band vice president and fellow euphonist Asuka Tanaka. Others are old friends, like Kumiko's childhood friend and hornist-turned-trombonist Shuuichi Tsukamoto, and trumpeter and bandmate from middle school, Reina Kousaka.

However, in the band itself, chaos reigns supreme. Despite their intention to qualify for the national band competition, as they currently are, just competing in the local festival will be a challenge—unless the new band advisor Noboru Taki does something about it.

[Written by MAL Rewrite]"
The Goddess is a Middle School Student,かみちゅ!,Special,4,Finished Airing,"Nov 23, 2005 to Mar 29, 2006",,Geneon Universal Entertainment,"Funimation, Geneon Entertainment USA",Brain's Base,Original,"Slice of Life, Comedy, Supernatural, Drama",29 min. per ep.,PG,"7.50, 5216",9445,4,"Episodes that were only released on the DVD afterwards and didn't air on TV. Episode numbers: 7.5, 9.5, 10.5, 12.5.

For a complete list of episodes and the order they're included in the Kamichu! DVD/BD box set, see the More Info tab."
Kingsglaive Final Fantasy XV,KINGSGLAIVE FINAL FANTASY XV,Movie,1,Finished Airing,"Jul 9, 2016",,Square Enix,add some,add some,Game,Action,1 hr. 55 min.,PG-13,"7.50, 27718",46176,135,"For years, the Niflheim Empire and the kingdom of Lucis have been at war. The empire, having dominated most of the world of Eos, covets the power of the last known Crystal, which is held in Lucis' capital city, Insomnia.

In order to protect his people from these advancing forces, King Regis Lucis Caelum CXIII used the power of the Crystal to surround Insomnia with a magical wall. Along with this barrier, Regis assembled an elite military task force known as the Kingsglaive. By drawing their power from the king, the Kingsglaive protect Lucis' borders from the onslaught of the empire and other forces that would do them harm.

One such member of the Kingsglaive is Nyx, a man nicknamed ""The Hero"" by his fellow warriors due to his arrogance and desire to save everyone. However, his pride gets the better of him, causing him to disobey his captain's orders, resulting in a demotion. Now, Nyx spends his days guarding the city gates, but things begin to change once word gets out that Regis plans to sign a peace treaty with their sworn enemies.

[Written by MAL Rewrite]"
La corda d'oro primo passo,金色のコルダ ～primo passo～,TV,25,Finished Airing,"Oct 2, 2006 to Mar 26, 2007",Unknown,"Aniplex, Hakusensha, Koei, TYO",Sentai Filmworks,Yumeta Company,Visual novel,"Harem, Music, Comedy, Drama, Magic, Romance, School, Shoujo",24 min. per ep.,PG-13,"7.50, 41903",84424,1141,"Seiso Academy is a prestigious high school that sorts students into two majors: General Studies, characterized by distinct grey uniforms, and Music Studies, characterized by pristine white uniforms. While rushing to class one morning, General Studies student Kahoko Hino has a chance encounter with Lili, a small fairy searching for someone with the ability to see her. Lili flies away, and Kahoko, puzzled by their meeting, continues on her way.

Later that day, the participants of a school-wide music competition are announced, and all of them are, unsurprisingly, Music Studies students—at least until Kahoko's name is read out. Immediately tracking down Lili, the small fairy gifts Kahoko a magical violin and convinces her to participate in the competition.

Kiniro no Corda: Primo Passo follows Kahoko's endeavors alongside Lili, as the young student must now face the challenges of competition and go head-to-head against her competitors while navigating a new world of classical music.

[Written by MAL Rewrite]"
Is This a Zombie? Of the Dead OVA,これはゾンビですか? OF THE DEAD 「はい、身の丈に合ってます」,OVA,1,Finished Airing,"Oct 20, 2012",,"Kadokawa Shoten, AT-X, Kadokawa Pictures Japan, KlockWorx, flying DOG",Funimation,Studio Deen,Light novel,"Action, Harem, Comedy, Supernatural, Magic, Ecchi",26 min.,R+,"7.50, 48227",89486,57,An unaired OVA episode of Kore wa Zombie Desu ka? of the Dead. It is the 11th episode and was bundled with the sixth volume of the manga. 
Black Butler II Specials,黒執事II シエル・イン・ワンダーランド,Special,6,Finished Airing,"Oct 27, 2010 to May 25, 2011",,Square Enix,Funimation,A-1 Pictures,Manga,"Fantasy, Supernatural, Comedy, Parody, Shounen",25 min. per ep.,PG-13,"7.50, 48306",95815,491,"According to the Kuroshitsuji website, there are 6 OVAs included in the DVD releases.

DVD 2: Ciel in Wonderland (Part 1)
This re-imagines the cast of Kuroshitsuji II as characters in Lewis Carroll's Alice in Wonderland story.

DVD 3: Welcome to the Phantomhive's
This is meant to be like a simulation game. Elizabeth invites a lady (perhaps the viewer) to join her at a ball held at the Phantomhive mansion.

DVD 5: The Making of Kuroshitsuji II
This is a Hollywood style documentary with behind the scenes interviews with Sebastian, Ciel, Claude and Alois etc.

DVD 6: Ciel in Wonderland (Part 2)
This re-imagines the cast of Kuroshitsuji II as characters in Lewis Carroll's Alice in Wonderland story.

DVD 8: The Tale of William the Shinigami
William and Grell have to train new shinigami and reminisce about when they were training partners.

DVD 9: The Spider's Intention
The life in Trancy household and how those work under Alois is caring for him."
Spiritpact Bond of the Underworld,灵契 2,TV,12,Finished Airing,"Feb 23, 2018 to May 11, 2018",Saturdays at 21 00 (JST),Tencent Animation & Comics,add some,Haoliners Animation League,Web manga,"Action, Comedy, Magic, Shounen Ai, Supernatural",24 min. per ep.,PG-13,"7.50, 9529",26101,168,"In this new season, we will discover the backstory of Tanmoki and who will learn through his memories who was his ancestor Rakugetsu.

(Source: ANN)"
,LOVE STAGE!! チョットジャナクッテ,OVA,1,Finished Airing,"Nov 22, 2014",,Kadokawa Shoten,Sentai Filmworks,J.C.Staff,Manga,"Comedy, Romance, Shounen Ai",23 min.,PG-13,"7.50, 24677",46676,79,"Bundled with volume four of the manga series Love Stage!! written by Eiki Eiki. 

This OVA takes place right after the final episode of Love Stage!! the anime series, which is based on the manga volumes 1-3. "
The Irregular at Magic High School The Movie - The Girl Who Summons The Stars,劇場版 魔法科高校の劣等生 星を呼ぶ少女,Movie,1,Finished Airing,"Jun 17, 2017",,"Aniplex, Studio Mausu",Aniplex of America,8bit,Light novel,"Action, Sci-Fi, Supernatural, Magic",1 hr. 30 min.,R,"7.50, 53293",122832,388,"In the story, the seasons have changed and it will soon be the second spring. Tatsuya and Miyuki have finished their first year at First Magic High School and are on their spring break. The two go to their villa on the Ogasawara Island archipelago. After only a small moment of peace a lone young woman named Kokoa appears before them. She has abandoned the Naval base and she tells Tatsuya her one wish.

(Source: ANN)"
Marmalade Boy,ママレード・ボーイ,TV,76,Finished Airing,"Mar 13, 1994 to Sep 3, 1995",Sundays at 08 30 (JST),Asahi Broadcasting,"Discotek Media, Tokyopop",Toei Animation,Manga,"Comedy, Drama, Romance, Shoujo",24 min. per ep.,PG-13,"7.50, 15338",40308,557,"Miki Koishikawa is a high school student who enjoys a very simple life. However, her ordinary life is about to be turned upside down, and she may not be able to handle everything that is coming her way.

After a very ""fun"" holiday in Hawaii, her parents have decided to get a divorce. As if this wasn’t enough of a shock for the poor girl, she also discovers that they will soon be re-marrying and swapping partners with another couple who they met on holiday. In order to include Miki in this shocking turn of events, they ask her to give the new couple a chance, and set up a dinner date with everyone. Miki may have tried to be emotionally prepared for her new parents, but what she was not expecting was their handsome son Matsuura Yuu.

Miki develops an instant crush for Yuu. What starts off as a lovely friendship between them soon develops into romantic feelings which they are both finding hard to control. But more trouble is ahead in their relationship, as both Miki and Yuu have admirers of their own who are trying very hard to keep them separated."
Only Yesterday,おもひでぽろぽろ,Movie,1,Finished Airing,"Jul 20, 1991",,Tokuma Shoten,GKIDS,Studio Ghibli,Manga,"Slice of Life, Drama, Romance",1 hr. 58 min.,G,"7.50, 44891",89399,710,"Taeko Okajima is a 27-year-old, independent woman who spent her entire life in Tokyo. Looking to unwind from the rush of the big city, she decides to visit her family in the country to help out during the harvest.

On the train there, Taeko vividly recalls her memories as a schoolgirl in the initial stages of puberty, as if she is on a trip with her childhood self. A young farmer named Toshio picks her up at the station, and they quickly develop a friendship. During her stay, Taeko forms strong bonds with family and friends, learning the contrasts between urban and rural life, as well as the struggles and joys of farming.

Nostalgic and bittersweet, Omoide Poroporo takes on Taeko's journey as an adult woman coming to terms with her childhood dreams compared to the person she is today.

[Written by MAL Rewrite]"
