name_english,name_japanese,show_type,episodes,status,aired,broadcast_time,producers,licensors,studios,source,genres,episode_length,rating,score_and_scorers,members,favorites,description
"Orochi, the Eight-Headed Dragon",わんぱく王子の大蛇退治,Movie,1,Finished Airing,"Mar 24, 1963",,add some,add some,Toei Animation,Unknown,Adventure,1 hr. 26 min.,PG,"6.26, 594",1702,6,"Susanoo, the youngest child of the creation gods Izanagi and Izanami, is a mighty warrior, easily able to defeat tigers with his bare hands. After his mother dies, Susanoo is devastated. Determined to travel to Heaven to find her, he carves a boat out of a tree, and along with his rabbit companion, Akahana, he prepares to cross the ocean.

As Susanoo does not know how to reach Heaven, he first visits his brother, Tsukuyomi, leader of the Night Kingdom, and his sister, Amaterasu, leader of the Light Kingdom. While his siblings can warn Susanoo of the dangers he faces, they are unable to stop him or provide him with the directions to Heaven. As Susanoo continues his journey to the ends of the Earth, Orochi, an eight-headed dragon, awakens to stand in Susanoo's path.

[Written by MAL Rewrite]
"
,Wind -a breath of heart-,Special,4,Finished Airing,"Dec 10, 2004",,Rondo Robe,add some,add some,Unknown,"Comedy, Romance, School",12 min. per ep.,PG-13,"6.26, 659",1753,0,"Four 13 minute episodes that came with the DVDs.  Episodes 9.5, 10.4, 10.8 and 12.5."
What's Up Mechadoc,よろしくメカドック,TV,30,Finished Airing,"Sep 1, 1984 to Mar 30, 1985",Saturdays at 18 30 (JST),add some,add some,Tatsunoko Production,Manga,"Action, Cars, Comedy, Police, Sports",23 min. per ep.,PG-13,"6.26, 195",1376,2,"Mechadock is a powerful race car obtained from a simple economy car, which is able to race on any ground."
,アンジェリーク　聖地より愛をこめて,OVA,3,Finished Airing,"Jan 25, 2001 to Jun 27, 2001",,Yumeta Company,add some,add some,Unknown,"Adventure, Comedy, Drama, Fantasy, Romance, Sci-Fi, Shoujo",30 min. per ep.,PG,"6.26, 708",2451,1,The queen is collecting some jewels that apparently endanger the whole universe if they fall into the wrong hands. But Zephel screws up and loses one of the jewels. What should he do now?
Princess Anmitsu,あんみつ姫,TV,51,Finished Airing,"Oct 5, 1986 to Sep 27, 1987",Sundays at 18 00 (JST),Fujipacific Music,add some,Studio Pierrot,Manga,"Comedy, Historical, Shoujo",24 min. per ep.,G,"6.26, 140",840,4,"Based on a manga by Kurakane Shousuke serialised in the Shoujo magazine.

Anmitsu is a tomboy princess living happily at the Amakara Castle. Our story begins when she turns ten years old and gets a home tutor Castella from the Pudding Kingdom as a present from her parents. But they were very wrong when they thought that Anmitsu will finally start studying seriously, because she will frequently escape from the castle looking for some fun, and in the process she will learn a lot about the outside world, make numerous friends and cause endless trouble for the inhabitants of the castle who are supposed to take care of her."
,小さな便り、大きな便り。,ONA,1,Finished Airing,"Dec 8, 2017",,add some,add some,add some,Original,"Drama, Music",4 min.,G,"6.26, 126",261,0,"Kao Japan is a chemical and cosmetics company. They commissioned Tekken for a short to promote their cat litter and liner products. Chiisana Tayori, Ookina Tayori. means ""small news, big news."" where the small news is pee and the big news is poop. Urological diseases often found in cats are sometimes noticed in urine/small news.

Kao Japan wants owners to be more proactive in checking their cats' health. And their product is a special pellet kitty litter with a litter tray that has a drainage shelf. A special pad goes on the lower section which catches urine. Owners are able to then see the volume and color of the urine to know if their cat is sick which traditional kitty litter does not provide."
,エルフ版 下級生 あなただけを見つめて…,OVA,4,Finished Airing,"Nov 24, 1997 to Jun 26, 1998",,"Pink Pineapple, KSS",add some,add some,Visual novel,"Harem, Romance, School, Drama",30 min. per ep.,R+,"6.26, 996",2779,5,"High school students Mizuho Yuuki and Miko Kamiyama are best friends. Miko likes fellow classmate Tohru Nagase. Mizuho is determined not to get in the way of their budding relationship. But underclassmate Ai Minamizato also likes Tohru. Tohru must decide which girl he likes the most. 

(Source: ANN)"
,FAKE!FAKE!,Music,1,Finished Airing,"Apr 30, 2014",,Space Shower Music,add some,add some,Unknown,Music,3 min.,G,"6.26, 781",1279,0,"Music video for the song ""fake!fake!"" by A Crow Is White."
,Fate/Grand Order -MOONLIGHT/LOSTROOM-,Special,1,Finished Airing,"Dec 31, 2017",,add some,add some,Lay-duce,Game,"Action, Supernatural, Magic, Fantasy",32 min.,PG-13,"6.26, 15497",33426,22,"Short centering on a ""Lost Room"" where you can find what was lost—or those who lost. This room, which belongs to no one, lies forgotten in a corner of Chaldea.

(Source: ANN)"
The Silver Guardian,銀の墓守り〈ガーディアン〉,TV,12,Finished Airing,"Apr 1, 2017 to Jun 17, 2017",Saturdays at 21 00 (JST),Emon,Funimation,Haoliners Animation League,Web manga,"Adventure, Fantasy",13 min. per ep.,PG-13,"6.26, 31359",84526,114,"High school student and gamer Suigin Riku attends the prestigious Shinryou Private Academy, a school for the elite and the children of the wealthy. But rich or wealthy are not words that describe Suigin; in fact, he is dirt poor and must work many part time jobs to pay for his tuition. During one such job, he dives into a pool to save his pet cat, fully aware that he cannot swim. Luckily, he is saved by Rei Riku, the beautiful and popular daughter of a game developer, and he falls in love with her.

He is also drawn to another girl: a new friend he meets in Dungeon Century, his favorite online RPG. But when the game is scheduled to shut down, he knows his adventures with her will soon end. However, the day after the game is shut down, he finds out that Rei and the online girl are one and the same. Soon after, Rei gives Suigin a new game meant to replace Dungeon Century—a tomb raiding game called Grave Buster. But when Rei is suddenly kidnapped, Suigin is pulled inside Grave Buster to save her.

Gin no Guardian follows Suigin as he plays through Grave Buster to save Rei, while uncovering the secrets hidden within the game.

[Written by MAL Rewrite]"
Haiyoru! Nyaruani Remember My Mr. Lovecraft,這いよる!ニャルアニ リメンバー・マイ・ラブ(クラフト先生),TV,11,Finished Airing,"Dec 11, 2010 to Feb 26, 2011",Unknown,SoftBank Creative,add some,DLE,Light novel,"Comedy, Sci-Fi",4 min. per ep.,PG-13,"6.26, 10001",24524,7,"The story centers around Nyarlko, a formless Cthulhu deity who can take on the shape of anyone it wishes, but particularly the shape of a seemingly ordinary silver-haired girl. Mahiro Yasaka is a normal high school student who is chased by aliens one night, until ""Nyarlko"" saves him.

(Source: ANN)"
Flowers Will Bloom,花は咲く,Special,1,Finished Airing,"Mar 20, 2013",,add some,add some,MAPPA,Original,Music,4 min.,G,"6.26, 750",1558,2,"""Hana wa Saku"" is a song written by Shunji Iwai and Yoko Kanno to support NHK's reconstruction efforts in the areas hardest hit by the 2011 Great Eastern Japan Earthquake. An animated music video was created in commemoration of the two-year anniversary of the disaster and broadcast on NHK G."
Happy Happy Party!,Happy Happy Party!,Music,1,Finished Airing,"Apr 13, 2017",,add some,add some,add some,Original,Music,2 min.,G,"6.26, 674",1385,0,"Music video of ""Happy Happy Party"" included in the 5th Single CD of Poppin' Party."
Aria the Scarlet Ammo AA,緋弾のアリアAA（ダブルエー）,TV,12,Finished Airing,"Oct 6, 2015 to Dec 22, 2015",Tuesdays at 23 00 (JST),"flying DOG, Fujishouji",Funimation,Doga Kobo,Manga,"Action, School, Shoujo Ai",23 min. per ep.,PG-13,"6.26, 30077",77837,79,"Akari Mamiya, a first-year student from Tokyo Butei High, idolizes the S-rank Butei Aria Holmes Kanzaki and wishes to follow in her footsteps. Despite only being an inept E-rank Butei, Akari's resolve to improve remains strong. After the idea of having an Amica contract (a senior-student mentorship program) with Aria is brought up, Akari submits a request form attempting to establish said contract. Her classmates and friends do not expect Aria to accept Akari's request, mainly because of the girl's strict selection process, but to everyone's surprise, Aria gives Akari a chance through a test, which Akari miraculously passes! However, Aria will not officially make Akari her Amica until Akari meets her standards.

Training under Aria will be no easy feat, as she has to concurrently manage her relationships with her friends. Will Akari have what it takes to walk down the same path as her idol?

[Written by MAL Rewrite]
"
Labyrinth Of Flames,炎のらびりんす,OVA,2,Finished Airing,"Sep 25, 2000 to Dec 21, 2000",,Bandai Visual,Central Park Media,Studio Fantasia,Original,"Adventure, Comedy, Ecchi, Samurai",33 min. per ep.,R+,"6.26, 3975",8390,12,"Meet Galan, a Russian spastic geek who`d do anything to be a real, live samurai. But that`s just an impossible dream... or is it? When his friend Natsu, who is a successor of Japanese emigrants family, gives him the gift of an ancient sword, strange events unfold, and even stranger people drop out of the sky to attack. Now Galan must overcome his ineptitude and join a bunch of beautiful women in a wacky romp through a kingdom that time forgot. Hey, what could be better?

(Source: AniDB, edited)"
,今生缘,Music,1,Finished Airing,"Jul, 2008",,add some,add some,add some,Unknown,Music,5 min.,PG-13,"6.26, 354",632,0,"A famous music video tells a sentimental story of a small group of gangsters in China, and their growth from childhood to their mid-age."
,ジャングル大帝 劇場版,Movie,1,Finished Airing,"Jul 31, 1966",,Tezuka Productions,add some,Mushi Production,Unknown,"Adventure, Shounen",1 hr. 38 min.,G,"6.26, 198",796,2,"The first 2 minutes of this film are taken from the Jungle Emperor Leo (1965) TV series, while the rest is all original. Tezuka was very pleased that this film conveyed his story accurately, something he wasn't able to do with the TV series. 

(Source: ANN)"
,下級生,TV,13,Finished Airing,"Jul 2, 1999 to Sep 24, 1999",Fridays at 00 35 (JST),Pink Pineapple,add some,add some,Visual novel,"Harem, Drama, Romance, School",25 min. per ep.,PG-13,"6.26, 630",3979,3,"When Tsuyoshi rushed to school as usual, he found a girl who tried to help a kitten which couldn't get down from a tree. It was Minamizato Ai who had loved Tsuyoshi secretly for a long time.

(Source: AniDB)"
,荒野の少年イサム,TV,52,Finished Airing,"Apr 4, 1973 to Mar 27, 1974",Wednesdays at 19 00 (JST),Fuji TV,add some,Shin-Ei Animation,Unknown,"Action, Adventure, Shounen",24 min. per ep.,G,"6.26, 144",736,4,"The adventures of Isamu, a young boy living in the Far West, searching for his real father."
,クラゲの食堂,OVA,1,Finished Airing,"Mar 9, 2016",,"Starchild Records, Grooove",add some,Zexcs,Light novel,"Slice of Life, Drama",29 min.,PG-13,"6.26, 4470",12521,14,"In the story, the protagonist Youtarou Misaki finds himself lying on the beach one day. He is picked up by Arashi, who manages a restaurant called Kurage no Shokudou. When asked who he is, the protagonist tells a lie that he lost his memory—but he remembers everything, including the fact that his twin brother died.

(Source: ANN)"
Guyver Out of Control,強殖装甲ガイバー,Movie,1,Finished Airing,"Dec 13, 1986",,Movic,add some,Production Reed,Unknown,"Action, Sci-Fi, Horror, Super Power",54 min.,R+,"6.26, 2258",5086,24,"The plot of this OVA is a rough adaptation of the first four chapters of the Guyver manga. It covers the same basic elements of these chapters; Genesis of the guyver, Fight with Vamore, Fight with Guyver 2 and the introduction of Guyver 3. Main differences are the exclusion of Tetsuro and his replacement by Mizuki, The replacement of Lisker with a female Agent ""Valcuria"", and thus a female Guyver 2. There is also a look at Sho's psychology of how he deals with his situation including a very harsh moment where his friends are assassinated in cold blood.

One night, high school student Sho Fukamachi discovers a mysterious metal object. Then in a blinding flash of light, Sho finds that he has accidentally fused with the Guyver, a mecha of mysterious alien design.

Now, to save his girlfriend, Mizuki Segawa, along with the entire world, Sho must become the Guyver to fight the Chronos Corporation and their biocreatures, called Zoanoids, who are hell-bent on world domination.

(Source: Wikipedia)"
Magical Meow Meow Taruto,魔法少女猫[まじかる にゃん にゃん]たると,TV,12,Finished Airing,"Jul 5, 2001 to Sep 27, 2001",Unknown,"Bandai Visual, Dentsu",Bandai Entertainment,"Madhouse, TNK",Unknown,"Comedy, Magic",22 min. per ep.,G,"6.26, 1540",5644,8,"Taruto is a little cat who has just moved to a new city with her master's family. Taruto spends her days making friends and exploring her new home town. She also has a knack for getting herself into trouble. And it turns out that Taruto just might be a legendary magical princess. Almost none of Taruto’s friends believe that she can use magic or that she’s a princess, but Taruto is determined to prove it to them. But Taruto's magic is so unpredictable, you never know what's going to happen when she uses it. 

(Source: ANN)"
Magical Idol Pastel Yumi,魔法のアイドル パステルユーミ,TV,25,Finished Airing,"Mar 7, 1986 to Aug 29, 1986",Unknown,add some,add some,Studio Pierrot,Original,"Comedy, Fantasy, Kids, Magic, Shoujo",23 min. per ep.,G,"6.26, 431",2000,5,"Yumi is a girl who likes flowers and comics. When Kakimaru and Keshimaru, flower fairies, see Yumi in trouble, they decide to help her. They tell Yumi that flower fairies give magic tools to children who take care of flowers. Kakimaru and Keshimaru, which sees Yumi's pure affection towards flowers, decide to give her a magic cane and a pendant. By using the cane, any pictures she drew in the air takes form and becomes real. However, once the pendant starts to flash, there are only 30 seconds left before the power of the magic disappears. Yumi always tries to use her magical power in a good manner, but she is hasty and goofy. As a result, her magic often causes a big trouble around her.  This is the fourth series of Magical Girl Series.

(Source: Studio Pierrot)"
Miss Machiko,まいっちんぐマチコ先生,TV,95,Finished Airing,"Oct 8, 1981 to Oct 6, 1983",Thursdays at 19 30 (JST),TV Tokyo,add some,Studio Pierrot,Manga,"Comedy, Ecchi, School",25 min. per ep.,R+,"6.26, 213",2502,7,"Machiko Mai is the newest teacher at Asama Elementary; she's young, beautiful, and has the perfect proportions—traits that attract the attention of not only her students, but the rest of the perverted faculty as well. Whether it's luring her in and spraying up her skirt with a hose or leaps and bounds to grab her breasts, there's nothing that Machiko's first year students won't try to do. Regardless of her embarrassing plight, Machiko is always a good sport and tries her best to help out her students—at any cost to her dignity!"
,마리 이야기 (korean),Movie,1,Finished Airing,"Jan 18, 2002",,add some,ADV Films,add some,Unknown,"Drama, Fantasy, Slice of Life",1 hr. 18 min.,PG,"6.26, 977",2975,4,"When office worker Nam-woo receives a package from childhood friend Jun-ho it transports him back to their last summer together. Back to their hometown in a small fishing village it the last few days before Jun-ho left for boarding school in Seoul. When a marble and an abandoned lighthouse had the power to transport him to a fantastic world where a mysterious flying girl named Mari lived.

(Source: ANN)"
Goku II Midnight Eye,MIDNIGHT EYE　ゴクウII,OVA,1,Finished Airing,"Dec 22, 1989",,add some,Urban Vision,Madhouse,Manga,"Action, Sci-Fi, Adventure, Mystery, Super Power, Seinen",53 min.,R+,"6.26, 2080",3875,4,"Goku, the lone wolf private detective is back, contracted by Yoshiko, a mysterious, beautiful and very afraid woman, to find and save her brother, Ryu. Will Goku be able to protect Yoshiko from her step father's soldiers long enough to find her brother? Meanwhile Ryu, the unfortunate subject of a military experiment gone bad, leaves a trail of bodies behind him and has no intention of being found or saved by anyone. Will Goku have to kill the man he is supposed to save? Will even his omniscient cybernetic eye and sceptre be enough to help him defeat this indestructible killing machine?

(Source: AniDB)"
,ミス・モノクローム-The Animation- MANAGER,OVA,1,Finished Airing,"May 25, 2014",,Starchild Records,add some,SANZIGEN,Original,"Music, Slice of Life, Comedy",4 min.,G,"6.26, 2698",5549,3,Limited edition OVA episode of Miss Monochrome.
Squishy! Black Clover,むぎゅっと！ブラッククローバー,ONA,8,Finished Airing,"Jul 1, 2019 to Aug 19, 2019",,add some,add some,DLE,Manga,"Comedy, Parody, Magic, Fantasy, Shounen",7 min. per ep.,PG-13,"6.26, 2061",7693,22,SD Black Clover short comedy specials released exclusively on dTV.
,マブラヴ オルタネイティヴ トータル・イクリプス 総集編 クライマックス直前スペシャル,Special,1,Finished Airing,"Nov 19, 2012",,TV Tokyo,add some,"Satelight, ixtl",Unknown,"Action, Mecha, Military, Sci-Fi",24 min.,R+,"6.26, 3388",7118,4,"A recap primarily of episodes 3-19, this special aired prior to episode 20.  It also included the new OP/ED of the series and a preview of what's to come in future episodes."
,あしたのジョー パイロットフィルム,Special,2,Finished Airing,"Nov 6, 1969 to Dec 22, 1969",,add some,add some,Mushi Production,Unknown,"Drama, Shounen, Sports",10 min. per ep.,PG-13,"6.25, 1251",3058,2,Pilot episodes.
,アサルトリリィ Bouquet,TV,Unknown,Currently Airing,"Oct 2, 2020 to ?",Fridays at 01 28 (JST),add some,Funimation,Shaft,Other,"Action, Magic, Fantasy",24 min.,None,"6.25, 5698",40834,141,"In the near future, humanity faces imminent destruction from mysterious creatures known as ""Huge."" The world wages war against the Huge, and develops the anti-weapon ""CHARM"" (Counter Huge Arms) by combining science and magic. CHARM works more effectively when used by teenage girls, and those who use the weapons are revered as ""Lilies."" The Lilies are trained at military academies called ""Gardens,"" which also serve as bases to protect and advise people. This is a story about girls who aim to become Lilies so they can protect Earth. 

(Source: MAL News)"
,爆球連発!!スーパービーダマン,TV,18,Finished Airing,"Jan 4, 1999 to Sep 27, 1999",Unknown,add some,add some,Xebec,Unknown,"Game, Adventure, Kids",40 min. per ep.,G,"6.25, 348",988,5,"Tamago Tosaka is a fifth-grader who loves nothing more than a B-Daman battle. One day, Ganma Nishibe, a talented bead-warrior, is transferred to Tamago's school. Their B-Daman battles set the stage for this story. Beginning as rivals, the two come together to prepare for the B-Daman championships. The two boys come to trust and help one another as they work toward their shared goal.

(Source: d-rights)"
Blade,ブレイド,TV,12,Finished Airing,"Jul 1, 2011 to Sep 16, 2011",Unknown,add some,Marvel Entertainment,Madhouse,Other,"Action, Drama, Horror, Vampire",24 min. per ep.,R,"6.25, 8889",22235,24,"The story revolves around Blade, a ""Daywalker"" vampire hunter who was born with vampire and human blood after a vampire attacked his mother. While visiting Japan on a mission, Blade tracks down Deacon Frost, the vampire who killed his mother. Blade confronts ""Existence,"" a mysterious organization composed of vampires modified by Frost. 

(Source: ANN)"
I Dream of Mimi,ぶっとび!!CPU,OVA,3,Finished Airing,"Apr 25, 1997 to Sep 26, 1997",,"Pink Pineapple, Studio Jack",Nozomi Entertainment,OLM,Manga,"Comedy, Ecchi, Magic, Sci-Fi, Seinen",27 min. per ep.,R+,"6.25, 2806",6662,12,"Embarrassed to be the only member of the Electric Brain Study Society who doesn’t own a computer, Akira Takaoka is thrilled when an electronics store advertises a PC9821 for only ninety-eight thousand yen. The deal is limited to the first five customers; unfortunately, by the time Akira gets there, the PCs are sold out. However, a mysterious man in the back alley offers him the exact same deal. Akira takes the deal, only to realize that this PC is not a 9821 version, but a 2198 version instead. It turns out that the PC2198 is an advanced bio-type computer that needs a nearly constant input of sperm to function!

The PC2198, named Mimi, now has to defend Akira from the evil Apple Nacintosh sisters who want to take over the entire Japanese PC market. Will the embarrassed Akira be able to supply Mimi with what she needs to win?

[Written by MAL Rewrite]"
The Daichis Earth's Defence Family - Into the Depths of Marital Hell,地球防衛家族 絶叫!愛の迷宮地獄,Special,1,Finished Airing,"Nov 25, 2002",,"Bandai Visual, Group TAC",add some,add some,Original,"Action, Game, Drama",22 min.,PG-13,"6.25, 115",399,0,"An alternative episode 11 (or episode 11.5) released on the DVD set of Chikyuu Bouei Kazoku. 

The world's first experience simulation game park ""Amber Crystal"" opened in Chiba Prefecture. Opening day only allows couples inside with a special ticket. Seiko and cameraman Hayakawa, Mamoru and Junko-sensei are there to meet up. While saying ""because it is a game, it's okay to do anything"", Mamoru guards as a knight figure to raise XP to steadily power up. Meanwhile, Seiko who became a mage, realized that this game park is the invasion of the space monster and goes on to approach the final boss of the game."
,超人戦隊バラタック,TV,31,Finished Airing,"Jul 3, 1977 to Mar 5, 1978",Unknown,add some,add some,Toei Animation,Unknown,"Sci-Fi, Adventure, Mecha",25 min. per ep.,PG-13,"6.25, 121",677,3,"Late at night, at a lake surrounded by a peaceful forest, a mysterious spaceship landed on the water. The group that emerged from that ship kidnapped the head of space engineering, Professor Katou, and his family. 

The Professor's second son, American football player Yuuji, who had run away from home was in the middle of a game and knew nothing of what had happened.

The four young people watching him were Mark, Dickey, Franco, and Yuri. They were a team of four psychics who had been training in a secret base. They had seen the previous night's events and believed them to be an alien attack. Believing their only option to be the transforming robot Baratack, they used their psychic powers to kidnap Yuuji.

Baratack could only move by combining the powers of Yuuji and the other four acting as one. When all five, including the astonished Yuuji, cried ""Pentagoras Unite!” Baratack emerged. Yuuji was overcome with a violent rage, his fighting spirit burning to defeat the Golteus reptile army.

(Source: Official Website)"
,シンデレラガールズ劇場 第3期,Special,3,Finished Airing,"Aug 24, 2018 to Oct 24, 2018",,add some,add some,Gathering,4-koma manga,"Game, Music, Slice of Life, Comedy",3 min. per ep.,PG-13,"6.25, 177",969,0,Specials included on the BD/DVD of Cinderella Girls Gekijou 3rd Season. 
Ein's Summer Vacation,アインのなつやすみ,Special,1,Finished Airing,"Dec 21, 2012",,add some,add some,Sunrise,Original,Adventure,1 min.,G,"6.25, 8001",19268,22,Picture drama featuring Ein.
,名探偵コナン 不思議実験やってみよう!,OVA,1,Finished Airing,"Jun 26, 1998",,add some,add some,add some,Manga,Mystery,17 min.,PG-13,"6.25, 216",1372,2,No synopsis information has been added to this title. Help improve our database by adding a synopsis here.
,ドラゴンコレクション,TV,51,Finished Airing,"Apr 7, 2014 to Mar 30, 2015",Mondays at 08 15 (JST),Konami,add some,OLM,Card game,"Fantasy, Shounen",11 min. per ep.,PG-13,"6.25, 1080",4373,7,"Through an unexpected turn of events, an ordinary elementary school student, Hiro Enryuu, finds himself in the world of the ""Dragon Collection"" game. This is a world called Dragon Earth, where gods, humans, and monsters exist side by side. Those who roam this world using a magic book, called a Grimoire, and cards to summon monsters and search for treasures that bear the powers of dragons are called Dracolle Battlers. Despite his bewilderment, Hiro becomes a Dracolle Battler and, together with the friends he meets there, begins his adventure to become a legendary Dragon Master!

(Source: Crunchyroll)"
,Follow Me,Music,1,Finished Airing,"Oct 31, 2012",,Warner Music Japan,add some,add some,Unknown,"Slice of Life, Romance, Music, Drama",4 min.,G,"6.25, 1319",2059,1,"A story about an unborn child who brought two unfortunate people together and gave them a second chance with a better future.

A beautiful alternative music video for Muse's song ""Follow Me"" animated by Tekken.
"
,ゲゲゲの鬼太郎　地獄編,TV,7,Finished Airing,"Feb 8, 1988 to Mar 21, 1988",Unknown,add some,add some,Toei Animation,Unknown,"Adventure, Fantasy, Comedy, Supernatural, Horror",25 min. per ep.,G,"6.25, 125",672,0,The origins of Kitarou.
,銀河漂流バイファム 消えた12人,OVA,1,Finished Airing,"Feb 25, 1985",,add some,add some,Sunrise,Original,"Sci-Fi, Adventure, Space, Comedy, Mecha",57 min.,G,"6.25, 151",446,0,"This episode is a sidestory and can be inserted somewhere between episodes #18 and #21. This is a ""mystery"" and so the present writer does not tell the whole story. The Janus is sailing towards Taut when something unexpected happens."
