name_english,name_japanese,show_type,episodes,status,aired,broadcast_time,producers,licensors,studios,source,genres,episode_length,rating,score_and_scorers,members,favorites,description
,スレイヤーズぷれみあむ,Movie,1,Finished Airing,"Dec 22, 2001",,"Starchild Records, chara-ani.com, GANSIS",ADV Films,Hal Film Maker,Light novel,"Adventure, Comedy, Fantasy, Magic, Shounen",33 min.,PG-13,"7.21, 8379",16835,8,"Lina and Gourry travel to a seaside town named Acassi, where octopus tentacle is a delicacy. However, the octopus meat carries a curse that dooms the eater to only speak Takogo (octopus language). Amelia, Zelgadiss, and Xelloss all show up, and the main four characters (Lina, Gourry, Ameria, Zelgadiss) get cursed. The octopi enlist the power of a mazoku to get rid of the humans once and for all. The white sorceress Ruma must learn the cure to the curse from her long-lost master in order to save the town. 

(Source: ANN)"
,SSSS.GRIDMAN,TV,12,Finished Airing,"Oct 7, 2018 to Dec 23, 2018",Sundays at 00 00 (JST),"Mainichi Broadcasting System, Pony Canyon, Tsuburaya Productions, KlockWorx, Ultra Super Pictures, Graphinica, Docomo Anime Store, Fields, BS11",Funimation,Trigger,Original,"Action, Sci-Fi, Mecha",23 min. per ep.,PG-13,"7.21, 79357",186485,865,"Yuuta Hibiki wakes up in the room of Rikka Takarada and notices two things: he has no memories, and he can hear a mysterious voice calling his name from a nearby room. On further inspection, he finds a robot—which introduces itself as Hyper Agent Gridman—behind the screen of an old computer. Much to Yuuta's surprise, Rikka cannot hear Gridman, nor can she see the ominous monsters looming over a thick fog as it envelopes the town outside.

Another giant monster materializes in the city and proceeds to wreak havoc. Amidst the confusion, Yuuta is once again drawn to the old computer and merges with Gridman. Suddenly, he appears in the middle of the battle and is forced to fight the monster. Together with Rikka and fellow classmate Shou Utsumi, Yuuta forms the ""Gridman Alliance"" to defeat the monsters plaguing the city and find whoever is responsible for their emergence.

[Written by MAL Rewrite]"
Gargantia on the Verdurous Planet Specials,翠星のガルガンティア 完全新作,Special,2,Finished Airing,"Aug 28, 2013 to Oct 25, 2013",,add some,Viz Media,Production I.G,Original,"Action, Sci-Fi, Adventure, Mecha",24 min. per ep.,PG-13,"7.21, 19445",35411,13,"Episodes 14 and 15, released with the first and third BD/DVD volumes. "
Tears to Tiara,ティアーズ・トゥ・ティアラ,TV,26,Finished Airing,"Apr 6, 2009 to Sep 28, 2009",Unknown,"Dwango, Bushiroad, Showgate, Good Smile Company",Sentai Filmworks,White Fox,Visual novel,"Action, Adventure, Fantasy, Magic",24 min. per ep.,PG-13,"7.21, 25532",68086,185,"As the Holy Empire rises to power, the neighboring lands begin to gradually fall under its control. The Empire's conquest eventually reaches the small island of Erin, home to the Gael tribe. There, a priestess named Riannon is kidnapped to be offered as a living sacrifice to the demon king Arawn, a malevolent being rumored to have caused untold destruction in the past.

Riannon's brother, First Warrior Arthur, rescues her, when Arawn suddenly materializes before them as a handsome grey-haired man. Hiding his true identity and remaining enigmatic, Arawn pledges his power and leadership to the tribe's cause and joins Arthur, Riannon, and their merry band of friends—including a talented swordsman, an agile hunter, and a group of ecstatic pixies—as they fight back against the Empire, while uncovering the dark secrets of the land along the way.

[Written by MAL Rewrite]"
Tenchi Forever!,天地無用！　ｉｎ　ＬＯＶＥ２　遥かなる想い,Movie,1,Finished Airing,"Apr 24, 1999",,"AIC, Genco, Pioneer LDC, Nippon Cultural Broadcasting","Funimation, Geneon Entertainment USA",add some,Unknown,"Sci-Fi, Drama, Romance, Shounen",1 hr. 35 min.,R+,"7.21, 6793",13579,23,"Tenchi runs off into the woods to spend some time alone after his friends have another argument. While lost in thought, he hears a voice coming from a camellia tree. Tenshi approaches it and vanishes through a portal.

Six months later, Tenchi still has not returned home. Though most have given up the idea of ever finding him, his friends refuse to lose hope and have split up into two teams. Aeka and Ryoukou remain on Earth to investigate while Washuu, Sasami, Kiyone, and Mihoshi comb the rest of the galaxy in search.

Their efforts eventually pay off when Tenchi's energy is picked up on their radar. However, the happy reunion will have to wait as the girls gear up for their biggest challenge yet—Tenchi seems to have completely forgotten them and is living happily with another woman. Instead of solving their problems, finding Tenchi has left them with even more questions.

[Written by MAL Rewrite]"
THE IDOLM@STER SHINY FESTA,アイドルマスター シャイニーフェスタ,OVA,3,Finished Airing,"Oct 25, 2012",,add some,add some,A-1 Pictures,Game,"Comedy, Drama, Music",23 min. per ep.,PG-13,"7.21, 6966",15195,13,"New anime episodes released with each of the three iDOLM@STER Shiny Festa PSP games (Honey Sound, Funky Note, and Groovy Tune)."
Uta no Prince Sama Legend Star,うたの☆プリンスさまっ♪マジLOVE レジェンドスター,TV,13,Finished Airing,"Oct 2, 2016 to Dec 25, 2016",Sundays at 01 00 (JST),"Broccoli, Movic, MAGES., Hakuhodo DY Music & Pictures, King Records",Sentai Filmworks,A-1 Pictures,Visual novel,"Harem, Music, Comedy, Romance, Shoujo",24 min. per ep.,PG-13,"7.21, 10170",31089,230,"The anime's story will start where the third season left off, at the competition for who will open the Triple S international sporting event. Raging Entertainment's HE★VENS idol group had hijacked the competition between QUARTET NIGHT and ST☆RISH, causing chaos. However, after the QUARTET NIGHT members suggest a certain idea, the three groups aim toward a new stage, with HE★VENS swearing to get their revenge on the other two groups.

(Source: ANN)"
,"Wake Up, Girls！Beyond the Bottom",Movie,1,Finished Airing,"Dec 11, 2015",,"TV Tokyo, Tatsunoko Production, AT-X, Toho, Ultra Super Pictures, DIVE II Entertainment, Good Smile Company, Avex Pictures, Lawson HMV Entertainment, Hiroshi Planning",add some,"Ordet, Millepensee",Original,"Music, Drama",53 min.,PG-13,"7.21, 2408",6700,15,"Second movie sequel of Wake Up, Girls!."
,映画　Yes! プリキュア５ GoGo! お菓子の国のハッピーバースデイ,Movie,1,Finished Airing,"Nov 8, 2008",,add some,add some,Toei Animation,Original,"Fantasy, Kids, Magic, Romance, Shoujo, Super Power",1 hr. 15 min.,G,"7.21, 1569",3937,6,"It's Nozomi's birthday, but it is disturbed by Bunbee chasing after a girl from another world, Chocola. When Pretty Cure rescue her, she thanks them by taking them to her country, Dessert Kingdom. In this cockaigne with rivers of juice and candy growing on trees, they feel very comfortable. But then they meet the evil Mushiban and his two subordinates Dry and Bitter. They want to take over the kingdom and change Pretty Cure into sweets. In order to save not only Nozomi's Birthday but also the whole Dessert Kingdom, Pretty Cure have to fight their way against Dry and Bitter and also against their own friend: Coco, who is being brainwashed by Mushiban. "
,遊☆戯☆王,TV,27,Finished Airing,"Apr 4, 1998 to Oct 10, 1998",Saturdays at 18 00 (JST),Nihon Ad Systems,add some,Toei Animation,Manga,"Action, Game, Comedy, Fantasy, Shounen",24 min. per ep.,PG-13,"7.21, 95235",169353,1056,"Bullies often target someone frail and weak—someone exactly like Yuugi Mutou. His beautiful childhood friend, Anzu Mazaki, is always there to stand up for him, but he can't depend on her forever. Katsuya Jonouchi, who is almost always accompanied by his verbal sparring partner Hiroto Honda, doesn't seem like a bad person either, despite always bringing Yuugi trouble. But most of all, Yuugi wishes for a true friend who understands him and would never betray him.

Yuugi treasures his Millennium Puzzle, an ancient Egyptian artifact that was brought into his grandfather's game shop. Believing that solving the puzzle will grant him his wish, he completes the puzzle, unleashing a new personality within him—the soul of the ""King of Games.""

Dark, twisted, strong, and reliable, the new personality named Yami Yuugi is the exact opposite of Yuugi. Upon any injustice toward him, Yami Yuugi takes over Yuugi's body and forces the opponent into a ""Shadow Game."" The stakes are high as whoever loses shall have a taste of the darkness that resides within their own heart.

[Written by MAL Rewrite]"
Yu Yu Hakusho the Movie Poltergeist Report,幽☆遊☆白書 冥界死闘篇 炎の絆,Movie,1,Finished Airing,"Apr 9, 1994",,"Movic, A-Line",Central Park Media,Studio Pierrot,Manga,"Action, Adventure, Comedy, Demons, Supernatural, Martial Arts, Shounen",1 hr. 34 min.,PG-13,"7.21, 10578",21418,30,"Millennia ago, a war was fought between the Netherworld and the Spirit World. Ultimately, the Netherworld was destroyed and Lord Yakumo, the King of the Netherworld, was banished to the depths of space. Now, five defenders from the Spirit World must team-up against Yakumo's Demon-Gods for possession of five, mystical sites. But Lord Yakumo is dangerously close to reclaiming the Power Sphere—the source of the Netherworld's energy—and once it is again in his possession, our world will become the new Netherworld.

(Source: AniDB)"
,あの夏で待ってる 特別編「僕達は高校最後の夏を過ごしながら、 あの夏を待っている。」,Special,1,Finished Airing,"Aug 29, 2014",,Geneon Universal Entertainment,Sentai Filmworks,J.C.Staff,Original,"Comedy, Drama, Romance, Sci-Fi, Slice of Life",26 min.,PG-13,"7.21, 20043",37423,34,Special episode included in the Blu-ray Box of Ano Natsu de Matteru.
,バクマン。 スペシャル「デラマン。」,Special,2,Finished Airing,"Sep 29, 2012 to Jan 2, 2013",,NHK,add some,J.C.Staff,Manga,"Comedy, School, Shounen",25 min. per ep.,PG-13,"7.21, 3730",13722,12,"First Episode: Summary of the previous two seasons of Bakuman

Second Episode: Shows many of the mangakas' works. Main cast members also talk about which ""Bakuman."" works they would like to see animated"
Black Jack The Two Doctors of Darkness,ブラック・ジャック ふたりの黒い医者,Movie,1,Finished Airing,"Dec 17, 2005",,"SKY Perfect Well Think, Nippon Television Network",add some,Tezuka Productions,Unknown,Drama,1 hr. 37 min.,PG-13,"7.21, 1570",3988,7,"The mega-corporate Daedalus Group is under attack by a small group of activists known as the Ghost of Icarus. While taking care of some of the victims of the bombing, Black Jack encounters Dr. Kiriko, also known as Death Incarnate, who just like him, asks his patients huge sums of money but instead of saving them, he offers them a painless death. When the activist group requests both doctors’ collaboration, Black Jack finds himself caught in a spiral of life, death and treason while trying to save his patients' lives and avoid the breaking of a biological war that could destroy humanity.

(Source: ANN)"
Blood-C The Last Dark,劇場版 ブラッドシー ザ ラスト ダーク,Movie,1,Finished Airing,"Jun 2, 2012",,"Aniplex, Dentsu, Shochiku, Kadokawa Shoten, Mainichi Broadcasting System, Dwango",Funimation,Production I.G,Original,"Action, Horror, Supernatural, Vampire",1 hr. 50 min.,R+,"7.21, 34607",69354,149,"Having escaped the many horrors of her village, Saya Kisaragi vows to hunt down the monster responsible and make him pay with his life. As she tears through flesh and bone for her vendetta, she encounters SIRRUT, a group of ingenious hackers, who enlist Saya to help them defeat a common enemy—someone she knows all too well.

Unfortunately, the path she follows is paved with tragedy, as once again, Saya faces betrayal at the hands of those she has come to trust. With her back against the wall, the fearsome monster slayer must fight with all her strength and skill if she is to overcome this final mission and exact vengeance.

[Written by MAL Rewrite]"
D.N.Angel,Ｄ・Ｎ・ＡＮＧＥＬ,TV,26,Finished Airing,"Apr 3, 2003 to Sep 25, 2003",Unknown,Kadokawa Shoten,"ADV Films, Discotek Media",Xebec,Manga,"Action, Comedy, Magic, Romance, Fantasy, School, Shoujo",23 min. per ep.,PG-13,"7.21, 84996",164147,1504,"Daisuke Niwa is a clumsy, block-headed, and wimpy middle school student who has few redeeming qualities. On his 14th birthday, he finally decides to confess his love to his longtime crush Risa Harada, but is rejected. 

In an unexpected turn of events, however, Daisuke finds himself transforming into Dark Mousy, the infamous phantom thief, whenever his mind is set on Risa. Though Daisuke is unaware of this strange heritage, his mother is certainly not: since before the boy was born, his mother had been planning for him to steal valuable works of art and let the name of the elusive art thief be known.

With doubt and confusion constantly clouding his mind, Daisuke finds himself struggling in his relationships with classmates and family. And it is not long before Daisuke realizes that he is not the only one with a fated family legacy—his greatest adversary could be the one classmate he is most unwilling to fight. 

[Written by MAL Rewrite]"
Days,DAYS,TV,24,Finished Airing,"Jul 2, 2016 to Dec 18, 2016",Sundays at 02 58 (JST),"Dentsu, Animax, Mainichi Broadcasting System, Pony Canyon, Kodansha, Tokyo MX, Lawson HMV Entertainment, BS11, Animatic, Techno Sound",Ponycan USA,MAPPA,Manga,"Sports, School, Shounen",24 min. per ep.,PG-13,"7.21, 46762",104488,391,"The series is about two boys named Tsukushi and Jin. Tsukushi is a boy with no special talent or traits while Jin is considered a soccer genius. On one stormy night, Jin meets Tsukushi, and they get dragged into the world of soccer.

(Source: MAL News)"
,名探偵コナン コナンと平次と消えた少年,OVA,1,Finished Airing,2003,,Shogakukan-Shueisha Productions,add some,TMS Entertainment,Manga,"Adventure, Mystery, Comedy, Police, Shounen",25 min.,PG-13,"7.21, 6444",12553,3,"Conan and Ran are visiting Heiji and Kazuha in Osaka when the four come across a trio of kids while touring the city. These children, who look eerily similar to the Detective Boys but with different personalities, are looking for their friend who has gone missing—and the two young detectives agree to help find the vanished boy.

[Written by MAL Rewrite]"
Digimon Adventure tri. Coexistence,デジモンアドベンチャーtri.（トライ）第５章「共生」,Movie,1,Finished Airing,"Sep 30, 2017",,Sonilude,add some,Toei Animation,Original,"Action, Adventure, Comedy, Drama",1 hr. 36 min.,PG-13,"7.21, 18944",37746,91,Fifth Digimon Adventure tri film. 
Doraemon the Movie Nobita and the Winged Braves,映画 ドラえもん のび太と翼の勇者たち,Movie,1,Finished Airing,"Mar 10, 2001",,add some,add some,add some,Unknown,"Adventure, Fantasy, Kids, Shounen",1 hr. 31 min.,PG,"7.21, 1627",2964,1,"Nobita and his friends gathered at Shizuka's house when they heard about the news about missing flocks of bird species. Nobita believed they were taken away by winged creatures and became obsessed on flying on his own. He created mechanical wings and upon the experiment he encountered an actual winged creature flying out of a time-space distortion. Upon helping him whose name is Gusuke, Nobita and his friends were sucked into the distortion and reached Gusuke's home, Birdpia or the world where the winged creatures live.

(Source: ANN)"
Doraemon the Movie Nobita and the Birth of Japan 2016,映画 ドラえもん 新・のび太の日本誕生,Movie,1,Finished Airing,"Mar 5, 2016",,"TV Asahi, Toho, Fujiko F. Fujio Pro",add some,Shin-Ei Animation,Manga,"Adventure, Comedy, Fantasy, Kids, Shounen",1 hr. 44 min.,PG,"7.21, 1101",2232,1,"Doraemon and friends run away from their home and travel back in time to the 70,000 years ago where nobody existed to build their ideal private paradise. After they fully relished the freedom in the era, Doraemon and friends bid farewell to their paradise and come back to the present day. However, a few days after they came back home, Doraemon and friends bump into a caveman called ""Kukul"" in the current era. They find out that the caveman Kukul was accidentally transported forward to the present, and that his tribe called Hikari tribe was attacked and abducted by Giga Zombie and Kurayami tribe after Doraemon and friends left the primitive age.

Doraemon and friends decide to go back to the primitive age to save Hikari tribe from the villain.

They dive into a grand adventure during their first and the furthest runaway.

(Source: Toho)"
,OVA ハイスクール・フリート,OVA,2,Finished Airing,"Mar 31, 2017 to May 24, 2017",,Cromea,add some,Production IMS,Original,"Action, Military, School",24 min. per ep.,PG-13,"7.21, 6528",15244,23,"The mutinous Musashi has been defeated, and the girls from Yokosuka Girls' Marine High School are safely back home. However, the Herakaze sustained critical damage during its final encounter with the Musashi and may not be able to sail again. Moreover, rumors spread that the Harekaze-class will be dissolved due to it lacking a ship. 

Other classes' attempts to scout members from the Harekaze's crew only make the situation even more uncertain. The answer to this dire problem may be found in the sealed orders that the secretary of the Harekaze, Kouko Nosa, is to deliver to its crewmembers. But time is running short...

[Written by MAL Rewrite]"
,ひぐらしのなく頃に 猫殺し編,Special,1,Finished Airing,"Aug 2, 2007",,"Geneon Universal Entertainment, Frontier Works, Sotsu",add some,Studio Deen,Light novel,Mystery,23 min.,PG-13,"7.21, 34894",63218,68,"After losing a bet, Keiichi, Mion, Rena, Satoko and Rika parade around the town in costumes. When they come to a fork in the road, they decide to go to Yagouchi, a nearby abandoned village. Once there Keichii and Rena learn the mystery of a strange haunted quarry as they debate whether or not to check it out."
,ハンターxハンター,OVA,1,Finished Airing,1998,,add some,add some,Studio Pierrot,Manga,"Action, Adventure, Shounen, Super Power",25 min.,PG-13,"7.21, 8613",19597,55,"The stand-alone pilot OVA which was shown as part of the ""Jump Super Anime Tour"" of 1998.

(Source: Wikipedia)"
Spring and Chaos,イーハトーブ幻想 Kenjiの春,Movie,1,Finished Airing,"Dec 14, 1996",,add some,Tokyopop,Group TAC,Unknown,"Drama, Historical, Slice of Life",57 min.,PG,"7.21, 1996",6037,26,"A unique biographical sketch of the life of the great modern Japanese poet Kenji Miyazawa, Spring and Chaos is a highly stylized and intense film that draws on Miyazawa's writing techniques to tell his life story. Miyazawa often used animals as the main characters in his stories and poems, and it is this technique that allows director Shoji Kawamori to recreate Miyazawa's fanciful land of Ihatov and use it as the backdrop for Miyazawa's life. Beautiful and affecting, Spring and Chaos is a fitting tribute to one of Japan's greatest writers.

(Source: Rotten Tomatoes)"
the Garden of sinners Chapter 8 The Final Chapter,劇場版 空の境界 the Garden of sinners 終章,Special,1,Finished Airing,"Feb 2, 2011",,add some,Aniplex of America,ufotable,Light novel,Mystery,33 min.,PG-13,"7.21, 42905",83633,153,"While walking home, Mikiya Kokutou comes across a familiar sight: Shiki Ryougi standing by a railing amidst the falling snow, just as when he first met her four years ago. While the two talk of their past and shared experiences, Mikiya realizes that something is strange about Shiki; rather, this is not the woman he has come to know, but an entirely different entity that dwells within Shiki's body...

[Written by MAL Rewrite]"
,血界戦線 & BEYOND ザップ・レンフロ因果応報中!! / バッカーディオの雫,OVA,1,Finished Airing,"Jul 4, 2018",,add some,add some,Bones,Manga,"Action, Comedy, Super Power, Supernatural, Vampire, Fantasy, Shounen",24 min.,R,"7.21, 6813",19344,10,Bundled with the 5th volume of the Kekkai Sensen: Back 2 Back manga. 
Kimi ni Todoke - From Me To You Season 2 – A Crush,君に届け 2ND SEASON 片想い,Special,1,Finished Airing,"Jan 5, 2011",,add some,add some,Production I.G,Unknown,"Romance, Shoujo",23 min.,PG-13,"7.21, 27824",54435,51,"The Kimi ni Todoke story so far, from Kurumi's point of view. "
Ghost in the Shell Stand Alone Complex 2nd GIG - Tachikomatic Days,攻殻機動隊 STAND ALONE COMPLEX Section9 Science File “タチコマな日々”,Special,26,Finished Airing,"Sep 10, 2004 to Sep 27, 2006",,add some,Bandai Entertainment,Production I.G,Unknown,"Sci-Fi, Comedy, Mecha",1 min. per ep.,PG,"7.21, 8216",18185,19,Tachikomatic Days is a series of comedic shorts attached to the end of every episode of Ghost in the Shell: Stand Alone Complex 2nd GIG. The shorts feature the antics of the Tachikoma think tanks of Section 9 and usually involve plot points. The average short time is a little over a minute.
Children of the Whales,クジラの子らは砂上に歌う,TV,12,Finished Airing,"Oct 8, 2017 to Dec 24, 2017",Sundays at 23 00 (JST),"Bandai Visual, Lantis, Magic Capsule, Hakuhodo DY Music & Pictures, Akita Shoten, Sony PCL, Contents Seed",Netflix,J.C.Staff,Manga,"Mystery, Super Power, Drama, Fantasy, Shoujo",23 min. per ep.,PG-13,"7.21, 67285",154059,668,"In a world covered by an endless sea of sand, there sails an island known as the Mud Whale. In its interior lies an ancient town, where the majority of its inhabitants are said to be ""Marked,"" a double-edged trait that grants them supernatural abilities at the cost of an untimely death. Chakuro is the village archivist; young and curious, he spends his time documenting the discovery of newfound islands. But each one is like the rest—abandoned save for the remnants of those who lived there long ago. 

For the first time in six months, another island crosses the horizon, so Chakuro and his friends join the scouting group. During the expedition, they find vestiges of an archaic civilization. And inside one of its crumbling remains, Chakuro discovers a girl who will change his destiny and the world inside the Mud Whale as he knows it.

[Written by MAL Rewrite]"
,タナカのナレーションで振り返る黒執事ダイジェスト,Special,1,Finished Airing,"Jan 9, 2009",,add some,add some,A-1 Pictures,Manga,"Action, Mystery, Comedy, Historical, Demons, Supernatural, Shounen",24 min.,PG-13,"7.21, 12738",32025,121,"A recap episode of the first half of Kuroshituji told by Tanaka-san, aka episode 13.5. Including this recap episode, the series is 25 episodes long. "
,灵笼 INCARNATION 下半季,ONA,6,Finished Airing,"Jul 31, 2020 to Oct 9, 2020",,bilibili,add some,YHKT Entertainment,Original,"Action, Sci-Fi, Horror, Demons, Drama, Thriller",30 min. per ep.,R,"7.21, 152",601,0,Second half of Ling Long: Incarnation.
Mama is Just a Fourth Grade Pupil,ママは小学４年生,TV,51,Finished Airing,"Jan 10, 1992 to Dec 25, 1992",Fridays at 17 00 (JST),add some,add some,Sunrise,Original,"Comedy, Drama, Sci-Fi",24 min. per ep.,PG,"7.21, 1411",4015,23," Natsumi Mizuki is a 4th grader whose parents have gone to London. Her Aunt Izumi comes to live with her. Izumi is an aspiring manga writer who is trying to get her first big break, so she doesn't have time for a baby that appears out of thin air on Natsumi's first night alone. The baby's name is Mirai and her mother is *Natsumi*, but 15 years older. Somehow, Mirai had traveled back in time. Now the young Natsumi has to raise Mirai while trying to keep her 4th grade life from falling apart and keep Mirai-chan secret from everyone. She has the dubious help of Izumi and some baby-care gadgets from the future.  

(Source: ANN)"
,増田こうすけ劇場 ギャグマンガ日和,TV,12,Finished Airing,"Feb 7, 2005 to Apr 25, 2005",Mondays at Unknown,"Bandai Visual, SKY Perfect Well Think, Kids Station, DAX Production",add some,Artland,Manga,"Comedy, Parody",5 min. per ep.,PG-13,"7.21, 2787",7761,55,"Gyagu Manga Biyori is an anime that is about absolutely nothing. It is comprised of 12 short stories (5 minutes long each) that only build up a small amount of plot for each story. The anime feeds off the stupidest things, but is quite humorous.

(Source: ANN)"
Everyday Life with Monster Girls OVA,モンスター娘のいる日常 OVA,OVA,2,Finished Airing,"Nov 12, 2016 to Apr 13, 2017",,add some,Sentai Filmworks,Lerche,Manga,"Comedy, Ecchi, Fantasy, Harem, Romance, Seinen",24 min. per ep.,R+,"7.21, 36801",73967,107,"During a physical exam, Miia, Centorea, and Mero discover that they have gained too much weight due to Kimihito Kurusu's delicious cooking. To remedy this, Polt offers them first use of her new pool and gym facility before its grand opening. However, it's not all fun and games, as the three girls' competitive spirits start to flare up!

Meanwhile, when Rachnera Arachnera receives a letter from her previous host family, she finds out that they would like to meet with her and apologize for the events that caused her transfer. But, as it turns out, not only do they want to apologize, they want her back as well! When the family's daughter, Ren Kunanzuki, shows up at the front door, the gang must convince her to let Rachnera stay at Kimihito's house. 

[Written by MAL Rewrite]
"
