name_english,name_japanese,show_type,episodes,status,aired,broadcast_time,producers,licensors,studios,source,genres,episode_length,rating,score_and_scorers,members,favorites,description
Umineko When They Cry,うみねこのなく頃に,TV,26,Finished Airing,"Jul 2, 2009 to Dec 24, 2009",Unknown,"Geneon Universal Entertainment, Frontier Works, Sotsu, Movic","NIS America, Inc.",Studio Deen,Visual novel,"Mystery, Horror, Psychological, Supernatural",23 min. per ep.,R,"7.14, 75666",179571,2053,"Considered as the third installment in the highly popular When They Cry series by 07th Expansion, Umineko no Naku Koro ni takes place on the island of Rokkenjima, owned by the immensely wealthy Ushiromiya family. As customary per year, the entire family is gathering on the island for a conference that discusses the current financial situations of each respective person. Because of the family head's poor health, this year involves the topic of the head of the family's inheritance and how it will be distributed.

However, the family is unaware that the distribution of his wealth is the least of Ushiromiya Kinzou's (family head) concerns for this year's family conference. After being told that his end was approaching by his longtime friend and physician, Kinzou is desperate to meet his life's true love one last time: the Golden Witch, Beatrice. Having immersed himself in black magic for many of the later years in his life, Kinzou instigates a ceremony to revive his beloved upon his family's arrival on Rokkenjima. Soon after, a violent typhoon traps the family on the island and a string of mysterious murders commence, forcing the eighteen people on the island to fight for their lives in a deadly struggle between fantasy and reality.

[Written by MAL Rewrite]"
The Fantastic Adventures Of Unico,ユニコ,Movie,1,Finished Airing,"Mar 14, 1981",,"Sanrio, Tezuka Productions",Discotek Media,Madhouse,Manga,"Adventure, Fantasy, Kids",1 hr. 30 min.,G,"7.14, 1690",4032,29,"Unico the Unicorn has the amazing power to make anyone he meets happy. Whether it's because of his personality or the powers of his horn, no one knows. However, the gods become jealous of Unico, thinking that only gods should be able to decide or let people be happy or not. Unico is banished to the Hill of Oblivion, and the West Wind is ordered to take him there. She can't stand giving this fate to an innocent like Unico, so Unico's adventures begin, as the West Wind takes him from one place and time to the next, in a neverending journey to escape the wrath of the gods. In this adventure, Unico meets Beezel a devil child and then Katy (Chao), a cat who wants to be a witch! Can he become friends with them?

(Source: AniDB)"
Urara Meirocho,うらら迷路帖,TV,12,Finished Airing,"Jan 6, 2017 to Mar 24, 2017",Fridays at 01 58 (JST),"TBS, Magic Capsule, Houbunsha, NBCUniversal Entertainment Japan, Nichion",Sentai Filmworks,J.C.Staff,4-koma manga,"Slice of Life, Comedy, Fantasy, Seinen",24 min. per ep.,PG-13,"7.14, 30022",102550,403,"Labyrinth Town is a legendary city composed of ten districts, home to witches and diviners alike. In the outermost district of this maze, many young girls begin training to join the ranks of the ""Urara,"" a group of women known far and wide for their ability to divine the answers to the world's most difficult questions. Chiya, a wild girl raised amongst the animals in the mountains, is invited to take her rightful place as a first rank urara. By joining them, she hopes to divine the location of her long-lost mother.

Chiya quickly makes three friends: studious Kon Tatsumi, aspiring witch Koume Yukimi, and reticent Nono Natsume. Armed with only their own ingenuity and a vague connection to the gods, they begin their journey in the way of the urara.

[Written by MAL Rewrite]"
Yes! Pretty Cure 5,Yes! プリキュア5,TV,49,Finished Airing,"Feb 4, 2007 to Jan 27, 2008",Unknown,Asahi Broadcasting,add some,Toei Animation,Original,"Action, Fantasy, Magic, School, Shoujo",24 min. per ep.,G,"7.14, 4339",11785,80,"Yumehara Nozomi, a regular student, finds a magical book called the Dream Collet in the library and meets Coco and Nuts, two creatures from the Palmier Kingdom. They plead with Nozomi to restore their world, which has been destroyed by an organization called the Nightmares, by completing the Dream Collet and finding the 55 Pinkies to make any wish come true. Meanwhile, the Nightmares are moving into the real world. Once Nozomi agrees to help, Coco and Nuts transform her into the magical girl Cure Dream and turn four fellow students into her Pretty Cure team.

(Source: ANN)"
Yu-Gi-Oh! 3D Bonds Beyond Time,劇場版 遊☆戯☆王 ～超融合! 時空を越えた絆～,Movie,1,Finished Airing,"Jan 23, 2010",,"TV Tokyo, Nihon Ad Systems","4Kids Entertainment, Flatiron Film Company",Gallop,Manga,"Game, Adventure, Shounen",49 min.,PG-13,"7.14, 22035",35671,71,"While riding with Jack Atlas and Crow Hogan, Yuusei Fudou's Stardust Dragon is captured by Paradox, a mysterious Turbo Duelist from the future, during a Turbo Duel and turned into a Sin Monster. With the help of the Crimson Dragon, Yuusei chases after Paradox as he enters a time slip, ending up in the past. During this time, Paradox duels against Jaden Yuki, who is still able to use the powers of Yubel and The Supreme King. However, by this time Paradox had also captured Cyber End Dragon and Rainbow Dragon and overwhelms Jaden. He is saved thanks to Yuusei and the Crimson Dragon. Jaden informs Yuusei of Paradox's true intentions. By stealing various monsters from across time and turning them dark, he plans to kill Maximillion Pegasus, the creator of Duel Monsters, preventing the game from being created and causing the events of all three series to never happen.

Yuusei and Jaden agree to pursue Paradox, which leads them to the past and causes a meeting with the King of Games, Yuugi Mutou. However, by the time Yuusei and Jaden arrive, Paradox had already attacked his time, supposedly killing both Pegasus and Yuugi's grandpa, and had also managed to steal Blue-Eyes White Dragon and Red-Eyes Black Dragon. After explaining everything to Yuugi, he agrees to fight with Yuusei and Jaden against Paradox in the ultimate three-on-one duel to free the trapped monsters and save both the world and time itself before it's too late.

(Source: Wikipedia)"
Yugo The Negotiator,勇午 ～交渉人～,TV,13,Finished Airing,"Feb 24, 2004 to May 25, 2004",Tuesdays at 00 00 (JST),G&G Entertainment,ADV Films,Artland,Manga,"Action, Military, Mystery, Psychological, Drama, Seinen",24 min. per ep.,R,"7.14, 2787",9885,28,"""Negotiation means, you turn words into weapons""

This is the realization of the popular comic Yu-go that was published in Kondasha Afternoon Magazine over a period of 10 years.

Beppu Yuugo is the world's most successfull negotiator. His only weapons are ""words."" Yuugo doesn't kill people. Neither does he threaten them with brute violence. With rich knowledge and a calm judgement, he believes in the humans inside them. Doing only that he has managed many dangerous negotiations successfully until now. Now two of the many episodes have been chosen very carefully, one taking place in Russia, the other one in Pakistan. In the burning desert and the freezing Siberia Yuugo begins his negotiations.

(Source: AniDB)"
,ネギま!?夏 スペシャル!?,OVA,1,Finished Airing,"Nov 22, 2006",,"Starchild Records, GANSIS",Funimation,Shaft,Manga,"Ecchi, Fantasy, Comedy, Romance",27 min.,PG-13,"7.13, 7721",15989,22,"Yue and Nodoka are practicing magic, and one spell catches their eye: The Red String of Fate. Supposedly, this spell connects you with your fated partner. Nodoka decides to try it out, and ends up tied to Negi. However, this spell isn't the Red String of Fate at all, but is in fact just a red string that connects two people. A magical red string that happens to be impossible to sever. Delightful. Meanwhile, Ayaka invites the class to a free trip to her family's recently constructed spa resort. Tied together for at least a day, will Negi and Nodoka be able to make the most out of this free trip without going too far...?"
Ninja Girl & Samurai Master 2nd,信長の忍び~伊勢・金ヶ崎篇~,TV,26,Finished Airing,"Apr 8, 2017 to Sep 30, 2017",Saturdays at 01 35 (JST),add some,add some,TMS Entertainment,4-koma manga,"Comedy, Historical",3 min. per ep.,PG-13,"7.13, 4298",9006,5,"A skilled, deadly ninja on the clock and an adorable, naïve girl off it, Chidori continues to pave the way forward for her master, Nobunaga Oda, in his conquest of the Land of the Rising Sun.

Though Nobunaga has made great progress in his quest, uniting a nation has not become any easier. Between vindictive former enemies and powerful new rivals, his stubborn adversaries have taken up arms to stamp out the warlord's ambitions. However, standing beside the ambitious general are his many close friends and supporters, including one loyal, capable shinobi. Ready to serve in whatever way she can, Chidori gathers key allies, infiltrates enemy castles, and duels against skilled warriors in the name of realizing her lord's dream: establishing a unified Japan.

[Written by MAL Rewrite]"
Please tell me! Galko-chan,おしえて! ギャル子ちゃん,TV,12,Finished Airing,"Jan 8, 2016 to Mar 25, 2016",Fridays at 22 30 (JST),add some,add some,feel.,Digital manga,"Slice of Life, Comedy, School",7 min. per ep.,PG-13,"7.13, 56378",127511,442,"At first glance, Galko, Otako, and Ojou are three high school girls who seem like they wouldn’t have anything to do with each other. Galko is a social butterfly with a reputation for being a party animal, even though she is actually innocent and good-hearted despite her appearance. Otako is a plain-looking girl with a sarcastic personality and a rabid love of manga. And Ojou is a wealthy young lady with excellent social graces, though she can be a bit absent-minded at times. Despite their differences, the three are best friends, and together they love to talk about various myths and ask candid questions about the female body.

Oshiete! Galko-chan is a lighthearted and humorous look at three very different girls and their frank conversations about themselves and everyday life. No topic is too safe or too sensitive for them to joke about—even though every so often, Galko seems to get a bit embarrassed by their discussions!

[Written by MAL Rewrite]"
Please tell me! Galko-chan OVA,おしえて! ギャル子ちゃん 夏休みって本当ですか?,OVA,1,Finished Airing,"Jan 23, 2017",,add some,add some,feel.,Digital manga,"Slice of Life, Comedy",28 min.,PG-13,"7.13, 10315",22181,23,Bundled with fourth manga volume. 
Popee the Clown,POPEE the ぱフォーマー,TV,39,Finished Airing,"Jan 3, 2000 to Dec 28, 2001",Mondays at 20 53 (JST),"Kids Station, Nippon Columbia",add some,Nippon Animation,Original,"Comedy, Dementia",4 min. per ep.,R,"7.13, 2050",5835,169,"Popee the Performer deals with a circus that operates in the middle of the desert. Each episode deals with the small cast of characters attempting at times to rehearse their performances, but it usually dissolves into the characters trying to humorously destroy each other in the usual cartoon manner.

The star of the show, Popee, is a clown in an odd red-striped jumpsuit and bunny ears. He is adept at juggling, being a clown, pulling large knives and small bombs out of thin air. He is not adept at ever succeeding in his nefarious plans to hurt his poor assistant or the owner of the circus. His mischievous nature is the driving force of each episode.

(Source: animefringe.com)"
,映画 プリキュアオールスターズ New Stage2 こころのともだち,Movie,1,Finished Airing,"Mar 16, 2013",,Kinoshita Group Holdings,add some,Toei Animation,Original,"Action, Kids, Magic, Shoujo",1 hr. 11 min.,G,"7.13, 1456",3510,3,"One day, the Pretty Cures receive an invitation to a party in their honor. Everyone is heading to the party venue, the school of fairies, but awaits a mysterious shadow. The shadow steals transformation objects! What can they do? If the Cures can not be converted are in big trouble! If this continues, the school, our world and everything else will deborado by that shadow! The 32 Pretty Cures will fight to protect everyone!

(Source: Wikipedia)"
,RD 潜脳調査室,TV,26,Finished Airing,"Apr 9, 2008 to Oct 1, 2008",Wednesdays at 00 59 (JST),"VAP, Nippon Television Network",add some,Production I.G,Original,"Action, Sci-Fi",22 min. per ep.,R,"7.13, 4730",22667,46,"2061 AD. Fifty years have passed since mankind developed the Network society. It was anticipated that this new infrastructure would realize a utopia where people connected with each other at the level of consciousness. However, new social problems such as personal data leaks and proliferation of manipulated information began to surface. Nevertheless, people still relied on the Network to exchange information, and proved unable to opt to abandon it.

In due course, a new Network realm with more effective security measures was developed. This was called Meta Real Network, usually abbreviated as ""the Metal.""

The Metal accommodated personal memory data within protected virtual stand-alone organic cyber enclaves called bubble shells and eventually pervaded the everyday lives of people.

However, people gradually learned to release and explode their instincts within the secure environment of the Metal. The unleashed instincts pushed each individual's consciousness to drown in the sea of information and to be exposed to the pressures of desire. Meanwhile, norms and regulations continued to bind their real world lives. Thus, strange friction between the two worlds began to manifest themselves as aberrations beyond the bounds of the imaginable.

Experts who challenged the deep sea of the Metal to investigate and decipher such aberrations were called cyber divers.

This is a story of a cyber diver, Masamichi Haru, who investigates the incidents that lie between Reality and the Metal.

(Source: Production I.G)"
,霊剣山 星屑たちの宴,TV,12,Finished Airing,"Jan 9, 2016 to Mar 26, 2016",Saturdays at 00 00 (JST),"Haoliners Animation League, Tencent Animation & Comics",add some,Studio Deen,Light novel,"Comedy, Magic, Fantasy",24 min. per ep.,PG-13,"7.13, 28547",73733,163,"Long ago in the nine provinces of Kyushu, a calamitous event was prophesied to take place: falling comets would exhaust the spiritual energies of both the heavens and the lands and thus bring about an age of chaos upon the world. But contrary to the prophecy, the comets passed by with no calamity taking place. At the same time, as if touched by the phenomenon, a boy was born in a remote village of the Sokei region by the name of Ouriku.

Twelve years later, as the memories of the event have faded from people's minds, the Reikenzan clan—one of the five supreme sects of the nine provinces—decides to hold an examination in order to gather the most talented individuals fit to become disciples and eventually sages. Hearing about this news, Ouriku and his servant Ouchou head toward the site, unaware that the organizer Oubu, despite her elegant appearance, is infamous for being extremely irresponsible and carefree; hence, making the trials in the examination unpredictable.

Reikenzan: Hoshikuzu-tachi no Utage follows the story of Ouriku as he journeys through these trials to become a powerful sage.

[Written by MAL Rewrite]"
The Great Adventures of Robin Hood,ロビンフッドの大冒険,TV,52,Finished Airing,"Jul 29, 1990 to Oct 28, 1992",Unknown,NHK,add some,Tatsunoko Production,Unknown,"Adventure, Historical, Romance",25 min. per ep.,G,"7.13, 3037",6505,22,"A variant of Robin Hood in which all the principal characters are teenagers.

Several centuries ago in Nottingham County, a cruel and greedy baron by the name of Alwine ordered the destruction of the Huntingtons' castle—from the fire of which Robin and his cousins, Will, Winifred and Barbara, miraculously escaped. The youngsters sought shelter in Sherwood Forest, where, thanks to the wise guidance of the hermit better known as ""Friar Tuck,"" they managed to face the difficulties of a life in the wilderness as as well as they could; however, in the forest there lived a fearless group of young bandits, led by Little John. Their first encounter with Robin and his cousins was at first rather stormy, as the two groups fought for the destiny of a young, noble maiden named Marian who had fallen into the hands of the bandits during an ambush.

Their bitterness, however, rapidly lead the way to friendship, and Robin and John later realized they were all victims of the same fate. The youngsters thus mutually decided to help one another. Baron Alwine was not merely enemy of the Huntingtons—in fact, a couple years earlier he had forced Little John and his gang to seek protection in the forest to avoid forced labour. He would later seek Marian Lancaster for the secret carved on a cross the girl wore as symbol of her family line.

The girl was to be adopted by the shady Bishop Herfort—Alwine's accomplice—who sought to attain the Lancaster's wealth. With all their strength, Robin and his friends were then compelled to fight against the baron's troops, led by Gilbert—a dangerous and fearless knight. When Winifred and Marian were then imprisoned in the castle's dungeons, our heroes tried in every way possible to enter until their ardour was finally rewarded with success. Thanks to his noble heart and heed for danger, Robin became rapidly known as the protector of the poor and oppressed. Beloved and highly esteemed not only by the villagers, but also and especially by the sweet and beautiful Marian he was. The boy who never parted from his loyal, magical bow, endlessly engaged in dangerous and unthinkable missions."
Megaman Star Force,流星のロックマン,TV,55,Finished Airing,"Oct 7, 2006 to Oct 27, 2007",Unknown,add some,Viz Media,Xebec,Game,"Action, Game, Sci-Fi, Shounen",10 min. per ep.,PG,"7.13, 4475",10589,81,"In the year 220X, the world has advanced toward radio-wave technology, and the world is connected through the Wave Road. Meet Subaru Hoshikawa, a fifth-grade student who lost his father in a space accident. Subaru meets an extraterrestrial radio-wave being named War-Rock, descending from a distant FM planet. War-Rock claims to know about Subaru's father, but many alien beings are after War-Rock. The two work together and merge into Rockman, a radio-wave human capable of traversing the Wave Road and battling the radio-wave viruses and FMs that threaten the Earth.

(Source: ANN)"
"Three Leaves, Three Colors",三者三葉,TV,12,Finished Airing,"Apr 11, 2016 to Jun 27, 2016",Mondays at 00 00 (JST),"AT-X, DAX Production, Houbunsha, TOHO animation, RAY",Funimation,Doga Kobo,4-koma manga,"Slice of Life, Comedy, School",24 min. per ep.,PG-13,"7.13, 17535",52029,108,"Having gone from pampered to poor after the bankruptcy of her father's company, Youko Nishikawa struggles to drop her princess-like persona and make friends at her all-girls high school. One day, while eating alone in a nearby forest, she has a chance encounter with Futaba Odagiri, the super-energetic transfer student, and Teru Hayama, an innocent-looking girl with a surprisingly direct and sometimes mean personality. Despite their differing personalities, the three girls who all have the kanji for ""leaf"" in their name begin an unlikely friendship as they try to navigate through an amusing and spontaneous adventure known as high school life.

Sansha Sanyou is a cheerful, cute series revolving around three close but very different friends as they try to balance the everyday challenges that school and adolescence have to offer.

[Written by MAL Rewrite]"
,新・キャプテン翼,OVA,13,Finished Airing,"Jul 1, 1989 to Jul 1, 1990",,"Studio Comet, Nihon Ad Systems, Fuji TV",add some,Nippon Animation,Manga,"Action, Sports, Shounen",30 min. per ep.,G,"7.13, 5098",9135,15,"Shin CT takes place at the U-16 word cup in France. After some friendly matches in Germany, Japan defeats one opponent after another and finally reaches the final round against Germany. After hard matches against Italian and French top players, the German team seems to be even more supreme. The giant goal keeper Moeller, the all round ace Kalz and Europe's best player and forward Schneider offer the Japanese team an extremely hard match.

(Source: ANN)"
,【神撃のバハムート GENESIS】 Short story,ONA,2,Finished Airing,"Dec 28, 2016 to Feb 20, 2017",,Cygames,add some,MAPPA,Game,"Action, Adventure, Demons, Supernatural, Magic, Fantasy",9 min. per ep.,PG-13,"7.13, 8116",20136,6,"The first short story focuses on Favaro and Kaiser between the events of the first and second series as they visit Favaro's home village. 

The second short story shows Kaiser as a knight commander sparring with Jeanne, and sharing the reasons they remained as Orleans Knights in the aftermath of the final battle against Bahamut."
