name_english,name_japanese,show_type,episodes,status,aired,broadcast_time,producers,licensors,studios,source,genres,episode_length,rating,score_and_scorers,members,favorites,description
Danganronpa The Animation,ダンガンロンパ 希望の学園と絶望の高校生 THE ANIMATION,TV,13,Finished Airing,"Jul 5, 2013 to Sep 27, 2013",Fridays at 01 35 (JST),"Geneon Universal Entertainment, Studio Hibari, Mainichi Broadcasting System, Showgate",Funimation,Lerche,Game,"Mystery, Horror, Psychological, School",24 min. per ep.,R,"7.31, 362208",639236,7657,"Hope's Peak Academy is an elite high school that accepts only the most talented students. Individuals who successfully enroll receive their own unique titles, suitably reflective of their skills and traits. Of the fifteen candidates admitted to the peculiar school that year, Makoto Naegi is a completely ordinary individual who has been accepted by sheer chance, with the title of ""Super High School-Level Luck.""

Naegi and his fellow classmates are initially ecstatic to be chosen to study at this prestigious institution, but these feelings of happiness are short-lived. They are soon confronted by Monokuma, the principal and resident bear, who traps them inside the school. The pupils' hopes of escape and graduation hinge on one of them successfully murdering one of their peers without being discovered. However, if the killer is caught, he or she will be executed, and the remaining survivors will be left to continue the deathmatch until only a single victor remains.

[Written by MAL Rewrite]"
,斗破苍穹特别篇2沙之澜歌,ONA,3,Finished Airing,"Apr 14, 2019 to Apr 28, 2019",,"Tencent Penguin Pictures, China Literature Limited",add some,Shanghai Motion Magic,Novel,"Action, Adventure, Demons, Fantasy",25 min. per ep.,PG-13,"7.31, 506",1347,5,The tale of Ice Emperor and his journey as a mercenary. The story tells a story of twin Queen Medusas and their intervention with the Ice Emperor.
Elemental Gelade,エレメンタルジェレイド,TV,26,Finished Airing,"Apr 5, 2005 to Sep 27, 2005",Tuesdays at 18 00 (JST),"TV Tokyo, Geneon Universal Entertainment, Sotsu, Victor Entertainment","Funimation, Discotek Media, Geneon Entertainment USA",Xebec,Manga,"Adventure, Comedy, Super Power, Magic, Romance, Fantasy, Shounen",24 min. per ep.,PG-13,"7.31, 38589",83825,488,"After a routine raid, the rookie sky pirate Coud finds a most unusual cargo in his mates' cargo hold: Ren, an ""Edel Reid"", a race prized by humans for granting special combat power to their partners through ""Reacting"". He quickly discovers, however, that Ren is even more prized than he expected. The pirate ship is visited by three members of the Edel Reid Complete Protection Agency ""Arc Aire"", who try to purchase her. When Coud refuses, the ship is suddenly attacked by a mysterious force, and Coud's captain charges him with Ren's protection.

(Source: ANN)"
Fate/Kaleid Liner Prisma Illya 2Wei!,Fate/kaleid liner プリズマ☆イリヤ ツヴァイ!,TV,10,Finished Airing,"Jul 10, 2014 to Sep 11, 2014",Thursdays at 01 35 (JST),"Lantis, Kadokawa Shoten, AT-X, DAX Production, KlockWorx, Tokyo MX, Kadokawa Media House",Sentai Filmworks,Silver Link.,Manga,"Action, Comedy, Fantasy, Magic",23 min. per ep.,PG-13,"7.31, 63093",119514,242,"Another lovely summer goes by for Illyasviel von Einzbern. Taking a break from her magical girl duties, she enjoys her time off after collecting the Class Cards with her best friend Miyu Edelfelt. 

However, her break comes to an abrupt end when she and Miyu are abducted by Rin Toosaka and Luviagelita Edelfelt, while out with her friends. The magical girls learn that their work is far from over, as Clock Tower informs them that the out of control mana thought to have been sealed continues to be dispersing throughout Fuyuki City. After heading to the origin point of the out of control mana, Illya and Miyu are tasked with solving the anomaly. 

But after casting their spell, Illyasviel discovers that she's split into two people! As this mysterious new form darts off, she can only wonder: what is to come from the existence of her dopplegänger, running amok in the unsuspecting town?

[Written by MAL Rewrite]"
,新世紀ＧＰＸサイバーフォーミュラ１１,OVA,6,Finished Airing,"Nov 1, 1992 to Jun 1, 1993",,add some,add some,Sunrise,Unknown,"Drama, Sci-Fi, Shounen, Sports",30 min. per ep.,PG-13,"7.31, 822",1896,7,"It is now time for the 11th Cyber Formula World Grand Prix. With all the expectations and pressures placed upon him, Hayato Kazami struggles to regain the championship form that he had a year ago. Moreover, Osamu Sugo, aka Knight Schumacher, has reentered the competition, and declared Hayato to be an enemy. Hayato, with the new Super Asurada AKF-11, must now defeat someone he once deeply trusted in order to secure his second championship.

(Source: ANN)"
Gatchaman Crowds Insight,GATCHAMAN CROWDS insight（インサイト）,TV,12,Finished Airing,"Jul 5, 2015 to Sep 27, 2015",Sundays at 01 55 (JST),add some,Sentai Filmworks,Tatsunoko Production,Original,"Adventure, Sci-Fi",23 min. per ep.,PG-13,"7.31, 22758",62459,181,"One day, a huge UFO spins over Japan and crashes into a rural farmland outside Nagaoka, disrupting Tsubasa Misudachi's ordinary life. As the Gatchaman, the legendary defenders of Tachikawa City, supervise the ordeal, a peaceful alien creature emerges from the spacecraft. In the ensuing chaos, Tsubasa is given a special high-tech notebook, or NOTE, from Gatchaman founder J.J. Robinson, signaling Tsubasa's sudden recruitment into their group. Under the tutelage of fellow hero Hajime Ichinose, Tsubasa slowly begins to adjust to life as a defender of justice.  

Meanwhile, the CROWDS technology, which enables users to manifest their consciousness' into a physical form, is spreading amongst the public, as well as being endorsed by Prime Minister Sugayama. However, a mysterious organization known as VAPE has gained notoriety by using unique red CROWDS to wreak havoc, shifting public opinion against the CROWDS technology. The Gatchaman, along with new recruit Tsubasa, must put a stop to their destructive activities before it's too late.

[Written by MAL Rewrite]"
,青山剛昌短編集,Special,7,Finished Airing,"Mar 17, 1999 to Dec 22, 1999",,add some,add some,TMS Entertainment,Unknown,"Adventure, Mystery, Comedy, Police, Shounen",20 min. per ep.,PG-13,"7.31, 1979",4337,9,"GOSHO collection reveals the origin of the smash hit ""Detective Conan."" ""GO"" into his world, and we will ""SHO"" you SEVEN romantic and exciting stories created by GOSHO AOYAMA.

WAIT FOR ME (30 min.)
A genius inventor, who is still a high school student, has a girlfriend two years older than him. One day, he invents a time machine and attempts to go two years back into the past, to become the same age as her. However, it is she who ultimately uses the machine to travel through time!

TEN PLANETS IN THE NIGHT SKY (10 minutes)
Meet Baby Conan! Yukiko Kudo is looking for her missing husband. The only clue to find him again is to decipher a mysterious message left for her. Their baby, Shinichi Kudo, one who later becomes the famous high school Detective Conan, will at this age already be offering some important hints for her.

THE WANDERING RED BUTTERFLY (7 minutes)
A handsome detective, Yusaku Kitakata, receives phone calls from a mysterious woman day after day, with a new case each day. He of course solves them one by one. But the biggest mystery is who is this mysterious woman?

PLAY IT AGAIN (30 minutes)
Thanks to the mystical powers of a Cherry Blossom Tree, a 70-year-old man with a secret sword technique goes back into the past and becomes the same age as his granddaughter. While enjoying his youth for the second time around, he notices that a player is after his granddaughter.

SANTA CLAUS IN SUMMER (30 minutes)
Keisuke, a young man of 17, accidentally activates the Earth Destruction System. The destiny of the Earth now depends on whether he can stop the system within 24 hours. However, suddenly amnesia strikes him and he forgets the pin number to stop the system. The time is running out...

DETECTIVE GEORGE’S SPECIAL CASE (30 minutes)
A girl is fleeing from men in black. She runs into a detective agency and discovers that the detective there is a super-miniature-size, cool dude. He risks his life trying to solve a case for this client. Will they come through in the end?

MAKING OF DETECTIVE CONAN (7 minutes)
Do you know how to make animation? Everybody wants to see the workings of an animation studio. Based on the concept of Detective Conan, the three sub-characters visit the animation studio of Detective Conan. This episode will surely catch the hearts of Detective Conan fans! (The actual animation is also involved in this special.)

(Source: TMS Entertainment, LTD)"
Hamatora The Animation,ハマトラ THE ANIMATION,TV,12,Finished Airing,"Jan 8, 2014 to Mar 26, 2014",Unknown,"TV Tokyo, Avex Entertainment, Sotsu, Movic, AT-X, DAX Production, DIVE II Entertainment, Shueisha",Sentai Filmworks,NAZ,Original,"Mystery, Comedy, Super Power, Drama",24 min. per ep.,R,"7.31, 102535",238865,983,"The ability to create miracles is not just a supernatural phenomenon; it is a gift which manifests in a limited number of human beings. ""Minimum,"" or small miracles, are special powers that only selected people called ""Minimum Holders"" possess. The detective agency Yokohama Troubleshooting, or Hamatora for short, is composed of the ""Minimum Holder PI Duo,"" Nice and Murasaki. Their office is a lone table at Cafe Nowhere, where the pair and their coworkers await new clients.

Suddenly, the jobs that they begin to receive seem to have strange connections to the serial killer whom their friend Art, a police officer, is searching for. The murder victims share a single similarity: they are all Minimum Holders. Nice and Murasaki, as holders themselves, are drawn to the case—but what exactly is the link between Nice and the one who orchestrates it all?

[Written by MAL Rewrite]"
The Case of Hana & Alice,花とアリス 殺人事件,Movie,1,Finished Airing,"Feb 20, 2015",,"Pony Canyon, Nippon Television Network, Shogakukan",GKIDS,"Steve N' Steven, Rockwell Eyes",Original,"Drama, Mystery, Slice of Life",1 hr. 38 min.,PG-13,"7.31, 8117",26342,135,"After transferring to Ishinomori Middle School, Tetsuko ""Alice"" Arisugawa overhears her classmates discussing a strange rumor. The previous occupant of her seat, a nondescript ""Judas,"" is missing and presumed murdered—poisoned by one of his four wives. Amidst dealing with her mother's undesired meddling in her affairs and warding off her classmates' bullying, the troubled Alice starts to investigate the mystery surrounding Judas' disappearance.

The trail of clues leads her to the house of her next-door neighbor, the quirky and reclusive Hana Arai. After an awkward introduction, Hana agrees to help Alice and formulates a plan that may lead them to the answers they seek. The two girls embark on a journey to uncover what happened to Judas, and perhaps a friendship may start to blossom between the two along the way.

[Written by MAL Rewrite]
"
Cells at Work Special,はたらく細胞 新作エピソード「風邪症候群」,Special,1,Finished Airing,"Dec 27, 2018",,add some,add some,David Production,Manga,"Comedy, Shounen",23 min.,PG-13,"7.31, 18094",30650,5,"A mysterious cell wearing a stylish hat appears before the regular cells, who are bored with just the same (cell division) work over and over again, every day. This mysterious cell lures the regular cells into a mischievous scheme against White Blood Cell and Killer T Cell. The regular cells enjoy working out their everyday, pent-up frustration. But, just who exactly is this cell wearing a stylish hat?

(Source: ANN)"
,ハイスクールD×D OVA,OVA,2,Finished Airing,"Sep 6, 2012 to May 31, 2013",,"Genco, Lantis, AT-X",add some,TNK,Light novel,"Comedy, Demons, Ecchi, Romance, School",23 min. per ep.,R+,"7.31, 112563",196381,558,"#1: Oppai, Minorimasu! (Episode 13)
A rumor is going about the school about how girls are disappearing and coming back ill and with their breast size decreased.

#2: Oppai, Motomemasu! (Episode 14)
While observing how the others do their jobs so they can do theirs better, Issei and Asia go with Rias to see if a coffin is cursed. During the investigation Issei is possessed by an Egyptian magician named Unas, It just so happens that Unas is just as perverted as Issei. Unas will only leave Issei's body if they can release Unas from the curse placed on him by a devil that Unas tried to make his bride."
"K SEVEN STORIES ""SIDE BLUE - Sirius - """,K Seven Stories SIDE BLUE ~天狼の如く~,Movie,1,Finished Airing,"Aug 4, 2018",,add some,Viz Media,GoHands,Manga,"Action, Super Power, Supernatural",1 hr. 1 min.,PG-13,"7.31, 3383",16588,16,"Gouki Zenjo, former right-hand man to Jin Habari and a survivor of the Kagutsu Incident, returns to work for SCEPTER 4, now under the command of Reisi Munakata, the new Blue King.

(Source: TubiTV)"
Valvrave the Liberator 2nd Season,革命機ヴァルヴレイヴ　2ndシーズン,TV,12,Finished Airing,"Oct 10, 2013 to Dec 27, 2013",Unknown,"Aniplex, Dentsu, Mainichi Broadcasting System, Movic, Bandai, Bandai Namco Entertainment",Aniplex of America,Sunrise,Original,"Action, Space, Mecha",24 min. per ep.,R,"7.31, 45628",79909,215,"Haruto and his comrades continue to fight against the forces of Dorssia. However, many things remain unanswered in the midst of battle, including the past of L-Elf and his fellow soldier's past, the destiny of the mysterious girl Liselotte, and the feelings of Haruto, Shouko, and Saki. The relationships and loyalty of each and every member of each army will be tested as the clash of ideals and power reaches its climax.

(Source: ANN)"
My-Otome,舞-乙HiME,TV,26,Finished Airing,"Oct 7, 2005 to Mar 31, 2006",Fridays at 01 30 (JST),"Bandai Visual, Lantis, TV Tokyo Music","Funimation, Bandai Entertainment",Sunrise,Original,"Comedy, Drama, Fantasy, Magic",24 min. per ep.,PG-13,"7.31, 22575",45290,330,"Arika Yumemiya has traveled far in search of her goal: the prestigious Gualderobe Academy. This is the school where young girls are trained to become Otomes, protectors of royal leaders throughout the lands. Here, Arika makes plenty of friends, but some enemies know something about her past that she does not. Nevertheless, her spirit and determination will keep pushing her forward.

Adapted from its predecessor, Mai-HiME, this series is not a direct sequel, but an alternate universe setting featuring some of the Mai-HiME cast (though with different personalities). 

(Source: ANN)"
