name_english,name_japanese,show_type,episodes,status,aired,broadcast_time,producers,licensors,studios,source,genres,episode_length,rating,score_and_scorers,members,favorites,description
,バイオハザード4 Incubate,OVA,1,Finished Airing,"Sep 28, 2006",,Capcom,add some,add some,Game,"Action, Demons, Horror, Military, Mystery, Police, Supernatural, Thriller",1 hr. 22 min.,R,"6.20, 2605",6390,8,"After the Playstation port of Resident Evil 4 hit the stores Capcom released a new 97 minute DVD some time later which intended to summarize the whole story of Resident Evil 4. It's played on English audio with Japanese subtitles. It also included a little book which explains the life on El Pueblo before and the arrival of Osmund Saddler. It also solved some plot holes like the whereabouts of the children. It contains many of the scenes original to Resident Evil 4.

(Source: Resident Evil Wiki)"
Brand New Story,Brand New Story,Music,1,Finished Airing,"Jun 20, 2019",,Avex Entertainment,add some,add some,Original,Music,2 min.,G,"6.20, 377",648,0,Music video for the song Brand New Story by GENERATIONS from Exile Tribe.
,バーンナップスクランブル,TV,12,Finished Airing,"Jan 12, 2004 to Mar 29, 2004",Unknown,"Geneon Universal Entertainment, Memory-Tech, Toshiba Entertainment",Geneon Entertainment USA,AIC,Original,"Action, Comedy, Drama, Ecchi, Police, Sci-Fi, Shounen",24 min. per ep.,R,"6.20, 2638",8000,2,"AD. 2023, Tokyo. Because of the change of the society such as internationalization and enlargement of the trading, the dark side of the society also continues changing. The criminals are getting deep, and their organizations are increasing its size, then the peace and security is getting worse.

The government takes it seriously, and decides to introduce an innovative system. In order to cope with the special criminals, an extralegal police is founded. 

It is a special criminal team, Warriors, which consists of a few elite members. 

(Source: AnimeNfo)"
Chibi Kero Secret of the Kero Ball!?,ちびケロ ケロボールの秘密!?,Special,1,Finished Airing,"Mar 17, 2007",,add some,add some,Sunrise,Unknown,Comedy,17 min.,G,"6.20, 374",1070,2,"A young Keroro tries to impress Pururu by showing off the Kero Ball, a ball borrowed by Giroro from his brother Garuru. While testing the buttons, he accidentally transports the 4 tadpoles inside the ball. To get out, they must win the pinball maze. In the outside world, a young blue tadpole Kururu picks up the ball and hears the cries of help. He makes a deal to free those trapped inside if he gets a plate of curry rice. A deal is a deal and with the Kero Ball, a plate of curry rice is produced for Kururu. Unfortunately, the plate grows bigger and bigger and bigger. It got so big, that Kururu was immersed in the curry. The yellow curry slowly transforms the blue Kururu into the ""yellow devil"" and as the film is about to fade into black, ""Kukuku"" is heard.

(Summary found on Veoh.com)"
,CMFU学院：王子碰碰球,ONA,24,Finished Airing,"Nov 3, 2016 to Apr 6, 2017",,"Tencent Penguin Pictures, China Literature Limited",add some,Shanghai Foch Film Culture Investment,Novel,"Romance, School, Sports",11 min. per ep.,PG-13,"6.20, 307",3891,45,No synopsis information has been added to this title. Help improve our database by adding a synopsis here.
,ディアブレイブ,Music,1,Finished Airing,"Nov 18, 2015",,add some,add some,add some,Original,"Music, Romance",4 min.,G,"6.20, 663",1376,1,No synopsis information has been added to this title. Help improve our database by adding a synopsis here.
,電撃文庫MOVIE FESTIVAL - Special Opening Anime (2007),Special,1,Finished Airing,"Apr 21, 2007",,add some,add some,add some,Unknown,Comedy,3 min.,G,"6.20, 1868",4270,3,"Played at Dengeki Bunko's Movie Festival on 21 April 2007 before the Shakugan no Shana, Inukami! and Kino no Tabi movies. It was later released on DVD and sold at Dengeki's 15th Anniversary event."
,名探偵コナン 謎のすい星怪獣を追え!,OVA,1,Finished Airing,"Nov 9, 2001",,Shogakukan,add some,add some,Manga,Mystery,14 min.,G,"6.20, 493",2222,1,A short story about Conan and the Detective Boys.
Dr. Slump and Arale-chan N-cha! Clear Skies Over Penguin Village,Dr.スランプ アラレちゃん んちゃ!ペンギン村はハレのち晴れ,Movie,1,Finished Airing,"Jun 3, 1993",,add some,add some,Toei Animation,Manga,"Comedy, Sci-Fi, Shounen",42 min.,PG-13,"6.20, 311",1016,1,"At the Penguin Village, the dinosaurs styled monster named Dodongadon appeared. But he was small as Arale and did not have strong power. Arale defeat him very easily, and Dodongadon called his mother Mamangadon. She was huge and had a big power. How Arale can defeat this big monster?

(Source: Official Website)"
