name_english,name_japanese,show_type,episodes,status,aired,broadcast_time,producers,licensors,studios,source,genres,episode_length,rating,score_and_scorers,members,favorites,description
JoJo's Bizarre Adventure,ジョジョの奇妙な冒険 ADVENTURE,OVA,7,Finished Airing,"May 25, 2000 to Jan 25, 2002",,Shueisha,Super Techno Arts,APPP,Manga,"Adventure, Drama, Fantasy, Horror, Shounen, Supernatural, Vampire",30 min. per ep.,R+,"7.18, 21612",51453,297," Kujo Jotaro is a normal, popular Japanese high-schooler, until he thinks that he is possessed by a spirit, and locks himself in prison. After seeing his grandfather, Joseph Joestar, and fighting Joseph's friend Muhammad Abdul, Jotaro learns that the ""Spirit"" is actually Star Platinum, his Stand, or fighting energy given a semi-solid form. Later, his mother gains a Stand, and becomes sick. Jotaro learns that it is because the vampire Dio Brando has been revived 100 years after his defeat to Jonathan Joestar, Jotaro's great-great-grandfather. Jotaro decides to join Joseph and Abdul in a trip to Egypt to defeat Dio once and for all. "
Children of the Sea,海獣の子供,Movie,1,Finished Airing,"Jun 7, 2019",,add some,add some,Studio 4°C,Manga,"Drama, Mystery, Seinen, Supernatural",1 hr. 51 min.,PG-13,"7.18, 10841",38743,232,"One summer vacation, Ruka meets two boys, ""Umi"" and ""Sora,"" whose upbringing contains strange and wonderful secrets. Drawn to their beautiful swimming, almost more like flying, Ruka and the adults who know them are intertwined in a complex mesh...

Meanwhile, an unexplained anomaly is occurring all over the world: fish are disappearing. Thus begins a marine adventure of boys and girls to captivate all the senses!"
Karin,かりん,TV,24,Finished Airing,"Nov 3, 2005 to May 11, 2006",Fridays at 00 00 (JST),"WOWOW, Frontier Works, Kadokawa Shoten, Half H.P Studio","Funimation, Geneon Entertainment USA",J.C.Staff,Manga,"Comedy, Romance, Vampire, School, Shounen",23 min. per ep.,PG-13,"7.18, 77353",150141,857,"Vampires—supernatural beings that feed on the life essence of the unsuspecting at night—have been around for centuries. However, high schooler Karin Maaka is unusual, even among her own kind. Unlike her vampire family, ever since she was a child, Karin has suffered from polycythemia: a rare disorder which causes her to periodically produce excessive amounts of blood. And the more blood she produces, the more anemic and lightheaded she gets, ultimately leading to frequent nosebleeds.

Her only solution? Force her excess blood onto random strangers, which surprisingly causes these ""victims"" to become livelier and happier than before. With her siblings—Anju, her reserved yet affectionate younger sister, and Ren, her womanizing elder brother—helping her abilities remain a secret by altering the affected humans' memories, no one is the wiser. That is, until Karin's newly transferred classmate, Kenta Usui, finds her behavior suspicious. And to make matters even more complicated, Karin feels her blood reacting unusually to Kenta's presence.

[Written by MAL Rewrite]"
,京騒戯画,ONA,5,Finished Airing,"Aug 31, 2012 to Dec 22, 2012",,Bandai Channel,Discotek Media,Toei Animation,Original,"Action, Fantasy, Supernatural",10 min. per ep.,PG-13,"7.18, 10130",24282,33,"Three kids are stuck in a strange city causing massive mayhem through the land. They are searching for an atypical rabbit in order to return home. Koto, the eldest of the three, seems to have some sort of connection to this weird place ruled by a monk, a demon, and a priest."
,ラブライブ！スクールアイドルフェスティバルALL STARS,ONA,1,Finished Airing,"Sep 19, 2018",,add some,add some,add some,Unknown,Music,4 min.,PG-13,"7.18, 856",3050,10,Special short to promote the release of the Love Live! School Idol Festival All Stars game.
Mahoromatic ~Something More Beautiful~,まほろまてぃっく  ~もっと美しいもの~,TV,14,Finished Airing,"Sep 26, 2002 to Jan 16, 2003",Unknown,Pioneer LDC,"Sentai Filmworks, Geneon Entertainment USA","Gainax, Shaft",Manga,"Military, Sci-Fi, Comedy, Drama, Romance, Ecchi",24 min. per ep.,R+,"7.18, 14416",28272,42,"As the relationship between Mahoro, Suguru and his classmates develops further, another android girl enters their lives and becomes attached to Mahoro. All the while, the number of days before Mahoro is to shut down decreases steadily.

(Source: ANN)"
Rune Soldier,魔法戦士リウイ,TV,24,Finished Airing,"Apr 3, 2001 to Sep 18, 2001",Tuesdays at 18 30 (JST),add some,ADV Films,J.C.Staff,Light novel,"Adventure, Comedy, Fantasy, Magic, Shounen",23 min. per ep.,PG-13,"7.18, 7636",17832,69,"Louie, a brawny student at the mage's guild, is reluctantly accepted by three girls (Merrill-thief, Genie-fighter, and Melissa-priestess) as a companion for their adventuring party. As the foursome explore ruins, battle dark creatures, and make new friends, they also uncover a sinister plot within the kingdom.

(Source: ANN)"
Orphen,魔術士オーフェン,TV,24,Finished Airing,"Oct 3, 1998 to Mar 27, 1999",Saturdays at 17 00 (JST),"Kadokawa Shoten, TBS",Sentai Filmworks,J.C.Staff,Light novel,"Action, Adventure, Comedy, Demons, Fantasy, Magic",25 min. per ep.,PG-13,"7.18, 11625",34101,171,"Six years ago at the magic school known as the Tower of Fang, a grave accident happened involving the magical sword Baltanders and the magic user Azali. Unable to control the sword's power, Azali was transformed into the shape of a great dragon who since that day became known as Bloody August. Krilancelo, a young magician at the Tower who cared greatly for Azali found much to his disgust that the elders of the Tower of Fang were less than willing to save Azali and wanted rather to pretend the accident never happened. Angered by their stand, Krilanceloa swore that he would find a way to return Azali to her former self. Thus he forsook the name Krilancelo and declared himself Orphen, leaving the Tower and his magical studies behind to wander the world... 

(Source: ANN) "
,みかん絵日記,TV,30,Finished Airing,"Oct 16, 1992 to Jun 18, 1993",Unknown,add some,add some,Nippon Animation,Manga,"Slice of Life, Comedy, Romance, Shoujo",23 min. per ep.,G,"7.18, 561",2153,20,"A kitten, abandoned and left for dead along with his siblings, is taken in by Tomu Kusanagi, who nurtures him and discovers that the tangerine cat he so adores is actually a genius who can talk, walk, read, and has even acquired a taste for liquor!"
,ムーンライトマイル 1stシーズン -Lift off-,TV,12,Finished Airing,"Mar 4, 2007 to May 27, 2007",Unknown,add some,"ADV Films, Funimation",Studio Hibari,Manga,"Adventure, Drama, Sci-Fi, Space",25 min. per ep.,R+,"7.18, 2684",9025,18,"After scaling Mt. Everest, mountain climbing partners Saruwatari Gorou and ""Lostman"" Jack F. Woodbridge see the ISA Space Station, and each vows to make the trek into outerspace. When Helium 3, a new energy source, is discovered on the moon, NASA forms a new project named ""Nexus"" to harness that energy for use on earth. This is the story of the two and the paths they take to see their dream become a reality in the quest to harness the next-generation energy source.

(Source: ANN)"
,ワンピース 夢のサッカー王!,Movie,1,Finished Airing,"Mar 2, 2002",,add some,add some,Toei Animation,Manga,"Comedy, Fantasy, Shounen, Sports",5 min.,PG-13,"7.18, 18424",33091,22,"Luffy and his crew take on the Villain All-Stars in a game of soccer in order to become the Dream Soccer King. The game comes down to a pk tie-breaker shoot-out with Coby as goalie and Helmeppo refereeing.

(Source: ANN) "
"She, The Ultimate Weapon",最終兵器彼女,TV,13,Finished Airing,"Jul 2, 2002 to Sep 24, 2002",Unknown,"Toei Video, Toshiba EMI, Tohokushinsha Film Corporation","Viz Media, Sentai Filmworks",Gonzo,Manga,"Drama, Military, Romance, School, Sci-Fi",24 min. per ep.,R,"7.18, 31570",81210,561,"Chise is an ordinary schoolgirl: small, frail, and not particularly intelligent. Her greatest joy is her budding romance with her classmate and childhood friend, Shuuji. They both live in a small military town in Hokkaido, where high schoolers have few concerns other than who is dating whom and complaining about the steep climb up ""Hell Hill"" every day before school.

One day, Shuuji and his friends make a trip to Sapporo to buy gifts for their girlfriends. A massive air raid on Sapporo that day kills thousands, including one of Shuuji's friends, and signals the beginning of a war. Fleeing from the carnage, Shuuji spots Chise, though now she has steel wings and a massive gun where her right arm should be. Against her will, she has been transformed into the ultimate cyborg weapon, capable of leveling entire cities.

As the war rages closer and closer to their hometown, Chise and Shuuji's relationship is strained by her transformation, and they are left to wonder whether she is even still human.

[Written by MAL Rewrite]"
,神八剣伝,TV,26,Finished Airing,"Apr 3, 1999 to Sep 25, 1999",Unknown,TV Tokyo,add some,Public & Basic,Unknown,"Action, Adventure, Martial Arts, Sci-Fi",24 min. per ep.,PG-13,"7.18, 1740",4808,21,"Based on the long cherished, classic Japanese novel Nanso Satomi Hakkenden by Bakin Kyokutei Takizawa (1767), a modified version of it was made into animation.

Taking place in the future, during this time wars were occuring in heaven, mostly for possession between the eight moons created by the savior Fuse that surrounded God's land. When the war ended, there was only one ruling family - that of the Oowaris, and the remaining son gained control of all the moons of heaven, except for one. Meiten, the moon of the pope, where people refrained from war and were therefore out of it's terms.

Eight people. Each from one of the eight moons. Each possessing one of the jewels - the elements that compose Earth. They are those who are destined to become saviors of humanity. All of them have sacrificed for these jewels, and are determined to complete their duty to Queen Fuse who entrusted these to them. When the mad emperor Kai threatens to revive a ghost who wants to prevent the restoration of Earth, these eight must battle using the powers given by their jewels in order to create Earth and defeat those who want to prevent it.

So they all go to Kusanagi, the ship in the center of God's land. They must gather the jewels in the key called Yatsufusa at Kusanagi's center, in order to create Earth.

(Source: AniDB)"
Street Fighter II The Animated Movie,ストリートファイターII MOVIE,Movie,1,Finished Airing,"Aug 6, 1994",,add some,Discotek Media,Group TAC,Game,"Action, Martial Arts, Shounen",1 hr. 41 min.,PG-13,"7.18, 14880",23075,123,"Get your quarters ready, because the world's top fighters are about to go head to head in this explosive animated adaptation of the classic Street Fighter II arcade game! M. Bison's plan to crush those who would oppose his organization, Shadowloo, is simple: brainwash the strongest martial artists around with his dreaded psycho power, and turn them into living weapons! To stop him, Interpol agent Chun-Li must team up with Major Guile of the United States Air Force, but that's no small feat.

They'll have to put aside their differences and learn to work together, and fast. Bison is closing in on Ryu, a traveling vagabond said to be the best fighter in the world. Fortunately (or not), Ryu is a hard man to find, but the same can't be said of his eternal rival, Ken. And it might just be through Ken that Bison will get what he wants! Can the World Warriors beat Bison to the punch?

(Source: Discotek)"
,映画中二病でも恋がしたい!Lite,Special,1,Finished Airing,"Feb 19, 2014",,add some,Sentai Filmworks,Kyoto Animation,Light novel,Comedy,5 min.,PG-13,"7.18, 12267",26555,6,Special episode included with the Blu-ray/DVD release of Chuunibyou demo Koi ga Shitai! Movie. 
,テイルズオブシンフォニア THE ANIMATION シルヴァラント編,OVA,4,Finished Airing,"Jun 8, 2007 to Dec 21, 2007",,"Geneon Universal Entertainment, Frontier Works",add some,ufotable,Game,"Action, Adventure, Magic, Martial Arts, Fantasy",32 min. per ep.,PG-13,"7.18, 20721",46533,162,"Two worlds exist, both unaware of the existance of the other. In order for one world to flourish, the other will have to perish. On the perishing world, a Chosen one is sent on a journey to restore that world's mana by awakening the Spirits and becoming an angel. Colette Brunel, the Chosen of Sylvarant, sets out on her journey accompanied by her best friends Lloyd Irving and Genis Sage. As they travel further they meet more friends and even more enemies, while they learn more and more about the truth behind the World Regeneration. 

(Source: ANN) "
The God of High School,THE GOD OF HIGH SCHOOL ゴッド・オブ・ハイスクール,TV,13,Finished Airing,"Jul 6, 2020 to Sep 28, 2020",Mondays at 23 30 (JST),"Sola Entertainment, Naver Webtoons",Crunchyroll,MAPPA,Web manga,"Action, Sci-Fi, Adventure, Comedy, Supernatural, Martial Arts, Fantasy",23 min. per ep.,PG-13,"7.18, 169760",385028,2618,"The ""God of High School"" tournament has begun, seeking out the greatest fighter among Korean high school students! All martial arts styles, weapons, means, and methods of attaining victory are permitted. The prize? One wish for anything desired by the winner.

Taekwondo expert Jin Mo-Ri is invited to participate in the competition. There he befriends karate specialist Han Dae-Wi and swordswoman Yu Mi-Ra, who both have entered for their own personal reasons. Mo-Ri knows that no opponent will be the same and that the matches will be the most ruthless he has ever fought in his life. But instead of being worried, this prospect excites him beyond belief.

A secret lies beneath the facade of a transparent test of combat prowess the tournament claims to be—one that has Korean political candidate Park Mu-Jin watching every fight with expectant, hungry eyes. Mo-Ri, Dae-Wi, and Mi-Ra are about to discover what it really means to become the God of High School.

[Written by MAL Rewrite]"
The iDOLM@STER Side M Episode of Jupiter,THE IDOLM@STER Prologue SideM Episode of Jupiter,Special,1,Finished Airing,"Oct 1, 2017",,"Aniplex, Lantis, Bandai Namco Live Creative, Bandai Namco Entertainment, ABC Animation",add some,A-1 Pictures,Game,Music,34 min.,PG-13,"7.18, 2541",5002,8,Prequel story of The iDOLM@STER SideM featuring Jupiter.
,To LOVEる -とらぶる- Multiplication ~前から後ろから~,OVA,1,Finished Airing,"Nov 2, 2017",,add some,add some,Xebec,Manga,"Comedy, Ecchi, Harem, Romance, School, Sci-Fi, Shounen",12 min.,R+,"7.18, 11924",28675,70,No synopsis information has been added to this title. Help improve our database by adding a synopsis here.
