name_english,name_japanese,show_type,episodes,status,aired,broadcast_time,producers,licensors,studios,source,genres,episode_length,rating,score_and_scorers,members,favorites,description
,ふしぎ魔法 ファンファン・ファーマシィー,TV,48,Finished Airing,"Feb 15, 1998 to Feb 6, 1999",Unknown,add some,add some,Toei Animation,Unknown,"Kids, Magic",12 min. per ep.,G,"6.66, 298",2016,16,"In a small town, there is a small pharmacy called Fun Fun Parmacy. Popuri, a girl who recently moved in downtown, discovers this pharmacy and meets Miss Fukiko, who is actually a witch. Miss Fukiko gives Popuri a mysterious bottle that can create magic spirits."
Future Card Buddyfight Hundred,フューチャーカード バディファイト100,TV,50,Finished Airing,"Apr 11, 2015 to Mar 26, 2016",Saturdays at 08 00 (JST),"Dentsu, Bushiroad",add some,"Xebec, OLM",Card game,Game,24 min. per ep.,PG,"6.66, 1479",3613,7,"While Tasuku is off training and getting rest in the world of the monsters, the Buddy Police sees the need to deputize some of the champions to help protect the Earth. Gao, Tetsuya, and Zanya Kisaragi are among those deputized, and it's just in time. A new enemy arrives, Ikazuchi, with the deadly 100 demons, all rogue monsters. Now the new trainees and the Great 8 monsters must fight to protect Earth from being consumed by these new rogues.

(Source: ANN)"
Gasaraki,ガサラキ,TV,25,Finished Airing,"Oct 4, 1998 to Mar 28, 1999",Sundays at 09 30 (JST),"Yomiko Advertising, Atelier Musa","ADV Films, Nozomi Entertainment",Sunrise,Original,"Psychological, Mecha, Military, Supernatural, Drama",25 min. per ep.,PG-13,"6.66, 4469",17112,39,"The flames of war explode in the Middle East as two shadow forces unleash monstrous new weapons of mass destruction! But in a world in which giant robots are real, the most dangerous weapon of all lies buried within a human mind. Yuushirou, the fourth son of the mysterious and powerful Gouwa family, finds himself at the center of events that will change the future of mankind forever! Nothing can prepare the human race for what is about to be unleashed in Gasaraki!

(Source: Sunrise)"
,映画Go! プリンセスプリキュア Go! Go!! 豪華3本立て!!!,Movie,1,Finished Airing,"Oct 31, 2015",,Kinoshita Group Holdings,add some,Toei Animation,Original,"Kids, Magic, Fantasy, Shoujo",1 hr. 15 min.,G,"6.66, 1025",2629,7,"Part 1, Cure Flora to Itazura Kagami, is a dialogue-less story featuring Cure Flora and a mischievous ghost in a mirror.

Part 2, Pumpkin Oukoku no Takaramono, features the four Precure girls from Go! Princess Precure trying to rescue a princess who is held captive.

Part 3, Precure to Refi no Wonder Night!, is set when the Night Kingdom lost its daytime. The Precure team fight to take the daytime back alongside the princess Refi.

(Source: Crunchyroll, Edited)"
,HAPPY☆LESSON,OVA,5,Finished Airing,"Jul 19, 2001 to May 23, 2003",,KSS,add some,Studio Hibari,Unknown,"Comedy, Harem, Romance, School",30 min. per ep.,PG-13,"6.66, 4040",10101,18,"One guy. Five girls. One roof. It's a recycled idea, but it never gets old. Happy Lesson is a kinetic take on an old genre.

Chitose shares his house with five ladies. One might think the continued attention of this many girls would be a good thing, but too much attention can prove to be painful. Did I mention they're also instructors at his school (hence the title)? Not only is he the subject of their abuse at home, but at school as well. Even when things finally calm down at night, all the rooms are taken so Chitose must sleep on the couch.

(Source: AniDB)"
,HAUNTED じゃんくしょん,TV,12,Finished Airing,"Apr 2, 1997 to Jun 25, 1997",Thursdays at 01 45 (JST),add some,Bandai Entertainment,Studio Deen,Manga,"Comedy, Supernatural, School, Shounen",24 min. per ep.,PG-13,"6.66, 1311",3573,10,"Saito High is a high school with its spiritual beings and a principal whose hobby is collecting occult paraphernalia. The school has the prophecy-chosen members of the Holy Student Council to protect it. These students have problems of their own; Haruto Houjo, the president, has a way of summoning spirits, and would resign from his duty for a normal life if it weren't for the principal. Kazumi Ryodo, the next member, is good at being possessed and has something for the Hanako. The last member is Mutsuki Asahina, who is a master of exorcism and is attracted to small boys. Unfortunately, these three are in charge of keeping the school in line and defending the world from supernatural beings, and this mission brings them through wacky predicaments.

(Source: ANN)"
Ruin Explorers Fam & Ihrie,秘境探検 ファム＆イーリー,OVA,4,Finished Airing,"Jun 25, 1995 to Feb 25, 1996",,"Bandai Visual, animate Film, Movic, Nippon Columbia","ADV Films, Maiden Japan",Ajia-Do,Manga,"Action, Adventure, Comedy, Fantasy, Magic",30 min. per ep.,R+,"6.66, 2742",6487,12,"Fam and Ihrie are willing to do almost anything to make a buck. So when these debt-driven damsels discover the potential profits to be hand in recovering a particularly dangerous mystical object, it means mortal peril for an entire civilization.

There's no guarantee that they'll live long enough to squander the fabulous wealth they've been promised, and danger lurks around every turn as they cross dark seas in pursuit of legendary evil. Haunted by an unspeakable curse, plagued by doomsday prophecies, plotted against by untrustworthy traveling companions and looked in desperate race to gain the Ultimate Power, Fam and Ihrie are the Ruin Explorers!

(Source: AniDB)"
Spellbound! Magical Princess Lilpri,ひめチェン! おとぎちっくアイドル リルぷりっ,TV,51,Finished Airing,"Apr 6, 2011 to Mar 28, 2012",Unknown,Shogakukan Music & Digital Entertainment,add some,Telecom Animation Film,Unknown,"Magic, Shoujo",5 min. per ep.,PG,"6.66, 402",1394,4,"Short episodes of Hime Chen! Otogi Chikku Idol Lilpri that aired as part of TV Tokyo's morning program block for children, Norinori♪Norisuta (のりのり♪のりスタ)."
,一騎当千 Dragon Destiny,Special,6,Finished Airing,"Jun 24, 2007 to Nov 24, 2007",,Genco,Media Blasters,add some,Unknown,"Super Power, Ecchi, Martial Arts, School",3 min. per ep.,R+,"6.66, 9516",19956,18,Ikkitousen Dragon Destiny Specials.
,イナズマイレブンGO特別編,Special,2,Finished Airing,"Dec 8, 2011 to Dec 23, 2011",,add some,add some,OLM,Unknown,"Sports, Super Power, Shounen",23 min. per ep.,G,"6.66, 1756",4346,9,Recap episodes of Inazuma Eleven Go made to catch viewers up in the newest franchise in preparation for the Inazuma Eleven Go: Kyuukyoku no Kizuna Gryphon film being released at the same time period (the 2nd recap ep aired on the same day the movie came out). Both recap episodes were included on the 12th DVD volume of the main anime as well.
Killing Bites,キリングバイツ,TV,12,Finished Airing,"Jan 13, 2018 to Mar 31, 2018",Saturdays at 02 25 (JST),"Sotsu, Mainichi Broadcasting System, NBCUniversal Entertainment Japan, Medicos Entertainment, Fields, KLab",add some,LIDENFILMS,Manga,"Action, Ecchi, Sci-Fi, Seinen",24 min. per ep.,R+,"6.66, 51339",124485,340,"After unknowingly participating in a kidnapping, college student Yuuya Nomoto finds his friends brutally murdered by Hitomi Uzaki, the high school girl they attempted to abduct. Forced to drive her to an undisclosed location, he finds himself being wagered as the prize for a death match between two Therianthropes, superpowered human-animal hybrids created through advanced gene therapy. As one of these hybrids, Hitomi uses the speed and fearlessness she gained from her ratel genes to viciously dispatch her foe and save Yuuya from certain death.

Waking up hours later hoping the whole event was only a nightmare, Yuuya realizes that he has become embroiled in a secret proxy war between four large Japanese business conglomerates, with the winner taking control of the economy. As her sole albeit unwilling investor, his life is now directly linked to Hitomi's ability to participate in underground bloodsport matches known only as Killing Bites.

[Written by MAL Rewrite]
"
Ladies versus Butlers!,れでぃ×ばと!,TV,12,Finished Airing,"Jan 5, 2010 to Mar 23, 2010",Tuesdays at 22 00 (JST),"Geneon Universal Entertainment, Lantis, AT-X, KlockWorx, ASCII Media Works, BIGLOBE",Media Blasters,Xebec,Light novel,"Harem, Comedy, Romance, Ecchi, School",24 min. per ep.,R+,"6.66, 83390",166214,231,"Hino Akiharu lost his parents when he was small and was adopted into his uncle's family. He didn't want to be a burden on his uncle's family and decides to enter a free boarding school as a butler, Hakureiryou high school. However, his delinquent boy-like appearance frightens the girls, who make up the majority of the students. Unable to get along with the classmates, Akiharu meets his childhood crush Saikyou Tomomi. "
Speed Racer,マッハＧｏＧｏＧｏ,TV,52,Finished Airing,"Apr 2, 1967 to Mar 31, 1968",Unknown,add some,Funimation,Tatsunoko Production,Manga,"Adventure, Cars, Sports, Shounen",25 min. per ep.,PG-13,"6.66, 5037",10963,95,"The Mach 5 is one of the fastest and most technologically advanced race cars built by man. Equipped with various gadgets and a powerful engine, it provides a challenge for anyone who would dare race against it. The driver of this amazing vehicle is Gou Mifune, a teenager who dreams of breaking into the world of professional racing.

In spite of this, Gou's father and the creator of the Mach 5, Daisuke Mifune, does not want his son anywhere near a racetrack. Undeterred, his girlfriend Michi, younger brother Kurio, and Kurio's monkey sidekick Sanpei become Gou's biggest fans as he sets out to become the greatest racer of all time.

However, Gou soon learns that becoming a professional racer is not easy. From the underhanded plots of corrupt businessmen to stiff competition in the form of his rival, Racer X, Gou faces many obstacles on the road ahead, and has a lot to prove before he can cross the finish line.

[Written by MAL Rewrite]"
,まほよめ,ONA,24,Finished Airing,"Oct 10, 2017 to Mar 27, 2018",,add some,add some,"W-Toon Studio, DMM.futureworks",Manga,Parody,30 sec. per ep.,G,"6.66, 2408",7693,14,"As the television anime Mahoutsukai no Yome debuts a new episode every week, one new 30-second episode of the series of shorts will debut every week on the official Twitter every Tuesday. The previous week's episode will no longer be available when each new episode debuts.

(Source: ANN)"
,魔女っ子メグちゃん,TV,72,Finished Airing,"Apr 1, 1974 to Sep 29, 1975",Unknown,add some,add some,Toei Animation,Unknown,"Magic, Shoujo",25 min. per ep.,PG-13,"6.66, 479",2280,7,"Megu is sent to Earth in her early teens, she is adopted by Mammi Kanzaki, a former witch who gave up her royal ambitions to wed a mortal. Mammi bewitches her husband and their two children, Rabi and Apo, into believing that Megu has always been the eldest child of the family. Under Mammi's tutelage, Megu learns to control both her abilities and impulses in order to prove her worthiness for the crown. This Rite-of-Passage subtext is continued throughout the series.

(Source: ANN)"
,マケン姫っ！ OVA,OVA,2,Finished Airing,"Mar 1, 2012 to Sep 25, 2013",,AIC,Funimation,Xebec,Manga,"Action, Ecchi, Harem, Martial Arts, School, Super Power",24 min. per ep.,R+,"6.66, 21561",44993,37,OVA episodes bundled with the 8th and 11th volumes of the manga.
Ninja the Wonder Boy,まんが猿飛佐助,TV,24,Finished Airing,"Oct 9, 1979 to Apr 15, 1980",Unknown,Knack Productions,add some,add some,Unknown,"Adventure, Comedy, Historical, Supernatural",20 min. per ep.,PG,"6.66, 408",1083,6,"Sasuke is the story of a ninja child that starts right after the battle of Sekigahara where Tokugawa Ieyasu becomes shogun of Japan. Sarutobi Sasuke (Jump Like Monkey Sasuke) was a famous ninja in the employ of Sanada Daisuke who fought for the losing side against Ieyasu. He was believed to have committed suicide when he was trapped in a castle, but the story takes off that he really escaped and that Sarutobi is not a name of a ninja but a whole ninja clan. (from AniDB)"
Maze The Mega-Burst Space,MAZE☆爆熱時空,TV,25,Finished Airing,"Apr 3, 1997 to Sep 25, 1997",Unknown,Kadokawa Shoten,Central Park Media,J.C.Staff,Manga,"Adventure, Comedy, Fantasy, Mecha, Shounen",24 min. per ep.,PG-13,"6.66, 1610",5342,9,"Maze wakes up in her house, everything is a wreck and she has amnesia. Before she can gather what has happened the girl Mill storms into her house thanking her for having saved her life. She tells Maze that her house suddenly fell down from the sky and crushed Mills pursuers under it. However before long they are both on the run from further pursuers who want their hands on princess Mill. They are only saved when Maze discovers that she has phantom light magical powers and can summon Mills family heirloom mecha. However her performance with the mecha is weak; that is until the sun goes down and she is turned in to a lecherous man. Soon other travellers join them as Maze tries to protect Mill and figure out what she is doing in this fantasy world. 

(Source: ANN)"
The Many Dream Journeys of Meme,ミームいろいろ夢の旅,TV,127,Finished Airing,"Apr 3, 1983 to Sep 29, 1985",Unknown,TBS,add some,Nippon Animation,Unknown,"Adventure, Kids, Sci-Fi",25 min. per ep.,PG,"6.66, 160",564,1,"Meme, a very cute and strange creature, is this leading character of this series.
One day Meme comes out of a computer and meets Daisuke and Sayaka.
Meme guides the kids throughout his world, where they meet world-famous scientists, inventors and scholars such as Galileo, Pasteur, Kepler, and many more.
This series is not only highly entertaining for children and the entire family but is also very interesting and educational.

(Source: AnimeNfo)"
