name_english,name_japanese,show_type,episodes,status,aired,broadcast_time,producers,licensors,studios,source,genres,episode_length,rating,score_and_scorers,members,favorites,description
,魍魎の匣,TV,13,Finished Airing,"Oct 8, 2008 to Dec 31, 2008",Unknown,"VAP, Kadokawa Shoten, Nippon Television Network",add some,Madhouse,Novel,"Mystery, Psychological, Supernatural, Thriller, Seinen",23 min. per ep.,R,"7.21, 12878",51657,218,"The story follows a series of bizarre murders of schoolgirls who have been dismembered and stuffed into boxes. The private investigator hired by a missing daughter's mother joins forces with an antique book seller and others to unravel the murder spree.

(Source: ANN)"
,7SEEDS,ONA,12,Finished Airing,"Mar 26, 2020",,"Nihon Ad Systems, Rakuonsha, BS Fuji",Netflix,"Gonzo, Studio Kai",Manga,"Sci-Fi, Adventure, Mystery, Psychological, Drama, Romance, Shoujo",24 min. per ep.,R+,"7.20, 12837",25275,52,Second season of 7 Seeds.
,アラビアンナイト シンドバットの冒険,TV,52,Finished Airing,"Oct 1, 1975 to Sep 29, 1976",Wednesdays at 19 00 (JST),Studio Jack,add some,Nippon Animation,Book,"Adventure, Fantasy, Magic, Romance",25 min. per ep.,G,"7.20, 2505",5061,21,"Based on the famous tale from The Thousand and One Arabian Nights, this story takes place more than 1200 years ago. The story's hero is the impish Sindbad, a mischievous boy full of curiosity, who one night sneaks into the royal palace to watch the acrobatic performances and learns that a wide world awaits beyond Baghdad.
Hearing of the travels of his uncle Captain Ali, Sindbad decides to become a sailor and travel around the world. Leaving behind a note to his father, young Sindbad boards Captain Ali`s ship and-accompanied by a myna called Sheila-sets out for the greatest adventure of his life.

(Source: AniDB)"
Black Bullet,ブラック・ブレット　BLACK BULLET　［黒の銃弾］,TV,13,Finished Airing,"Apr 8, 2014 to Jul 1, 2014",Tuesdays at 22 30 (JST),"Geneon Universal Entertainment, AT-X, Showgate, NBCUniversal Entertainment Japan",Sentai Filmworks,"Kinema Citrus, Orange",Light novel,"Action, Sci-Fi, Mystery, Seinen",24 min. per ep.,R,"7.20, 362062",672987,3559,"In the year 2021, a parasitic virus known as ""Gastrea"" infects humans and turns them into monsters. What is left of mankind now lives within the Monolith walls, walls that are made of Varanium, the only material that can hurt Gastrea.

To counter the threat that the Gastrea pose, ""Cursed Children""—female children whose bodies contain trace amounts of the virus which grant them superhuman abilities—officially called Initiators by the Tendo Civil Security, are given partners called Promoters, people who work to guide and protect the young Initiators. These teams of two are sent out on missions to fight the monsters created by the Gastrea virus and keep them at bay. 

Black Bullet revolves around the team of Enju Aihara, an Initiator, and Satomi Rentaro, a Promoter, as they go on missions to fight the growing threat of Gastrea in their hometown of Tokyo.

[Written by MAL Rewrite]"
Little Miss Maruko,ちびまる子ちゃん,TV,Unknown,Currently Airing,"Jan 8, 1995 to ?",Sundays at 18 00 (JST),Sakura Production,add some,Nippon Animation,Manga,"Slice of Life, Comedy, Kids, School",23 min.,G,"7.20, 937",2844,24,"Momoko Sakura is an elementary school student who likes popular idol Momoe Yamaguchi and mangas. She is often called ""Chibi Maruko-chan"" due to her young age and small size. She lives together with her parents, her grandparents and her elder sister in a little town. In school, she has many friends with whom she studies and plays together everyday, including her close pal, Tama-chan; the student committee members, Maruo-kun and Migiwa-san; and the B-class trio: 'little master' Hanawa-kun, Hamaji-Bu Taro and Sekiguchi-kun. This is a fun-loving and enjoyable anime that portrays the simple things in life.

(Source: ANN)"
,映画 クレヨンしんちゃん　暗黒タマタマ大追跡,Movie,1,Finished Airing,"Apr 19, 1997",,TV Asahi,add some,add some,Manga,"Action, Adventure, Comedy, Seinen",1 hr. 39 min.,G,"7.20, 2166",3860,7,"An action comedy film depicting the Nohara family who get caught in a fight between two clans, Tamayura and Tamayomi. Set in Tokyo and Aomori (northern end of Japan's main island). The Tamayomi clan had plotted to revive the evil genie Jarke and to conquer the world. To stop Tamayomi's plot, the three gay brothers (Rose, Lavender and Lemon) from Tamayura clan wrested Jarke's ball, which was a key to revive Jarke, from the bar girl gang of Tamayomi clan, but Shinnosuke's younger sister Himawari swallowed down the ball. The Nohara family, with the three gay brothers and a female detective Yone Higashimatsuyama, fights a fierce battle against the Tamayomi gang chasing them. 

(Source: Manabu Tsuribe)"
Magical Circle Guru Guru 2,ドキドキ♡伝説 魔法陣グルグル,TV,38,Finished Airing,"Apr 4, 2000 to Dec 26, 2000",Tuesdays at 18 00 (JST),"TV Tokyo, Sotsu",add some,Nippon Animation,Manga,"Adventure, Comedy, Magic, Fantasy, Shounen",23 min. per ep.,G,"7.20, 1070",3202,9,"Join the new legend of Guruguru, where Nike, the reluctant hero, and Kukuri, the innocent heroine, return to save the world. The magical adventure that unfolds, with its unique monsters and eccentric characters, is sure to draw you into this curious and exciting realm.

To save the world from evil King Giri, Kukuri must locate the monsters in each territory and win them, one by one, over to her side. Meanwhile Nike's task is to be recognized by the Four Kings of Nature and collect their swords. These swords are known as the ""Sword of Wind,"" the ""Sword of Water,"" the ""Sword of Earth"" and the ""Sword of Fire.""

Can Nike and Kukuri truly become hero and heroine? Follow their journey and find out!

(Source: AniDB)"
Doraemon the Movie Nobita's Great Adventure into the Underworld,映画 ドラえもん のび太の魔界大冒険,Movie,1,Finished Airing,"Mar 17, 1984",,add some,add some,add some,Unknown,Fantasy,1 hr. 38 min.,PG,"7.20, 1473",2783,3,"Having dreamed of being in a world of magic, Nobita and Doraemon used the what-if-telephone-booth gadget to turn the world into one that is based on magic instead of science. Little did they know that demons exist and threaten this magical world.

(Source: ANN)"
,『DOUBLE DECKER! ダグ＆キリル』EXTRA,Special,3,Finished Airing,"Feb 10, 2019 to Apr 10, 2019",,add some,add some,Sunrise,Original,"Action, Sci-Fi, Comedy, Police",24 min. per ep.,R,"7.20, 2196",5302,1,"During the final episode pre-screening event on Friday, it was announced that Double Decker! Doug & Kirill TV anime will get three extra episodes. Titled Double Decker! Doug & Kirill: Extra, the three episodes will be streamed via Bandai Channel and other streaming websites between February and April 2019. The Blu-ray and DVD for the extra episodes will also be released on May 24, 2019.

(Source: MAL News)"
,ドラゴンクエスト ダイの大冒険,TV,Unknown,Currently Airing,"Oct 3, 2020 to ?",Saturdays at 09 30 (JST),"TV Tokyo, Square Enix, Shueisha",add some,Toei Animation,Manga,"Action, Adventure, Fantasy, Shounen",24 min.,PG-13,"7.20, 6217",29636,1880,"A long time ago, there was a valiant swordsman who came to be known simply as ""the hero."" There was a demon who has caused people suffering. The hero and his companions arrived to challenge the demon to a battle and by combining their powers, the battle was brought swift conclusion. With no one around to cause trouble, the island became a quiet place where everyone could live together in peace.

Several years later, the demon is revived. Our present-day protagonist, Dai, lives on a remote island in the southern seas and dreams of becoming a great hero. When he hears about the demon's revival, Dai and his friends take it upon themselves to stop him and the evil force that revived him. Along the way, Dai discovers the identity of ""the hero,"" the truth behind the evil force who revived the demon, and Dai's own hidden powers that surface in times of peril.

(Source: MU, edited)"
Tower of Druaga The Aegis of Uruk,ドルアーガの塔 〜the Aegis of URUK〜,TV,12,Finished Airing,"Apr 5, 2008 to Jun 21, 2008",Unknown,"Dentsu, Sotsu Music Publishing",Funimation,Gonzo,Game,"Adventure, Comedy, Fantasy",25 min. per ep.,PG-13,"7.20, 44243",102277,219,"It is said that every few years, there is what's known as the ""Summer of Anu.""  During that summer, thanks to the divine protection of the sky-god Anu, all of the demons in the tower lose their power.  The country of Uruk has begun an invasion of the tower in order to suppress the demons.  They've built up positions inside the tower, with their sights set on getting to the upper levels.  The Uruk army knows that this is the third Summer of Anu-a perfect time to launch a mission to suppress the monster Druaga once and for all.  The army soldiers aren't the only ones in the tower, though.  An enitre city called Meskia has formed inside the tower's first floor.  It plays host not just to soldiers, but also to adventurers who have heard rumors about a legendary treasure called the Blue Crystal Rod, which is said to rest at the very top of the tower.  With all these different groups in the mix, each with its own agenda, one can only guess how things will play out during this unusual summer.

(Source:  Newtype Magazine)"
Elfen Lied In the Passing Rain,エルフェンリート 通り雨にて 或いは、少女はいかにしてその心情に至ったか?（REGENSCHAUER）,Special,1,Finished Airing,"Apr 21, 2005",,VAP,ADV Films,Arms,Manga,"Horror, Psychological, Supernatural, Drama, Ecchi, Seinen",25 min.,R+,"7.20, 97606",162329,307,"Having been accepted into the Kaede Inn, Nana struggles to find some way to contribute, though she inadvertently brings more trouble than assistance. However, Nana's worries are directed more towards fellow resident Nyu, whom she had only known as Lucy, the violent Diclonius. Fearful that Nyu will unleash the same horrific savagery—violence that scars Nana to this day—upon those close to her, Nana faces a dilemma: attempt to live peacefully alongside Lucy with all the uncertainty that that entails or dispose of the source of her worries, shattering the relationships she has formed at the inn. As Nana struggles to come to a decision, Nyu recalls a painful memory of one of her dearest friends and one of her greatest rivals.

[Written by MAL Rewrite]"
,ギャラクシーエンジェルＺ,TV,9,Finished Airing,"Feb 3, 2002 to Mar 31, 2002",Sundays at 09 30 (JST),"Bandai Visual, Broccoli","Nozomi Entertainment, Bandai Entertainment",Madhouse,Original,"Sci-Fi, Comedy",24 min. per ep.,PG,"7.20, 4059",8577,11,"In the far future, the human race advanced to space, and prospered. However, Jikushin ( earthquake of time and space ) which occurred suddenly intercepted all networks, and all the civilizations were reset. However, the human race begins to revive, and enters the prosperity age of The Second by the Transvaal imperial country which rises at the center of the galactic system. The science and technology before the civilization was reset, that is, ""Lost Technology"" was considered to be god`s task. And, it came to be worshiped by the priest who was called ""Tsuki no miko"".

On the other hand, a certain guard fleet was stationed in the frontier of the galactic system. Though it was the seemingly perfectly ordinary army, the team composed only of the woman called ""Angel Corps"" existed in this army. They controlled the spaceship which was called ""Angel Frame"" which was the relic of Lost Technology. And, they collected the lost technology by using the angel frame, and carried out the duties to manage them. They were not the elite pilots, but Angel Corps was rather an eccentric person`s group. Arms mania`s Forte, costume player`s Mint, taciturn Vanilla, showy Ranpha and Milfeulle who likes cooking ... Every time, they cause a big trouble in the mission.

(Source: AniDB)"
,ガンバリスト! 駿,TV,30,Finished Airing,"Jul 1, 1996 to Mar 10, 1997",Mondays at 19 00 (JST),Yomiuri Telecasting,add some,Sunrise,Manga,"Comedy, Shounen, Sports",26 min. per ep.,PG-13,"7.20, 791",2708,13,"First-year high school student Fujimaki Shun has a dream of becoming an olympic gold medalist as a gymnast. Having no previous training, Shun trusts his passion, boldly joins the gymnastics club, and sets out to pursue his goal.

Along the way, he meets his share of entertaining and supportive upper classmen, develops a romantic interest in his classmate, and learns about the happiness involved in devoting yourself to a sport."
,繰繰れ！コックリさん,Special,11,Finished Airing,"Dec 24, 2014 to May 27, 2015",,add some,Sentai Filmworks,TMS Entertainment,4-koma manga,"Comedy, Supernatural, Romance, Shounen",3 min. per ep.,PG-13,"7.20, 3200",11856,12,Short episodes included with the Blu-ray/DVD volumes. 
