name_english,name_japanese,show_type,episodes,status,aired,broadcast_time,producers,licensors,studios,source,genres,episode_length,rating,score_and_scorers,members,favorites,description
Mr. Tonegawa Middle Management Blues,中間管理録トネガワ,TV,24,Finished Airing,"Jul 4, 2018 to Dec 26, 2018",Wednesdays at 00 00 (JST),"VAP, Half H.P Studio, Nippon Television Network, Nippon Television Music",Sentai Filmworks,Madhouse,Manga,"Comedy, Parody, Psychological, Drama, Seinen",23 min. per ep.,PG-13,"7.14, 7803",29454,74,"Chuukan Kanriroku Tonegawa is a spin-off of the Kaiji series, which follows Tonegawa, the right hand man of Kazutaka Hyoudou, the president of the Teiai Corporation and owner of numerous gambling tournaments. After Hyoudou is getting bored with his life, he orders Tonegawa to organize a so called ""game of death"" as it is his and his subordinate's job to keep the president in a good mood. Tonegawa must cooperate with his subordinates in order to make the president happy and what follows is a humorous story of his interactions with his subordinates and other characters of the Kaiji series.

(Source: MAL News)"
Doraemon the Movie Nobita and the Kingdom of Clouds,映画 ドラえもん のび太と雲の王国,Movie,1,Finished Airing,"Mar 7, 1992",,add some,add some,add some,Unknown,"Adventure, Comedy",1 hr. 40 min.,PG,"7.14, 2494",4103,3,"During class, Nobita questions the teacher where heaven is located when he was being taught about clouds. Being laughed at, Nobita looks for proof that a heavenly place exists on the clouds, but was explained by Doraemon that it cannot exist scientifically. Disappointed, he was eventually helped by Doraemon to create their own kingdom of clouds. Little did they know that there are creatures who have been living on clouds for a long time. 

(Source: ANN) "
,映画 ドラえもん のび太の人魚大海戦,Movie,1,Finished Airing,"Mar 6, 2010",,TV Asahi,add some,Shin-Ei Animation,Manga,"Adventure, Comedy, Fantasy, Kids, Shounen",1 hr. 39 min.,PG,"7.14, 1715",3064,2,"Nobita asks Doraemon to take him somewhere they can dive and as a result the robot-cat uses several gadgets to make it possible for both to able to swim on an imaginary ocean above sea level. Inadvertently a mermaid ends up on Nobita's backyard when they turn off the illusion. Her name is Sophia and she is a princess of an ancient underwater civilization. Doraemon, Nobita, Shizuka, Jyaian, and Suneo quickly become her friends and are invited to visit her homeland. While heading towards the underwater kingdom they find themselves amid a conflict between the mermaids and an opposing tribe that has driven them away from their home planet thousands of years ago. Doraemon, Nobita, and their friends must then aid Sophia find a legendary sword that might bring peace once again to the seas. 

(Source: ANN) "
Dororo,どろろと百鬼丸,TV,26,Finished Airing,"Apr 6, 1969 to Sep 28, 1969",Sundays at 19 30 (JST),Fuji TV,Discotek Media,Mushi Production,Manga,"Action, Adventure, Supernatural",26 min. per ep.,R,"7.14, 2391",10578,64,"To aid his conquest of Japan, the ruthless lord Daigo Kagemitsu offers to sacrifice his soon-to-be-born son to 48 demons. The demons accept, and the next day, the child is born with several missing limbs and is ruthlessly cast down a river.

Fifteen years later, a stubborn young boy named Dororo struggles to survive against hunger and oppressive samurai on the streets of an impoverished and war-torn village. After angering a group of thugs, Dororo is attacked by them, but a mysterious man interrupts them, claiming to hear spirits nearby. Sure enough, a monster emerges from the river, and the man then removes his prosthetic arms, revealing blades hidden underneath, with which he slays the monster before leaving.

That night, as the man walks through the forest, Dororo approaches him and declares that he will accompany him. From this, the man, Hyakkimaru, reveals that many of his body parts were stolen by demons and that though he sought a peaceful life, he couldn't escape their relentless onslaught. Despite the tale, Dororo still insists on tagging along. And thus, Hyakkimaru travels through Japan with his new companion and a puppy named Nota, facing the brutality of both hell and mankind.

[Written by MAL Rewrite]"
Dragon Ball Z Bojack Unbound,ドラゴンボールZ 銀河ギリギリ!!ぶっちぎりの凄い奴,Movie,1,Finished Airing,"Jul 10, 1993",,add some,Funimation,Toei Animation,Manga,"Action, Adventure, Comedy, Fantasy, Sci-Fi, Shounen",50 min.,PG-13,"7.14, 54507",87748,42,"Mr. Money is holding another Tenka'ichi Budokai and Mr. Satan invites everyone in the world to join in. Little does he know that Bojack, an ancient villain who has escaped his prison, is competing. Since Goku is currently dead, it is up to Gohan, Vegeta, and Trunks to defeat Bojack and his henchman."
,デンゼルを中心としたオリジナルアニメ,OVA,1,Finished Airing,"Apr 16, 2009",,Square Enix,add some,A-1 Pictures,Novel,"Action, Fantasy, Super Power",28 min.,PG-13,"7.14, 11673",23328,15,"Final Fantasy VII spinoff novel On the Way to a Smile Episode: Denzel will be adapted into an anime for the Final Fantasy VII: Advent Children Complete release on April 16. The anime will ship as an extra supplement on Advent Children's Blu-ray Disc releases. The Denzel part of On the Way to a Smile story begins as the character Denzel aims to enlist in the World Regenesis Organization (WRO) and ""leaps"" back into Denzel's past. (Source: ANN)"
Pretty Cure Splash Star,ふたりはプリキュア Splash☆Star,TV,49,Finished Airing,"Feb 5, 2006 to Jan 28, 2007",Unknown,Asahi Broadcasting,add some,Toei Animation,Original,"Action, Comedy, Magic, Fantasy, Shoujo",24 min. per ep.,G,"7.14, 3507",9414,64,"During the summer festival five years ago, two girls met at a mysterious tree and saw two glowing spheres. Now, these two girls--Saki Hyuuga, ace pitcher on the school softball team; and Mai Mishou, who prefers sketching over stargazing--are chosen by the spirits of flowers (Flappy) and birds (Choppy) to restore the Seven Fountains and save their worlds from Dark Autumn. Together, they are the NEW Pretty Cure.

(Source: ANN)"
,ガールズ&パンツァー タイヤキ・ウォー！,Special,1,Finished Airing,"Feb 27, 2020",,add some,add some,add some,Original,"Military, Comedy, School",10 min.,PG-13,"7.14, 1106",4135,6, Special included with Girls & Panzer: Saishuushou Part 2 Blu-ray and DVD.
Ace Attorney Season 2,逆転裁判 ～その「真実」、異議あり！～ Season 2,TV,23,Finished Airing,"Oct 6, 2018 to Mar 30, 2019",Saturdays at 17 30 (JST),"Aniplex, Capcom",Funimation,CloverWorks,Game,"Comedy, Drama, Mystery, Police",24 min. per ep.,PG-13,"7.14, 8395",24466,79,"Defense attorney Ryuuichi Naruhodou is still hard at work defending the falsely accused with his knack for last-minute turnabouts. With his trusty assistant and medium-in-training Mayoi Ayasato in tow, Ryuuichi's fame as a champion for the innocent steadily grows. But this newfound success attracts the attention of the coffee-loving, masked Godot⁠—a mysterious rookie prosecutor who bears an inexplicable grudge against Ryuuichi.

With the help of their allies, Ryuuichi and Mayoi take this new challenger head-on and search for the reason behind his appearance. But before long, the first two cases from the career of Mayoi's late sister Chihiro Ayasato become critical to solving a fantastical murder mystery, continuing the bloody saga of the tumultuous Ayasato clan. Will Ryuuichi once again be able to overcome the odds and find the truths hidden within the web of lies?

[Written by MAL Rewrite]"
Smart-san,はいからさんが通る,TV,42,Finished Airing,"Jun 3, 1978 to Mar 31, 1979",Unknown,Asahi Broadcasting,add some,Nippon Animation,Manga,"Drama, Historical, Romance, Shoujo, Slice of Life",24 min. per ep.,PG-13,"7.14, 489",3893,10,"Set in the 1920s, Haikara-san ga Tooru is the story of the high-spirited tomboy Benio and her relationship with a handsome half-German soldier named Shinobu. Benio is a very outgoing and athletic girl with firm ideas about being able to live her life as she wants to. When she first meets Shinobu, she dislikes him intensely, even though he manages to help her out of a series of embarrassing mishaps. She is therefore surprised when she finds out that she has been forced into an arranged marriage and that her husband-to-be is none other than Shinobu! The story then has many twists and turns, as Shinobu has to fight in the war, Benio has to wrangle with the idea of getting married, and getting along with her future in-laws and employer. Meanwhile, the great Kanto earthquake looms in the future..."
Hell Teacher Nube,地獄先生ぬ～べ～,OVA,3,Finished Airing,"Jun 12, 1998 to May 14, 1999",,Toei Video,add some,add some,Unknown,"Action, Supernatural, Comedy, School, Demons, Horror, Shounen",30 min. per ep.,PG-13,"7.14, 843",2437,11,Continuation of the TV series.
,ユンカース・カム・ヒア,Movie,1,Finished Airing,"Jul 20, 1994",,"Bandai Visual, Kadokawa Shoten",Bandai Entertainment,Triangle Staff,Novel,"Slice of Life, Drama",1 hr. 39 min.,G,"7.14, 1732",4881,7,"This heartwarming and unexpectedly mature story concerns a young girl named Hiromi Nozawa and her dog, Junkers (pronounced Yoon-kers). Hiromi walks us through her childhood troubles of love, schooling, and family bonds. Her companion Junkers accompanies her on this adventure; however, Junkers is no ordinary dog—he can talk and grant 3 wishes. "
,キディ・グレイド　劇場版　第三部 黎明篇,Movie,1,Finished Airing,"Sep 1, 2007",,"Kadokawa Shoten, gimik",add some,"Gonzo, Asread",Original,"Action, Mecha, Sci-Fi, Super Power",1 hr. 30 min.,PG-13,"7.14, 1060",4007,5,A is the retelling of the original anime's finale.
Demon Prince Enma,鬼公子　炎魔,OVA,4,Finished Airing,"Aug 24, 2006 to Mar 23, 2007",,Bandai Visual,"Bandai Entertainment, Bandai Visual USA",Brain's Base,Manga,"Horror, Demons, Supernatural, Magic, Ecchi, Fantasy, Seinen",40 min. per ep.,R+,"7.14, 6161",17203,48,"Enma is a character created by the genius manga artist Go Nagai. Now, the popular character makes his appearance in an alluring Japanese horror anime for adults. It's a hair-raising erotic suspense in which Enma takes on complicated and gruesome incidents caused by demons who lurk in the darkness. But humans have lit up the darkness of the night with neon lights and turned their world into one that never sleeps, so demons now lurk in the ""darkness of the human heart."" Unfulfilled hearts, suppressed hearts, despair,...such darkness of the heart is the place they lurk.

Enma is the Demon Prince of the Underworld, a demon ""Born of Fire."" His mission is to take back or destroy demons that have escaped to the human world from the Underworld. Along with his partner, Princess Yukihime, ""Born of Ice,"" and the monster, Kapaeru, Enma sets up ""Enma's Detective Agency."" Tonight, like any other night, they will roam the sleepless city. Horrific incidents that could not possibly be human acts occur one after another. The stench of evil lingers at the scene... Enma's fire rips through the darkness!

(Source: Bandai Entertainment)"
Spiritpact,灵契,ONA,20,Finished Airing,"Jun 21, 2016 to Nov 1, 2016",,Tencent Animation & Comics,add some,Haoliners Animation League,Web manga,"Action, Comedy, Magic, Shounen Ai, Supernatural",14 min. per ep.,PG-13,"7.14, 17925",58702,420,"Low on luck after a series of unfortunate events, You Keika works part-time to try bringing himself out of a life of poverty. After a strange encounter with a white-haired man in a junkyard, You wakes up to discover that he was killed in a sudden accident and has become a spirit. The man he had encountered, Tanmoku Ki, is revealed as the 13th Youmeshi of the Tanmoki, the highest-ranking exorcist family of China. Noticing the wandering spirit, he offers You the opportunity to form a pact: he will offer You protection from humans and in return, You will have to become his spirit shadow, keeping him safe and guarded at all times.

From then on, the two face untold challenges in the spiritual world, striving to keep those around them safe from harmful spirits. Along the way, the pact they formed grows into something more; a bond that neither of the two ever expected. Behind their roles as master and servant, a lingering admiration begins to emerge.

[Written by MAL Rewrite]"
Magical Angel Creamy Mami,魔法の天使 クリィミーマミ,TV,52,Finished Airing,"Jul 1, 1983 to Jun 29, 1984",Fridays at 18 00 (JST),Kodansha,add some,Studio Pierrot,Original,"Comedy, Fantasy, Magic, Romance, School, Sci-Fi, Shoujo",24 min. per ep.,G,"7.14, 2348",9964,107,"Creamy Mami is about a young girl, Yuu, who after seeing a spaceship is given the power to use magic for one year. She is also given 2 cats, Poji and Nega, to watch over and guide her. Using her magic powers to transform into the idol Creamy Mami, Yuu must work hard at acting, singing, helping her parents at their crepe shop, fighting aliens and bad guys, going to school, plus try to get the affections of her childhood friend Toshio.

(Source: ANN)"
MM!,えむえむっ!,TV,12,Finished Airing,"Oct 2, 2010 to Dec 18, 2010",Unknown,"Lantis, Media Factory, AT-X",Sentai Filmworks,Xebec,Light novel,"Harem, Comedy, Ecchi, School",23 min. per ep.,PG-13,"7.14, 104817",199082,681,"Taro Sado is a high school student who lives his day to day life with a big secret—he's a masochist! Encouraged by his cross-dressing best friend Tatsukichi Hayama, Taro asks the Second Voluntary Club for help with his problem and ends up joining the club after they vow to ""fix"" him.

However, it turns out that all of the members of the club have some serious issues. The club leader Mio Isurugi is a self-designated god who is afraid of cats, Arashiko Yuuno has a severe fear of men, and the club advisor Michiru Onigawara is a sadist who enjoys making people cosplay. 

Together with other wacky characters such as Yumi Mamiya, a talented masseuse and Yuuno's best friend, and Noa Hiiragi, the president of the invention club, they all learn about the importance of acceptance and kindness.

[Written by MAL Rewrite]"
More! Ojamajo Doremi Secret of the Frog Stone,も～っと！おジャ魔女どれみ カエル石のひみつ,Movie,1,Finished Airing,"Jul 14, 2001",,add some,add some,Toei Animation,Unknown,"Kids, Magic, Shoujo",26 min.,G,"7.14, 1485",3754,5,"Mo~tto Ojamajo Doremi movie features the five witches Doremi, Aiko, Hazuki, Onpu, and Momoko as they visit Doremi's grandpa's home. There, they learn of the mystery of the frog stone, a magical place where magic used to mingle in the old countryside. Aiko rediscovers her love for grandpa, and Doremi learns a piece of the magical kingdom's past.

(Source: ANN)"
Bodacious Space Pirates the Movie Abyss of Hyperspace,モーレツ宇宙海賊 ABYSS OF HYPERSPACE -亜空の深淵-,Movie,1,Finished Airing,"Feb 22, 2014",,Starchild Records,Sentai Filmworks,Satelight,Light novel,"Sci-Fi, Space",1 hr. 33 min.,PG-13,"7.14, 4094",11479,13,"Marika Katou, a third year student at Hakuho Girls' Academy, is a legitimate space pirate with a Letter of Marque. Between her studies, leading her school's space yacht club, working part time at Cafe Lamp, and being the captain of the space pirate ship Bentenmaru, Marika's days are very busy. One day, Marika gets a job to rob a high-class passenger ship, and she discovers that on the passenger list is Kanata Mugen, a boy who owns a ""galaxy pass"". Thus, an adventure featuring a hyperspace race between pirates and one young boy begins.

(Source: ANN)"
The Seven Deadly Sins Heroes' Frolic,七つの大罪 英雄たちは燥(はしゃ)ぐ,OVA,1,Finished Airing,"Nov 16, 2018",,add some,add some,A-1 Pictures,Manga,"Action, Adventure, Supernatural, Magic, Fantasy, Shounen",24 min.,PG-13,"7.14, 13667",43300,56,OVA bundled with the 34th volume of the manga.
OreImo,俺の妹がこんなに可愛いわけがない,TV,12,Finished Airing,"Oct 3, 2010 to Dec 19, 2010",Sundays at 23 30 (JST),"Aniplex, Movic, ASCII Media Works, Jumondo",Aniplex of America,AIC Build,Light novel,"Slice of Life, Comedy",24 min. per ep.,PG-13,"7.14, 310035",543879,4497,"Kirino Kousaka embodies the ideal student with equally entrancing looks. Her grades are near perfect, and to cover her personal expenses, she works as a professional model alongside her best friend Ayase Aragaki, who abhors liars and all things otaku. But what Ayase doesn't know is that Kirino harbors a deep, entrenched secret that will soon be brought to light.

At home one day, Kyousuke, Kirino's perfectly average brother, stumbles upon an erotic game that belongs to none other than his seemingly flawless little sister. With her reputation at stake, Kirino places a gag order on her sibling while simultaneously introducing him to the world of eroge and anime. Through Kirino, Kyousuke encounters the gothic lolita Ruri Gokou and the bespectacled otaku Saori Makishima, thus jump-starting an entirely new lifestyle. But as he becomes more and more involved in his little sister's secret life, it becomes that much harder to keep under wraps. 

[Written by MAL Rewrite]"
Seraph of the End The Beginning of the End,終わりのセラフ特別編 The Beginning of the End,Special,1,Finished Airing,"Oct 3, 2015",,add some,add some,Wit Studio,Manga,"Action, Drama, Shounen, Supernatural, Vampire",24 min.,R,"7.14, 15594",38846,87,Recap of 1st Season Aired Before Nagoya Kessen-hen.
Pretty Cure All Stars DX2 Light of Hope - Protect the Rainbow Jewel!,映画 プリキュアオールスターズDX2 希望の光☆レインボージュエルを守れ!,Movie,1,Finished Airing,"Mar 20, 2010",,Asahi Broadcasting,add some,Toei Animation,Original,"Action, Fantasy, Magic, Shoujo",1 hr. 10 min.,G,"7.14, 2194",4953,9,"Tsubomi Hanasaki is woken by her best friend Erika Kurumi only to find out that their two fairies, Coffret and Shypre, have left just leaving a note explaining where to find them. Fairy Park is not only the destination of both girls, it is also the meeting point of all other Precures who planned to spend this special day together. This magical theme park holds the Rainbow Jewel, a special gem that represents all of the hopes and dreams of the world. Such a powerful stone is the object of desire of a malefic entity named Bottom who has waited one thousand years for the opportunity to possess it."
Soul Hunter,仙界伝 封神演義,TV,26,Finished Airing,"Jul 3, 1999 to Dec 25, 1999",Unknown,TV Tokyo Music,"ADV Films, Discotek Media",Studio Deen,Manga,"Magic, Adventure, Fantasy, Supernatural, Historical, Shounen",24 min. per ep.,PG-13,"7.14, 5974",14526,74,"Thousands of years ago, it was a time of witchcraft and dark magic. An evil sorceress has bewitched the emperor of the mighty dynasty and he has become a mindless puppet. The country is in shambles, and evil spirits lurk everywhere. The human world is on the verge of utter destruction. A bold mission is planned by the Confederation of the Immortal Masters. They send a young master wizard to hunt down the villains and evil warlocks in the devastated lands.

(Source: ANN)"
,新あたしンち,TV,26,Finished Airing,"Oct 6, 2015 to Apr 5, 2016",Tuesdays at 19 00 (JST),add some,add some,Shin-Ei Animation,Manga,"Slice of Life, Comedy",23 min. per ep.,G,"7.14, 820",2379,11,"Outrageous misadventures of an almost normal family with a housewife, her husband, and their two kids Yuusuke and Mikan. Wacky humor about this weird family's daily life.

(Source: AniDB)"
,劇場版 探偵オペラ ミルキィホームズ〜逆襲のミルキィホームズ〜,Movie,1,Finished Airing,"Feb 27, 2016",,"Sotsu, Bushiroad, Tokyo MX, Chrono Gear Creative, Bushiroad Music, Epicross",add some,J.C.Staff,Original,"Mystery, Comedy, Super Power",1 hr. 9 min.,PG-13,"7.14, 1052",3383,4,"The four members of Milky Holmes are going on a study tour. While soaking in the hot springs among snow monkeys, alarms interrupt the relaxing environment! It was the work of the Thief Empire. A fierce battle between Milky Holmes and the Thief Empire begins, with both sides using their Toys (special powers). Furthermore, with the arrival of the Genius 4, a three-way fight occurs! In the midst of battle, a violent lightning strikes from the sky. Struck by the lightning, the four Milky Holmes girls lose their abilities."
Tenchi the Movie 2 Daughter of Darkness,天地無用！真夏のイヴ,Movie,1,Finished Airing,"Aug 2, 1997",,"Geneon Universal Entertainment, Genco, Pioneer LDC, Nippon Cultural Broadcasting","Funimation, Geneon Entertainment USA",AIC,Unknown,"Action, Comedy, Sci-Fi, Shounen, Space",59 min.,R+,"7.14, 7025",13433,15,"Tenchi Masaki gets the surprise of his life when a teenage girl approaches him and calls him ""Daddy."" Believing that the girl is mistaking him for someone else, Tenchi brings her home to figure out what is going on, which turns out to be a big mistake. When the girl introduces herself as Mayuka Masaki, Tenchi's daughter, the Masaki household is thrown into yet another frenzy. 

Thinking that Mayuka is just taking advantage of Tenchi, the girls refuse to believe that she is really his child. However, when DNA testing reveals that Tenchi is indeed her father, Washuu comes to the conclusion that Mayuka is his daughter from the future, the result of a recent time distortion. With this new revelation, everyone tries to welcome Mayuka into their lives with the sole exception being Ryouko Hakubi, who senses something sinister lurking beneath Mayuka's charm.

[Written by MAL Rewrite]"
,グレンラガン パラレルワークス,Music,8,Finished Airing,"Jun 15, 2008 to Sep 14, 2008",,Aniplex,add some,Gainax,Original,Music,3 min. per ep.,PG-13,"7.14, 14972",29552,24,"An anthology of animated shorts featuring characters from Gurren Lagann in alternative worlds. Every clip is animated by a particular animator of GAINAX.

Creators are Akira Amemiya, Shin Itagaki, Hirokazu Kojima, SUEZEN, Ryouji Masuyama, Hiroyuki Yamaga, Yoh Yoshinari, and Keisuke Watanabe"
,天上人とアクト人最後の戦い,Movie,1,Finished Airing,"Apr 18, 2009",,add some,add some,Kyoto Animation,Original,"Action, Fantasy, Magic, Super Power, Supernatural",1 hr. 30 min.,PG-13,"7.14, 2268",7100,10,"A movie finale to Munto, a director's cut of the climactic scenes with new footage."
,とんかつDJアゲ太郎,TV,12,Finished Airing,"Apr 10, 2016 to Jun 26, 2016",Sundays at 22 15 (JST),"YTV, DAX Production, Shueisha, Yomiuri TV Enterprise",add some,Studio Deen,Manga,"Music, Comedy, Shounen",9 min. per ep.,PG-13,"7.14, 5158",11472,88,"Tonkatsu chef by day, professional DJ by night—this is the aspiration of Agetarou Katsumata, whose family owns a small tonkatsu shop in Shibuya.

One night, Agetarou delivers an order to a staff member at a nightclub and gets invited inside as a token of thanks. Although nervous at first, he soon finds himself absorbed by the atmosphere, falling in love with the dancing girls, flashing lights, and groovy music. Agetarou starts visiting the club regularly until a certain night leads him to a chance encounter with a legendary American DJ: Big Master Fly. Putting on a spectacular show, the DJ sparks an epiphany in Agetarou—the groove of mixing music appears to be strikingly similar to the rhythm of preparing tonkatsu. Thenceforth Agetarou sets his sights on becoming a master of both disciplines.

With the help of his neighborhood friends and his mentor DJ Oily, Agetarou pursues his dream all the while dealing with familial problems, love issues, and many other kinds of trouble. Tonkatsu DJ Agetarou is a hilarious tale about an impulsive young boy trying to find his own path in life, while still fulfilling his familial and social responsibilities.

[Written by MAL Rewrite]"
Toriko the Movie Secret Recipe of Gourmet God!,劇場版トリコ 美食神の超食宝 (スペシャル・メニュー),Movie,1,Finished Airing,"Jul 27, 2013",,"Yomiko Advertising, Toei Video, Bandai, Nippon Columbia, Happinet Pictures, Bandai Namco Games, Shueisha",Discotek Media,Toei Animation,Unknown,"Action, Adventure, Fantasy, Shounen",1 hr. 21 min.,PG-13,"7.14, 2230",5282,4,"The new Toriko movie, planned for Summer 2013."
