name_english,name_japanese,show_type,episodes,status,aired,broadcast_time,producers,licensors,studios,source,genres,episode_length,rating,score_and_scorers,members,favorites,description
,劇場版イナダン×豆しば コラボCM,Special,2,Finished Airing,"Oct 30, 2012",,add some,add some,add some,Other,"Comedy, Kids, Sports",30 sec. per ep.,G,"5.45, 236",630,0,Collaboration commercials between the Inazuma Eleven Go vs. Danball Senki W Movie and Mameshiba.
Inferno Cop Fact Files,インフェルノコップ ファクトファイル,ONA,12,Finished Airing,"Dec 28, 2012 to Mar 17, 2013",,CoMix Wave Films,add some,Trigger,Original,"Action, Comedy, Police",24 sec. per ep.,R,"5.45, 4511",8956,2,"There are 12 companion pieces in the forms of ""Fact Files"" (which expand upon a given character from a corresponding episode) airing shortly after each episode. "
,活動写真,Movie,1,Finished Airing,Not available,,add some,add some,add some,Original,,3 sec.,G,"5.45, 2652",4466,13,"The film consists of a series of cartoon images on fifty frames of a celluloid strip and lasts three seconds at sixteen frames per second. It depicts a young boy in a sailor suit who writes the kanji characters ""活動写真"" (katsudou shashin, or ""moving picture""), then turns towards the viewer, removes his hat, and offers a salute.

(Source: Wikipedia)"
,キンタロー体育日記,Movie,1,Finished Airing,"Sep 19, 1940",,add some,add some,add some,Original,Comedy,9 min.,G,"5.45, 140",411,1,"A young man in a leotard leads a group of animals in a sumo wrestling match. The bear is the final victor of all the animals, but then loses when he must face Kintaro."
Lightning Trap Leina & Laika,ライトニングトラップ レイナ＆ライカ,OVA,1,Finished Airing,"May 23, 1990",,Youmex,add some,Ashi Production,Original,"Action, Sci-Fi",27 min.,PG-13,"5.45, 306",727,0,"The fourth and final OVA of the Leina-centric Machine Robo: Revenge of Chronos spin-off/sequel. Instead of following the story of the previous Wolf Sword Legend continuity, Lightning Trap takes place in another universe.

In present day Tokyo, traveling has never been more comfortable than aboard the Lightning L808, Japan's new luxury passenger plane. One day, on what seemed to be a routine flight, Haruka Leina and the plane's passengers were unaware of the mysterious and top secret cargo brought aboard, which attracted the attention of international terrorists set on obtaining it. Now, with a dangerous hostage situation at hand, only special agent Laika Strange and brave Leina may be able to save the passengers, and keep the deadly cargo from falling into the wrong hands..."
