name_english,name_japanese,show_type,episodes,status,aired,broadcast_time,producers,licensors,studios,source,genres,episode_length,rating,score_and_scorers,members,favorites,description
Last Period The Journey to the End of the Despair,ラストピリオド -終わりなき螺旋の物語-,TV,12,Finished Airing,"Apr 12, 2018 to Jun 28, 2018",Thursdays at 00 00 (JST),Egg Firm,add some,J.C.Staff,Game,"Action, Adventure, Comedy, Fantasy, Magic",23 min. per ep.,PG-13,"6.45, 7170",29594,21,"""Period"" is how magic users called who beat ""Spiral""—monsters that were summoned from isolation. Due to the rise of these beings, 14-year-old apprentice Period Haru, who is a part of the Eighth Arc-end Division, is called to break the cycle and cast himself into the endless battle. However, a mysterious thievery occurred and sank the division into bankruptcy, forcing Haru and his other comrades have to leave their headquarters. To rebuild a branch, they have to overcome quest after quest.

(Source: MAL News)"
,ミュークルドリーミー,TV,Unknown,Currently Airing,"Apr 5, 2020 to ?",Sundays at 10 30 (JST),Sanrio,add some,J.C.Staff,Other,"Adventure, Kids, Fantasy",24 min.,G,"6.45, 519",3554,9,"The story begins when a middle school girl named Yume sees something fall from the sky, and meets a pale violet-colored kitten named Mew. It turns out that Mew has the power of ""Yume Synchro"" (Dream Synchro), the power to enter dreams. In the dream world, the girl and Mew collect Dream Stones. 

(Source: ANN)"
Mobile Police Patlabor Minimum,ミニパト,Movie,3,Finished Airing,"Mar 30, 2002 to Apr 13, 2002",,"Bandai Visual, Tohokushinsha Film Corporation","Maiden Japan, Geneon Entertainment USA",Production I.G,Original,Parody,10 min. per ep.,PG,"6.45, 960",2666,4,"Unlike most shows the three episodes are not only totally unrelated to each other but really don't follow a plot as such and are more a light hearted jibe at both the Patlabor series (TV and films) and other ""mecha"" Anime. Episode 1 is a brief introduction to the weaponry carried by the Ingram and how it was designed and why it is the way it is. Episode 2 looks at the design and maintenance of the Ingram 98 AV in SVU2 and takes a swipe at the marketing forces behind them (as in merchandising for the series). Episode 3 is the only one to attempt to expand on a very minor point raised in the original TV show and just how SVU2 is actually funded.

(Source: ANN)"
,12歳。～ちっちゃなムネのトキメキ～,TV,12,Finished Airing,"Apr 4, 2016 to Jun 20, 2016",Mondays at 19 30 (JST),"Shogakukan-Shueisha Productions, AT-X, Nippon Columbia, Tokyo MX, Shogakukan, JR East Marketing & Communications, Sun TV",add some,OLM,Manga,"Romance, School, Shoujo",24 min. per ep.,PG,"6.44, 11177",25758,51,"Reaching a period of life where they are neither a child nor an adult, 12-year-old Hanabi Ayase and Aoi Yui meet with life-changing events. Due to the mischievous demeanor of her male classmates, Ayase does not think highly of the opposite sex. However, her perspective begins to change after she is paired with the kind-hearted Takao Yuuto for a class assignment and unexpectedly shared their first kisses with each other on the school rooftop.

With her best friend discovering love, Aoi yearns to seek her own. She finds herself falling in love with the rash Kazuma Hiyama after protecting her from a rejected suitor who had talked behind her back.

12-sai.: Chicchana Mune no Tokimeki follows the four in this phase of adolescence. As they grow up alongside each other, this sweet romance depicts the innocence and excitement of first love.

[Written by MAL Rewrite]"
,爱神巧克力 完结纪念,ONA,1,Finished Airing,"Mar 23, 2016",,Tencent Animation & Comics,add some,B.CMAY PICTURES,Web manga,"Harem, Comedy, Romance, School",8 min.,PG-13,"6.44, 441",2086,1,Recap episode of the first season of Aishen Qiaokeli-ing posted on the official Tenecent biibili channel.
Android Announcer Maico 2010,アンドロイド・アナ　MAICO ２０１０,TV,24,Finished Airing,"Apr 6, 1998 to Sep 28, 1998",Unknown,"Pony Canyon, animate Film, Movic",add some,"Group TAC, Animaruya",Manga,"Comedy, Drama, Sci-Fi, Seinen",14 min. per ep.,PG-13,"6.44, 853",2797,3,"In the year 2010, the Japanese radio industry is in decline. To reverse their flagging ratings, a station staffed with perennial losers makes a daring gamble: to hire the industry's first android on-air host. Maico is cute, but it will take more than novelty to win over the fickle audience -- especially with a crew as inept as this one. "
,爆走兄弟レッツ&ゴー!! WGP 暴走ミニ四駆大追跡!,Movie,1,Finished Airing,"Jul 5, 1997",,add some,add some,add some,Manga,"Adventure, Cars, Shounen, Sports",1 hr. 20 min.,G,"6.44, 247",735,0,"Rion gets tricked into installing a chip into his racing car called ""Gun Bluster"" by the mini-4wd company he was associated with. His car starts racing without control and causing various riots with fellow racers, Rion teams up with the TRF Victorys and start chasing after Gun Bluster to remove the chip.

Rion, Retsu and Go Seiba along with the other TRF members, Ryo Takaba with the help of his little brother, Jiromaru, Tokichi and J are confroted with an association that is also after Gun Bluster, but what are their intentions?

United along-side their trademark mini-4wd, the TRF's and Rion race together and avoid traps to safelly capture Gun Bluster!"
,バトルスピリッツ 少年突破バシン,TV,50,Finished Airing,"Sep 7, 2008 to Sep 6, 2009",Unknown,"Sotsu, Nagoya Broadcasting Network",add some,"Sunrise, Toei Animation",Card game,"Game, Shounen",24 min. per ep.,PG,"6.44, 633",2532,11,"Meet Toppa Bashin, a hero sixth-grader's favorite trading card. Bashin Kadobatora got a special ability. The legend is a rumor at school Reakado X. Bashin actually know that there are rivals with the pyroxene in the same way, the X over the Reakado, intense card battle we protest. Stocked all the time Reakado X, say the battle to achieve the strongest and legendary champion. The ultimate battle and win the world champion's best put to everyone. 

(Source: ANN, edited)"
Berserk,ベルセルク,TV,12,Finished Airing,"Jul 1, 2016 to Sep 16, 2016",Fridays at 22 30 (JST),"WOWOW, Mainichi Broadcasting System, Hakusensha, Ultra Super Pictures, LIDENFILMS, NBCUniversal Entertainment Japan, Lucent Pictures Entertainment, Docomo Anime Store, Koei Tecmo Games, Rialto Entertainment","Funimation, Crunchyroll","Millepensee, GEMBA",Manga,"Action, Adventure, Demons, Drama, Fantasy, Horror, Military, Romance, Seinen, Supernatural",24 min. per ep.,R+,"6.44, 108024",236914,1743,"Now branded for death and destined to be hunted by demons until the day he dies, Guts embarks on a journey to defy such a gruesome fate, as waves of beasts relentlessly pursue him. Steeling his resolve, he takes up the monstrous blade Dragonslayer and vows to exact vengeance on the one responsible, hunting down the very man he once looked up to and considered a friend.

Along the way, he encounters some unlikely allies, such as a small elf named Puck, and Isidro, a young thief looking to learn swordsmanship from the former mercenary. As the ragtag group slowly comes together after having decided to join Guts in his quest, they will face incredible danger unlike anything they have ever experienced before.

[Written by MAL Rewrite]"
GGO Football,超智能足球,TV,52,Finished Airing,"Jun 2, 2010 to Jun 10, 2014",Unknown,add some,add some,add some,Original,"Comedy, Sports",22 min. per ep.,G,"6.44, 179",569,7,"As we enter the 21st century, the relationship between sports and technology is getting closer and closer. Sports products are enhanced by technological advances. The designs of footballs and football shoes require detailed information and computer tests in order to produce products that will allow us to reach the full potential and beyond. If we were only reliant on human testing, the standards would definitely fluctuate greatly. Thus, Professor GGO was brought in as consultant in the research, and as a result GGO robotic footballers were created.

(Source: GGO Football Website)"
Beast Wars Neo,超生命体トランスフォーマー ビーストウォーズ・ネオ,TV,35,Finished Airing,"Feb 3, 1999 to Sep 29, 1999",Unknown,add some,add some,Production Reed,Unknown,"Action, Adventure, Space, Mecha, Shounen",23 min. per ep.,PG,"6.44, 722",2033,2,"Beast Wars Neo was a television series that aired in Japan in 1999, in support of the toyline of the same name. It directly follows Beast Wars II.

The show follows the adventures of a crew of Maximals, commanded by Big Convoy, as they compete with Magmatron's evil Predacons to collect the Angolmois energy capsules, scattered at the end of Beast Wars II. "
,CODE-E,TV,12,Finished Airing,"Jul 4, 2007 to Sep 19, 2007",Unknown,Nagoya Broadcasting Network,add some,Studio Deen,Original,"Comedy, Romance, School, Sci-Fi, Slice of Life",24 min. per ep.,G,"6.44, 6479",15929,19,"Chinami Ebihara is girl with a strange ability to generate electromagnetic waves when her emotions run high. However, since this ""ability"" affects anything electrical, it resulted in her having to transfer from school to school when she was younger. As Chinami, now 18 years of age, transfers to a new school, she once again affects the electronic devices in the school, but this time, when another student, Kotaro Kannagi, sees her do this, he becomes obsessed in studying her ""TYPE-E"" ability.

(Source: ANN)"
,こみっくパーティー,Special,4,Finished Airing,"Jan 13, 2003",,KSS,"Nozomi Entertainment, Discotek Media",OLM,Visual novel,"Comedy, Drama",7 min. per ep.,PG-13,"6.44, 1339",3283,3,"The DVD Specials.

Kazuki, together with his friends, goes to a Comic Party that's going to be held in a hot spring. There, they make an incredible discovery that is going to reveal something amazing about comic conventions."
evangelion Another Impact,evangelion Another Impact（VR）,Movie,1,Finished Airing,"Jul 2, 2018",,add some,add some,add some,Original,"Action, Mecha, Sci-Fi",4 min.,PG-13,"6.44, 1738",10024,21,"The all-consuming sense of scale of ""evangelion: Another Impact (Confidential)"", which was released in the 2015 Japan Anima(tor)'s Exhibition, gets retouched upon in all new short VR movie.

​Another time, another place. An activation test of a decisive weapon was underway. With its development and operational trials shrouded in complete secrecy, the Another Number - Unit Null, suddenly breaks free of human control and goes berserk.

​For what purpose was Another Number - Unit Null created?

​The story of an Evangelion's activation, rampage and howling in another world... 

(Source: Official Site)"
FLCL Progressive,フリクリ プログレ,Movie,1,Finished Airing,"Sep 28, 2018",,Toho Visual Entertainment,NYAV Post,"Production I.G, Signal.MD, Production GoodBook",Original,"Action, Comedy, Dementia, Mecha, Parody, Sci-Fi",2 hr. 16 min.,PG-13,"6.44, 23631",98648,193,"Hidomi Hibajiri is a dissilusioned young girl who never takes off her headphones. Her whole life consists of going to school, helping out at her mother's cafe, and listening to music. And with nothing else to break the crippling monotony, she keeps her headphones on at all times. That is, until she is run over by a mysterious guitar-wielding woman.

That same night, a robot barges into Hidomi’s room along with a boy from her class, Ko Ide, and the kids are chased around town together. They're saved by the guitar-wielding woman from before, but now Hidomi's got a horn growing from her forehead? Who knows where these robots are coming from, what kind of vespa woman this weird guitar woman is warning her about, or what this thing on her forehead is, but it doesn't look like Hidomi is going to be able to ignore all this with headphones!

[Written by MAL Rewrite]"
Galilei Donna Storia di tre sorelle a caccia di un mistero,ガリレイドンナ,TV,11,Finished Airing,"Oct 11, 2013 to Dec 20, 2013",Fridays at 00 50 (JST),"Aniplex, Dentsu, Fuji TV, Asahi Production, Kyoraku Industrial Holdings","Discotek Media, Crunchyroll",A-1 Pictures,Original,"Action, Sci-Fi, Adventure",24 min. per ep.,R,"6.44, 20832",48702,49,"Three sisters, Hozuki, Kazuki, and Hazuki, are descendants of Galileo and have completely different personalities and tastes; they never meet eye-to-eye. One day, the girls are suddenly attacked by a mysterious organization. The organization was after the ""Galileo Tesoro"" which Galileo Galilei was said to have discovered. Still unaware of what was going on, the sisters escape on the airship they built after the sudden attack. But it won't be so easy for these three sisters to help each other out in a pinch when they're constantly at odds with each other. What is the Tesoro, and what is the organization after? And what about the relationship between the sisters? It's a threesome of cute girls, action, and mystery!

(Source: Fuji Creative)"
Spooky Kitaro Japan Explodes!!,劇場版 ゲゲゲの鬼太郎 日本爆裂!!,Movie,1,Finished Airing,"Dec 20, 2008",,add some,add some,Toei Animation,Unknown,"Action, Fantasy, Horror, Kids, Shounen, Supernatural",1 hr. 23 min.,G,"6.44, 260",873,1,Movie based on the 2007 TV anime with an original plot.
The Boy Who Carried a Guitar Kikaider vs. Inazuman,ギターを持った少年 -キカイダーVSイナズマン-,Special,1,Finished Airing,"Sep 18, 2003",,"Radix, Studio OX",add some,add some,Unknown,"Sci-Fi, Shounen",28 min.,PG-13,"6.44, 398",1062,1,The OVA Special which teams the Anime version of the legendary Henshin Hero Jiro/Jinzou Ningen Kikaider with another Toei Henshin Hero Inazuman.  
Ace Attorney,逆転裁判 ～その「真実」、異議あり！～,TV,24,Finished Airing,"Apr 2, 2016 to Sep 24, 2016",Saturdays at 17 30 (JST),"Aniplex, Yomiuri Telecasting, Capcom, Trinity Sound","Funimation, Crunchyroll",A-1 Pictures,Game,"Comedy, Drama, Mystery, Police",24 min. per ep.,PG-13,"6.44, 34680",102853,384,"Since he was a child, Ryuuichi Naruhodou's dream was to become a defense attorney, protecting the innocent when no one else would. However, when the rookie lawyer finally takes on his first case under the guidance of his mentor Chihiro Ayasato, he realizes that the courtroom is a battlefield. In these fast paced trials, Ryuuichi is forced to think outside the box to uncover the truth of the crimes that have taken place in order to prove the innocence of his clients.

Gyakuten Saiban: Sono ""Shinjitsu"", Igi Ari! follows Ryuuichi as he tackles cases to absolve the falsely accused of the charges they face. It will not be easy—standing in his path is the ruthless Reiji Mitsurugi, a prosecutor who will stop at nothing to hand out guilty verdicts. With his back against the wall, the defense attorney must carefully examine both evidence and witness testimony, sifting through lies to solve the mystery behind each case. With a shout of ""objection!,"" the battle in the courtroom begins!

[Written by MAL Rewrite]"
,はじまりの速度,Music,1,Finished Airing,"Jun 1, 2016",,Sony Music Entertainment,add some,add some,Music,Music,4 min.,PG-13,"6.44, 911",2756,4,"Music video for the song ""Hajimari no Sokudo"" by Sangatsu no Phantasia."
Domain of Murder,ハロー張りネズミ 殺意の領分,OVA,1,Finished Airing,"Sep 1, 1992",,"Sony Pictures Entertainment, animate Film","Central Park Media, NYAV Post",Studio Deen,Manga,"Drama, Mystery, Psychological, Seinen",51 min.,R+,"6.44, 972",2408,3,"One stormy night, a young woman is shot to death on a cliff; her body is found floating in the waters below the next morning. She was last seen with a man who is now being sought not only for her death. Meanwhile, an estranged wife hires Goro, a private investigator, to find her husband. Alongside another member of law enforcement with his own motives for finding the man, Goro sets forth on a trail of tragedy and intrigue to find the reason and connection behind the murders and missing husband.

(Source: Anime-Planet; edited)"
Scutes on my mind,かたすみの鱗,Movie,1,Finished Airing,2015,,Geidai Animation,add some,add some,Original,"Adventure, Drama, Fantasy",9 min.,G,"6.44, 191",432,2,The scutes glisten in the corner of her mind and she starts to dig her memories up. What was like the museum director she encountered when she was lost?
La corda d'oro Blue♪Sky,金色のコルダ Blue♪Sky,TV,12,Finished Airing,"Apr 6, 2014 to Jun 22, 2014",Unknown,Koei,add some,TYO Animations,Visual novel,"Harem, Music, School, Shoujo",23 min. per ep.,PG-13,"6.44, 8176",22638,40,"Soon after transferring to Seisou Gakuin, Kanade finds the orchestra club in the middle of preparing for the National concur. Teaming up with the other members, she will improve her skills, meet new rivals and create memories for what will become an unforgettable summer...

(Source: La Corda D'oro Wikia)"
,Newsong,Music,1,Finished Airing,"Jan 18, 2012",,SME Records,add some,add some,Music,"Sci-Fi, Music",3 min.,G,"6.44, 990",2353,10,Music video for the track Newsong by Japanese rock band tacica. The song was featured as the tenth opening for Naruto: Shippuuden.
,NEXT A-Class,ONA,1,Finished Airing,"Nov 17, 2012",,add some,add some,Production I.G,Original,"Action, Cars, Sci-Fi",6 min.,PG-13,"6.44, 3921",6910,4,"In the not so distant future, to cope with the traffic jams and verticalization due to the increased population, the city of Tokyo was reconstructed under the theme of city sharing in which people share the urbane space by transforming the roads and city structure by time of the day. A woman named Nico is walking in the city. She is having her long-awaited day off; however, she does not know what to do and who to hang out with. She hopes an exciting thing suddenly happens.

Then, a truck passes right before her eyes. The loud music and flashy decoration of the vehicle reminds Nico the car it that everyone's talking about on the internet. As soon as Nico sees it, she runs after it, then runs into Gatsu and Makito. Nico gets in their latest A-Class and they chase after the truck driving through the city that is changing its form rapidly.

(Source: AniDB) "
Prince Nezha's Triumph Against Dragon King,哪吒鬧海,Movie,1,Finished Airing,"May 19, 1979",,add some,add some,Shanghai Animation Film Studio,Novel,Kids,1 hr. 5 min.,G,"6.44, 243",620,1,"The film is an adaptation of a story in Chinese mythology (in particular, the epic fantasy novel Fengshen Bang) about the warrior deity Nezha. After a gestation period of 3.5 years, Lady Yin, the wife of General Li Jing, gives birth to a flesh ball, which becomes a lotus flower, from which Nezha is born. Nezha is born able to walk and talk, and is taken on as a student of the immortal Taiyi Zhenren.

The Dragon Kings of the Four Seas, tired of being peaceful, have become cruel and destructive, plaguing China with destructive storms and a drought. The people beg for rain, but the East Sea Dragon King Ao Guang ignores them, telling the yaksha Ye Sha to go and find children for him to eat. Ye Sha captures one of Nezha's friends as he is bathing by the ocean, and Nezha confronts him, injuring him badly. Ao Guang sends his third son, Ao Bing, next. Ao Bing is killed by Nezha, infuriating Ao Guang.

A variety of confrontations ensue between Nezha and Ao Guang. Ao Guang and the other Dragon Kings wreak havoc on the people, causing storms, floods and all manners of natural disasters. Seeing this, Nezha takes his father's sword, tells his parents that he is returning their flesh and bones to them, and calls out for his master before committing suicide by slitting his throat.

He is reborn with the help of his master, again from a lotus blossom, and is given new weapons and abilities. After breaking into Ao Guang's underwater palace, he confronts Ao Guang and the other Dragon Kings again, and is finally triumphant. 

(Source: Wikipedia)"
Japan Sinks 2020,日本沈没2020,ONA,10,Finished Airing,"Jul 9, 2020",,add some,add some,Science SARU,Novel,"Sci-Fi, Drama",25 min. per ep.,R,"6.44, 36530",72356,198,"The Mutou family leads a peaceful life: Kouichirou works at a construction site and his wife Mari is returning from an overseas trip. Their daughter Ayumu has just finished her track practice while their son Gou is playing video games at home. However, life as they know it is flipped upside down when a calamitous earthquake strikes the entire Japanese archipelago—obliterating the face of the country in an instant.

With society crumbling around them and their nation gradually sinking into the ocean, the Mutou family must band together to survive the catastrophe. Treading the near-apocalyptic setting, they struggle not only to stay alive, but also to learn the difficulty of coping with loss.

[Written by MAL Rewrite]"
,閑話休題すぺしゃる ～再び祭りの予感でワッショイ!～,Special,1,Finished Airing,"Jun 6, 2003",,"Rondo Robe, Pioneer LDC, Toshiba Entertainment",ADV Films,"Kyoto Animation, Tatsunoko Production",Original,"Comedy, Magic, Parody",27 min.,PG-13,"6.44, 2119",4505,1,"A TV special, known as episode 2.5, that takes place between episodes 2 and 3.

(Source: ANN)"
,わんおふ -one off-,OVA,4,Finished Airing,"Aug 5, 2012 to Oct 7, 2012",,"Dentsu, TYO",add some,TYO Animations,Original,Slice of Life,15 min. per ep.,PG-13,"6.44, 5021",13403,13,"A slice of life of high school girls in the early summer. Shiozaki Haruno is a 17-year-old girl who loves her motor cycle, HONDA's Giorno. She lives in remote highlands and longs for a vivid life in a city. 

Encounters with people staying at Haruno's parents' boardinghouse encourage her to step forward to her dream."
OreImo. Specials,俺の妹がこんなに可愛いわけがない。,ONA,3,Finished Airing,"Aug 18, 2013",,Aniplex,Aniplex of America,A-1 Pictures,Light novel,"Slice of Life, Comedy, Romance",24 min. per ep.,PG-13,"6.44, 74251",115275,164,Episodes 14–16 of OreImo 2 which finish adapting the OreImo novels.
Pokemon Pikachu's Winter Vacation (2000),ピカチュウのふゆやすみ2000,OVA,2,Finished Airing,"Dec 22, 1999",,add some,4Kids Entertainment,OLM,Game,"Adventure, Comedy, Fantasy, Kids",11 min. per ep.,PG,"6.44, 3382",7369,2,"Pikachu's Winter Vacations are three series of videos, each composed of several Pikachu shorts. All shorts deal with winter and Christmas. This is the second series and contains Winter Games & Stantler's Little Helpers."
Pikachu's Island Adventure,ピカチュウのわんぱくアイランド,Special,1,Finished Airing,"Aug 1, 2006",,add some,"Viz Media, The Pokemon Company International",OLM,Game,"Adventure, Comedy, Fantasy, Kids",21 min.,PG,"6.44, 3993",8527,8,"Pikachu and the other Pokémon were at the beach, when a weakened Wynaut approaches them. It tells them that its friends were attacked by Meowth and the other Team Rocket Pokémon, as well as an Exploud and a Hariyama, because Meowth wanted to take over their playground, which resides on a nearby island. After hearing Wynaut's story, Pikachu and the others decide to help them take back their playground, and begin to train them, so that they can rescue their island from the clutches of Meowth.

(Source: ANN)"
,リングにかけろ1 世界大会編,TV,6,Finished Airing,"Apr 10, 2011 to Jun 12, 2011",Unknown,add some,add some,Toei Animation,Manga,Sports,24 min. per ep.,PG-13,"6.44, 245",1048,14,"After defeating Black Shaft's makeshift Team USA and proving their worth to the Shadow Clan, Team Golden Japan Jr. will finally enter the World Jr. Boxing Tournament. In order to fulfill their goal of a perfect victory they'll have to take on teams from countries like Mexico, Italy, France, Germany, and the mysterious and godlike Team Greece.

(Source: ANN)"
,ROBOMASTERS THE ANIMATED SERIES,TV,6,Finished Airing,"Oct 13, 2017 to Nov 17, 2017",Fridays at 22 30 (JST),DJI,add some,"Gonzo, DandeLion Animation Studio",Original,"Action, Mecha, School",24 min. per ep.,PG-13,"6.44, 2152",11064,13,"The series will depict college students as they prepare and participate in a RoboMasters tournament.

(Source: ANN)"
,最近、妹のようすがちょっとおかしいんだが。 OVA,OVA,1,Finished Airing,"Jun 30, 2014",,add some,add some,Project No.9,Unknown,"Ecchi, Comedy, Romance, Supernatural, Shounen",23 min.,PG-13,"6.44, 12082",23848,7,"This OVA is divided into two parts. First one is about Torii Shoutarou following his younger sister on a date. Second one is about Christmas Eve, which Mitsuki, Yuuya and their friends spend at Kanzaki's house.

Bundled with the limited-edition volume 7 of the manga.

(Source: AniDB)"
Sakura Wars School of Paris,サクラ大戦 エコール・ド・巴里,OVA,3,Finished Airing,"Mar 19, 2003 to Aug 20, 2003",,"Radix, Sega, Imagine",Funimation,add some,Game,"Action, Adventure, Game, Harem, Mecha, Sci-Fi",25 min. per ep.,PG-13,"6.44, 1034",3204,2,"An unseen evil lurks in the streets of Paris. Unless something is done, the darkness will unleash its destruction and consume all that is good. The City of Love will be lost to her people forever. All hope rests within the hearts of five young ladies. The only problem is, they don't even know it yet. But will an apprenticed nun, a reserved aristocrat, a hardened criminal, a traveling circus emcee and a Japanese girl experiencing loss set aside their unique differences and come together as one for the defense of many. The Paris Fighting Troup is born. 

(Source: ANN)"
