name_english,name_japanese,show_type,episodes,status,aired,broadcast_time,producers,licensors,studios,source,genres,episode_length,rating,score_and_scorers,members,favorites,description
,シスター・プリンセス,TV,26,Finished Airing,"Apr 4, 2001 to Sep 26, 2001",Unknown,"Starchild Records, TV Tokyo Music, GANSIS","ADV Films, Discotek Media",Zexcs,Light novel,"Comedy, Drama, Harem, Romance, Slice of Life",23 min. per ep.,PG-13,"6.44, 6972",20448,75,"Wataru Minakami is a top student who failed his high school entrance exam because of a computer glitch. He later discovered that he was accepted to Stargazer Hill Academy, which is located at a mysterious place called Promised Island. At the request of his father, Wataru is whisked away to the island, and before he can settle in, a dozen of cute and charming girls start to flock him and claim to be his younger sisters. As Wataru gets closer to his newfound siblings, a deeper mystery as to why they were sent to the island comes to play. 

(Source: ANN)"
,鉄人２８号 白昼の残月,Movie,1,Finished Airing,"Mar 31, 2007",,add some,Discotek Media,Palm Studio,Unknown,"Action, Adventure, Mecha, Sci-Fi",1 hr. 35 min.,G,"6.44, 228",748,3,"This theatrical version based on the manga by Yokoyama Mitsuteru, deals with the genius boy detective Kaneda Shotaro and his giant robot, Tetsujin 28, set in Tokyo ten years after the end of the Second World War.

Shotaro's missing brother appears as a a new character who was trained as a pilot of the soldier robot Tetsujin which Japan had created for the Second World War. However, with the end of the war, there was nothing left for him but a peaceful Japan. In the meantime, ""Destruction Bombs"" are found in many places in Tokyo. The bombs were developed by Professor Kaneda, the creator of Tetsujin 28 and Shotaro's father, as the ultimate weapons to protect the mainland. If the bombs explode, Tokyo will be reduced to ashes."
,トゥハート ~remember my memories~,TV,13,Finished Airing,"Oct 2, 2004 to Dec 25, 2004",Unknown,Rondo Robe,add some,"OLM, AIC ASTA",Visual novel,"Drama, Harem, Romance, School, Sci-Fi, Slice of Life",24 min. per ep.,PG-13,"6.44, 2745",7618,5,"Time flies by; Hiroyuki and Akari are 12th-graders now. Both of them and their friends have grown up gradually in someway, physically or mentally, but one of their best friends is missing: the lifelike android Multi. To their surprise, Multi is brought to their campus again without notice, yet she is no longer the same Multi they have known. 

(Source: ANN)"
,UFOロボ グレンダイザー対グレートマジンガー,Movie,1,Finished Airing,"Mar 20, 1976",,Dynamic Planning,add some,add some,Unknown,"Mecha, Sci-Fi",24 min.,PG-13,"6.44, 738",1673,2,"Alien invaders take over Great Mazinger who is at the entrance of a museum next to Mazinger Z as symbols of peace. Grendizer fights the evil invaders and Great Mazinger is recovered. 

When the Vegan empire dispatches a new general to oversee the takeover of Earth, he quickly manages to capture Koji Kabuto and, learning of Great Mazinger through interrogation, quickly commandeers it from a museum where it was kept as a symbol of peace. 

It is now up to Duke Fleed aboard Grendizer to stop humanity's former defender from becoming its destroyer.

(Source: ANN) "
,ウサビッチ 労働の時間（裏）,Special,1,Finished Airing,"Oct 31, 2008",,add some,add some,Kanaban Graphics,Unknown,"Adventure, Comedy",1 min.,G,"6.44, 1002",1745,0,"Usavich (ウサビッチ) (from Japanese うさぎ ""usagi"", rabbit, with ""vich"" giving it faux Russian flavor) is a series of animated short films being produced for MTV Japan by Kanaban Graphics. It's about an odd couple of rabbits imprisoned in a Russian prison. While the first season (1-13 eps) shows the absurd everyday occurrences of the two rabbits' prison life, the second season (14-26 eps) tells the adventures of their escape and life on the run.

(Source: AnimeDB)"
Little Door Gods,小门神,Movie,1,Finished Airing,"Jan 1, 2016",,Light Chaser Animation Studios,add some,add some,Original,"Comedy, Fantasy",1 hr. 47 min.,PG,"6.44, 208",557,3,"There's a crisis in the Chinese Spirit World -- humans don't believe in gods anymore! A Door God, facing unemployment, ventures into the human world to prove his worth, leading to unexpected encounters and transformations for humans and spirits alike. 

(Source: IMDb)"
Wicked City,妖獣都市,Movie,1,Finished Airing,"Apr 25, 1987",,Japan Home Video,"Discotek Media, Urban Vision",Madhouse,Novel,"Action, Adventure, Demons, Drama, Horror, Super Power",1 hr. 22 min.,R+,"6.44, 12554",29382,126,"There is Earth, our familiar world, and then there is the Black World, a parallel dimension that very few people are aware of. For centuries, a pact between the two worlds has been observed to maintain peace, and terms must be negotiated and renewed soon to continue relative harmony.

This time around, there is a militant faction that will stop at nothing to prevent the signing of a new treaty for inter-dimensional peace. Two agents of the elite organization known as the Black guards—defenders of the balance between the two worlds—are charged with ensuring the success of the treaty.

Director Yoshiaki Kawajiri (Ninja Scroll) blends stylish eroticism, graphic horror and pulse-pounding action as these two race to consummate the peace treaty in time.

(Source: AniDB)"
,夢使い,TV,12,Finished Airing,"Apr 9, 2006 to Jun 25, 2006",Sundays at 02 30 (JST),"Pony Canyon, Happinet Pictures",add some,Madhouse,Manga,"Drama, Fantasy, Magic, Slice of Life",24 min. per ep.,PG,"6.44, 2047",7561,12,"When people dream, they express their utmost desires and emotions within the confines of their mind; but when their strong emotions cross the border into reality, the dream can turn into an uncontrollable nightmare. 

Touko and Rinko are sisters known as ""yume tsukai"" (dream users), and their job is to take care of these nightmares. Using toys as weapons, the girls must both destroy the nightmare and return the dream to its rightful owner before the nightmare does any sort of serious damage. 

Have no fear, Touko and Rinko are here!

(Source: Anime-Planet)"
Zoids Fuzors,ゾイド・フューザーズ,TV,26,Finished Airing,"Oct 3, 2004 to Apr 3, 2005",Unknown,Tokyo Kids,add some,add some,Unknown,"Adventure, Mecha, Sci-Fi, Shounen",25 min. per ep.,PG-13,"6.44, 4110",9598,17,"R.D. is a delivery boy who works for a company called Mach Storm in order to earn money to search for the legendary Alpha Zoid. A Zoid that he heard rumours about from his dad that he passionately believes in. Mach Storm also doubles as a Zoid Battling team. In R.D.'s first Coliseum Zoid Battle, he encounters a team that can fuse Zoids. R.D. soon discovers that he has a Zoid that can computably fuse with his Zoid, Liger Zero. After this happens R.D.'s adventure to discover the truth about the Alpha Zoid begins.

(Source: ANN)"
,逆转次元：AI崛起,ONA,12,Finished Airing,"Nov 5, 2019 to Jan 14, 2020",,add some,add some,add some,Manga,"Action, Game, Sci-Fi, Adventure, Martial Arts, Fantasy",16 min. per ep.,PG-13,"6.43, 113",340,1,"Shi Jiajie and Xiao Lei, who used the game as a livelihood, accidentally received the entry of the ""Epoch"" game. In order to win a huge prize in the game, Shi Jiajie decided to enter the game. As everyone knows, but it is involved in the inexplicable pursuit, but this is only the prelude to this layer of conspiracy…

(Source: Donghua Info)"
,忍者ハットリくん （2012年版）,TV,52,Finished Airing,"May 13, 2012 to Feb 16, 2015",Not scheduled once per week,TV Asahi,add some,Shin-Ei Animation,Manga,Comedy,24 min. per ep.,G,"6.43, 633",1296,1,Remake of the Ninja Hattori-kun series.
,俺たちに翼はない 肌色率九割増!?,OVA,1,Finished Airing,"Jun 24, 2011",,add some,Funimation,Nomad,Visual novel,"Drama, Ecchi, Fantasy, Harem, Romance",24 min.,R+,"6.43, 5052",11452,4,"An OVA bundled with the non-adult version of the OreTsuba PC game. The OVA has more fan service than the TV series (what they call, ""nakedness plus 90%"")."
,お父さんは愛の人,ONA,1,Finished Airing,"Jul 26, 2016",,add some,add some,add some,Original,"Drama, Slice of Life",3 min.,G,"6.43, 210",403,1,"A Tsutaetai, Kokoro no Tegami (wedding, elderly aid, and funeral company) commissioned work from Tekken showing the love of a father and the complications as he ages."
,Panty & Stocking in Sanitarybox,Special,1,Finished Airing,"Apr 28, 2011",,add some,Funimation,Gainax,Original,"Action, Comedy, Parody, Dementia, Supernatural, Ecchi",8 min.,R,"6.43, 16397",30682,47,A special short included with the 5th DVD/BD release.
